txt_pl_lem,date
""" Bóg pobłogosławić Noe i on syn , mówić do on : "" "" być płodny i mnożyć się , abyście zaludnić ziemia . wszelki zaś zwierzę na ziemia i wszelki ptactwo podniebny niechaj się wy bać i lękać . wszystko , co się poruszać na ziemia , i wszystek ryba morski zostać oddać wy w władanie . wszystko , co się poruszać i żyć , być przeznaczyć dla wy na pokarm , tak jak roślina zielony , dawać wy wszystko . nie wolno wy tylko jeść mięso z krew życie . upomnieć się o wasz krew przez wzgląd na wasz życie – upomnieć się o on u każdy zwierzę . upomnieć się też u człowiek o życie człowiek i u każdy – o życie brat . jeśli ktoś przelać krew ludzki , przez człowiek mieć być przelać krew on , bo człowiek zostać stworzyć na obraz Bóg . wy zaś być płodny i mnożyć się ; zaludniać ziemia i mieć nad on władza "" "" . potem Bóg tak rzec do Noe i do on syn : "" "" oto ja zawierać przymierze z wy i z wasz potomstwo , który po wy być ; z wszelki istota żywy , który być z wy : z ptactwo , z zwierzę domowy i polny , jaki być przy wy , z wszyscy , który wyjść z arka , z wszelki zwierzę na ziemia . zawierać z wy przymierze , tak iż nigdy już nie zostać zgładzić woda potop żaden istota żywy i już nigdy nie być potop niszczyć ziemia "" "" . po co Bóg dodać : "" "" a to być znak przymierze , który ja zawierać z wy i każdy istota żywy , jaki być z wy , na wieczny czas : łuk mój kłaść na obłok , aby być znak przymierzać między ja a ziemia "" "" . Bóg z wyżyny niebo spoglądać na ziemia poganin być się bać imię pan , a twój chwała wszystek król ziemia , bo Pan odbudować Syjon i ukazać się w swój majestacie.Pan przychylić się ku modlitwa opuścić i nie odrzucić on modły . należeć to zapisać dla przyszły pokolenie , lud , który się narodzić , niech wychwalać Pana.Spojrza ł pan z wysokość swój przybytek , popatrzyć z niebo na ziemia , aby usłyszeć jęk uwięziony , aby skazany na śmierć uwolnić . syn sługa twój bezpiecznie mieszkać być , a on potomstwo być trwać w twój obecność . aby imię pan głosić na Syjona i w Jeruzalem on chwała , kiedy zgromadzić się raz naród i królestwo , aby służyć pan . Jezus udać się z swój uczeń do wioska pod Cezareą Filipową . w droga pytać uczeń : "" "" za kto uważać ja człowiek ? "" "" on on odpowiedzieć : "" "" za Jan chrzciciel , inny za Eliasz , jeszcze inny za jeden z prorok "" "" . on on zapytać : "" "" a wy za kto ja uważać ? "" "" odpowiedzieć on Piotr : "" "" ty być Mesjasz "" "" . wtedy surowo on przykazać , żeby nikt o on nie mówić . i zacząć on pouczać , że syn człowieczy wiele musieć wycierpieć , że być odrzucić przez stary , arcykapłan i uczony w pismo ; że zostać zabić , ale po trzy dzień zmartwychwstać . a mówić zupełnie otwarcie ten słowo . wtedy Piotr wziąć on na bok i zacząć on upominać . lecz on obrócić się i patrzeć na swój uczeń , zgromić Piotr słowo : "" "" zejść ja z oko , szatani , bo nie myśleć po boży , lecz po ludzki "" "" . "" ",2019-02-21
""" Saul wyruszyć ku pustynia Zif , a wraz z on trzy tysiąc doborowy izraelita , aby wpaść na trop Dawid na pustynia Zif . Dawid wraz z Abiszajem zakraść się w noc do obóz ; Saul właśnie spać w środek obozowisko , a on dzida być wbić w ziemia obok głowa . Abner i człowiek leżeć uśpić dokoła on . rzec więc Abiszaj do Dawid : "" "" dziś Bóg oddawać wróg twój w twój ręka . teraz pozwolić , że przybić on dzida do ziemia , jeden pchnięcie , drugi nie być trzeba "" "" . Dawid odeprzeć Abiszajowi : "" "" nie zabijać on ! któż bowiem podnieść by ręka na pomazaniec pański , a nie ponieść kara ? "" "" wziąć więc Dawid dzida i bukłak na woda od wezgłowie Saul i pójść siebie . nikt on nie spostrzec , nikt o on nie wiedzieć , nikt się nie obudzić . wszyscy spać , gdyż pan zesłać na on twardy sen . Dawid oddalić się na przeciwległy strona i stanąć na wierzchołek góra w oddal , a dzielić on od on spory odległość . wtedy Dawid zawołać do Saul : "" "" oto dzida królewski , niech przyjść który z pachołek i wziąć on . pan nagradzać człowiek za sprawiedliwość i wierność : pan dać ja ty w ręka , lecz ja nie podnieść być on przeciw pomazaniec Pański "" "" . pan być łaskawy , pełny miłosierdzie błogosławić , dusza mój , pan , i wszystko , co być w ja , święty imię on . błogosławić , dusza mój , pan i nie zapominać o wszystek on dobrodziejstwach.On odpuszczać wszystek twój wina i leczyć wszystek choroba . on twój życie ratować od zguba , obdarzać ty łaska i zmiłowanie . miłosierny być pan i łaskawy , nieskory do gniew i bardzo cierpliwy . nie postępować z my według nasz grzech ani według wina nasz my nie odpłacać . jak odległy być wschód od zachód , tak daleko odsuwać od my nasz wina . jak ojciec litować się nad dziecko , tak pan się litować nad ten , który cześć on oddawać . Jezus powiedzieć do swój uczeń : "" "" powiadać wy , który słuchać : miłować wasz nieprzyjaciel ; dobrze czynić ten , który wy nienawidzić ; błogosławić ten , który wy przeklinać , i modlić się za ten , który wy oczerniać . jeśli ty kto uderzyć w policzek , nadstawić on i drugi . jeśli zabierać ty płaszcz , nie bronić on i szata . dawać każdy , kto ty prosić , a nie dopominać się zwrot od to , który brać twój . jak chcieć , żeby człowiek wy czynić , podobnie wy on czynić . jeśli bowiem miłować ten tylko , który wy miłować , jakiż za to należeć się wy wdzięczność ? przecież i grzesznik okazywać miłość ten , który on miłować . i jeśli dobrze czynić to tylko , który wy dobrze czynić , jaki za to należeć się wy wdzięczność ? i grzesznik to sam czynić . jeśli pożyczka udzielać ten , od który spodziewać się zwrot , jakiż za to należeć się wy wdzięczność ? i grzesznik pożyczać grzesznik , żeby tyleż sam otrzymać . wy natomiast miłować wasz nieprzyjaciel , czynić dobrze i pożyczać , nic się za to nie spodziewać . a wasz nagroda być wielki i być syn wysoki ; ponieważ on być dobry dla niewdzięczny i zły . być miłosierny , jak ojciec wasz być miłosierny . nie sądzić , a nie być sądzić ; nie potępiać , a nie być potępić ; odpuszczać , a być wy odpuścić . dawać , a być wy dana ; miara dobry , ubić , utrząść i wypełnić ponad brzeg wsypać w zanadrze wasz . odmierzyć wy bowiem taki miara , jaki wy mierzyć "" "" . "" ",2019-02-24
""" cały mądrość od pan pochodzić i z on być na wiek . piasek morski , kropla deszcz i dzień wieczność któż móc policzyć ? wysokość niebo , szerokość Ziemia , przepaść i mądrość któż potrafić zbadać ? jako pierwszy przed wszystko stworzyć zostać mądrość , a rozum roztropny być od wiek . korzeń mądrość któż zostać objawić , a dzieło on wszechstronny umiejętność któż poznać ? być jeden mądry , co bardzo lęk przejmować , zasiadać na swój tron . to pan on stworzyć , przejrzeć , policzyć i wylać on na wszystek swój dzieło , na wszystek stworzenie jako swój dar , a ten , co on miłować , hojnie w on wyposażyć . pan Bóg królować , pełny majestat pan królować , oblec się w majestat , pan wdziać potęga i on się przepasać . tak świat utwierdzić , że się nie zachwieje.Tw ój tron niewzruszony na wiek , istnieć od wiek , Bóg . świadectwo twój bardzo godny być wiara ; twój dom świętość przystać po wszystek dzień , o Pan . gdy Jezus z Piotr , Jakub i Jan zstąpić z góra i przyjść do uczeń , ujrzeć wielki tłum wokół on i uczony w pismo , który rozprawiać z on . skoro on zobaczyć , zaraz podziw ogarnąć cały tłum i przybiegać , witać on . on on zapytać : "" "" o co rozprawiać z on ? "" "" jeden z tłum odpowiedzieć on : "" "" nauczyciel , przyprowadzić być do ty mój syn , który mieć duch niemy . ten , gdziekolwiek on pochwycić , rzucać on , a on wtedy się pienić , zgrzytać ząb i drętwieć . powiedzieć być twój uczeń , żeby on wyrzucić , ale nie móc "" "" . odpowiadać on , Jezus rzec : "" "" o plemię niewierny , jak długo mieć być z wy ? jak długo mieć wy znosić ? przyprowadzić on do ja ! "" "" i przywieść on do on . na widok Jezus duch zaraz począć miotać chłopiec , tak że upaść na ziemia i tarzać się z piana na usta . Jezus zapytać ojciec : "" "" od jak dawno to on się zdarzać ? "" "" ten zaś odrzec : "" "" od dzieciństwo . i często wrzucać on nawet w ogień i w woda , żeby on zgubić . lecz jeśli coś móc , zlitować się nad my i pomóc my "" "" . Jezus on odrzec : "" "" jeśli móc ? wszystko możliwy być dla to , kto wierzyć "" "" . zaraz ojciec chłopiec zawołać : "" "" wierzyć , zaradzić mój niedowiarstwo ! "" "" a Jezus , widzieć , że tłum się zbiegać , rozkazać surowo duch nieczysty : "" "" Duch niemy i głuchy , rozkazywać ty , wyjść z on i dużo w on nie wchodzić ! "" "" a ten krzyknąć i wyjść , silnie on miotać . chłopiec zaś pozostawać jak martwy , tak że wiele mówić : "" "" on umrzeć "" "" . lecz Jezus ująć on za ręka i podnieść , a on wstać . a gdy przyjść do dom , uczeń pytać on na osobność : "" "" dlaczego my nie móc być on wyrzucić ? "" "" powiedzieć on : "" "" ten rodzaj można wyrzucić tylko modlitwa i post "" "" . "" ",2019-02-25
""" dziecko , jeśli mieć zamiar służyć pan , przygotować swój dusza na doświadczenie ! zachować spokój serce i być cierpliwy , a nie tracić równowaga w czas utrapienie ! przylgnąć do on i nie odstępować , abyś być wywyższyć w twój dzień ostatni . przyjąć wszystko , co przyjść na ty , a w zmienny los poniżenie bądź wytrzymały ! bo w ogień próbować się złoto , a człowiek miły Bóg – w piec poniżenie . być on wierny , a on zająć się ty , prostować swój droga i on zaufać ! który bać się pan , oczekiwać on zmiłowanie , nie zbaczać z droga , abyście nie upaść . który bać się pan , zawierzyć on , a nie przepaść wasz zapłata . który bać się pan , spodziewać się dobro , wieczny wesele i zmiłowanie ! popatrzeć na dawny pokolenie i zobaczyć : kto zaufać pan , a zostać zawstydzić ? albo kto trwać w bojaźń pański , a zostać opuścić ? albo kto wzywać on , a on on wzgardzić ? dlatego że pan być litościwy i miłosierny , odpuszczać grzech i wybawiać w czas ucisk . zaufać pan , on sam być działać mieć ufność w pan i czynić to , co dobry , a być mieszkać na ziemia i żyć bezpiecznie . Raduj się w pan , a on spełnić pragnienie twój serca.Pan znać dzień postępować uczciwie , a on dziedzictwo trwać być na wiek . w czas klęska nie zaznawać wstyd , w dzień głód zostać nasyceni.Odst ąp od zły i czynić dobro , abyś móc przetrwać na wiek . gdyż pan sprawiedliwość miłować i nie opuszczać swój święty . zbawienie sprawiedliwy pochodzić od pan , on on ucieczka w czas utrapienie . pan on wspomagać i wyzwalać , wyzwalać od występny i zachowywać , on bowiem być on ucieczka . Jezus i on uczeń przemierzać Galilea , on jednak nie chcieć , żeby ktoś o to wiedzieć . pouczać bowiem swój uczeń i mówić on : "" "" syn człowieczy być wydać w ręka człowiek . ten on zabić , lecz zabity , po trzy dzień zmartwychwstanie "" "" . on jednak nie rozumieć ten słowo , a bać się on pytać . tak przyjść do Kafarnaum . gdy być już w dom , zapytać on : "" "" o co to rozprawialiście w droga ? "" "" lecz on milczeć , w droga bowiem posprzeczać się między siebie o to , kto z on być duży . on usiąść , przywołać dwanaście i rzec do on : "" "" jeśli ktoś chcieć być pierwszy , niech być ostatni z wszyscy i sługa wszyscy "" "" . potem wziąć dziecko , postawić on przed on i objąć on ramię , rzec do on : "" "" kto jeden z ten dziecko przyjmować w imię mój , ja przyjmować ; a kto ja przyjmować , nie przyjmować ja , lecz to , który ja posłać "" "" . "" ",2019-02-26
""" mądrość wywyższać swój syn i mieć piecza nad ten , który on szukać . kto on miłować , ten miłować życie , a ten , który dla on rano wstać , napełnić się wesele . kto on posiąść , odziedziczyć chwała , a gdzie on wejść , tam pan błogosławić . który on służyć , oddawać cześć Święty , a miłować on pan być miłować . kto on słuchać , sądzić być naród , a kto do on się przykładać , być trwać bezpiecznie . kto on zaufać , ten on odziedziczyć i posiadać on być on potomek . z początek powieść on trudny droga , bojaźń i strach on przejąć , zadać on ból swój nauka , aż nabrać zaufanie do on dusza i wypróbować on przez swój nakaz . następnie powrócić do on po droga gładki i rozradować on , i odkryć on swój tajemnica . a jeśliby zejść na bezdroże , opuścić on i wydać on potężny klęska . obfity pokój miłować prawo obfity pokój dla miłować twój prawo , i nigdy się nie potknąć . przestrzegać twój postanowienie i napomnienie , bo wszystek mój droga być przed ty . niech mój warga rozbrzmiewać hymn , bo ja nauczać twój ustawa . niech mój język opiewać twój słowo , bo wszystek twój przykazanie być sprawiedliwe.Pragn ę twój pomoc , pan , a prawo twój być mój rozkosz . niech żyć mój dusza i niech ty chwalić , niech ja wspierać twój wyrok . apostoł Jan rzec do Jezus : "" "" nauczyciel , widzieć być ktoś , kto nie chodzić z my , jak w twój imię wyrzucać zły duch , i zacząć być on zabraniać , bo nie chodzić z my "" "" . lecz Jezus odrzec : "" "" przestać zabraniać on , bo nikt , kto uczynić cud w imię mój , nie być móc zaraz źle mówić o ja . kto bowiem nie być przeciwko my , ten być z my "" "" . "" ",2019-02-27
""" nie polegać na swój bogactwo i nie mówić : "" "" on ja wystarczyć "" "" . nie dać się uwieść żądza i siła , by iść za zachcianka swój serce . nie mówić : "" "" któż mieć nad ja panować ? "" "" albowiem pan z cały pewność wymierzyć ty sprawiedliwość . nie mówić : "" "" zgrzeszyć być i cóż ja się stać ? "" "" albowiem pan być cierpliwy . nie być bez obawa co do przebaczenie , byś mieć dodawać grzech do grzech . nie mówić : "" "" Wielki być on miłosierdzie , zgładzić mnóstwo mój grzech ! "" "" u on bowiem być miłosierdzie , ale i gniew , a na grzesznik spaść on zapalczywość . nie odwlekać nawrócić do pan ani nie odkładać z dzień na dzień ; nagle bowiem gniew on przyjść i zginąć w czas odpłata . nie polegać na bogactwo niesprawiedliwie nabyć , nic ty bowiem nie pomóc w dzień klęska . szczęśliwy człowiek , który ufać pan szczęśliwy człowiek , który nie iść za rada występny , nie wchodzić na droga grzesznik i nie zasiadać w grono szyderca , lecz w prawo pański upodobać siebie i rozmyślać nad on dzień i noc . on być jak drzewo zasadzić nad płynąć woda , który wydawać owoc w swój czas . liść on nie więdnąć , a wszystko , co czynić , być udane.Co inny grzesznik : być jak plewa , który wiatr rozmiatać . albowiem droga sprawiedliwy być pan znany , a drogi występny zaginąć . Jezus powiedzieć do swój uczeń : "" "" kto wy podać kubek woda do pić , dlatego że należycie do Chrystus , zaprawdę , powiadać wy , nie utracić swój nagroda . a kto by się stać powód grzech dla jeden z ten mały , który wierzyć , to dobrze być by kamień młyński uwiązać u szyja i wrzucić on w mora . jeśli zatem twój ręka być dla ty powód grzech , odciąć on ; dobrze być dla ty ułomny wejść do życie wieczny , niż z dwa ręka pójść do piekło w ogień nieugaszony . i jeśli twój noga być dla ty powód grzech , odciąć on ; dobrze być dla ty chromy wejść do życie , niż z dwa noga być wrzucić do piekło . jeśli twój oko być dla ty powód grzech , wyłupać on ; dobrze być dla ty jednooki wejść do królestwo boży , niż z dwa oko być wrzucić do piekło , gdzie robak on nie ginąć i ogień nie gasnąć . bo każdy ogień być posolić . dobry być sól ; lecz jeśli sól smak swój utracić , coże on przyprawić ? mieć sól w siebie i zachowywać pokój między siebie "" "" . "" ",2019-02-28
""" gdy sito się przesiewać , zostawać odpadek , podobnie błąd człowiek przy on ocena . piec poddawać próba naczynie garncarz , a sprawdzian człowiek być on wypowiedź . jak o uprawa drzewo świadczyć on owoc , tak mowa o zamysł serce człowiek . nie chwalić mąż przed wypowiedź , to bowiem być próba dla człowiek . dobrze być śpiewać ty , pan Bóg dobrze być dziękować pan , śpiewać twój imię , wysoki , rano głosić twój łaskawość , a wierność twój nocami.Sprawiedliwy zakwitnąć jak palma , rozrosnąć się jak cedr na Liban . zasadzić w dom pański rozkwitnąć na dziedziniec nasz Boga.Nawet i w starość wydać owoc , zawsze pełnić życiodajny sok , aby świadczyć , że pan być sprawiedliwy , on mój opoka i nie mieć w on nieprawość . Jezus opowiedzieć uczeń przypowieść : "" "" czy móc niewidomy prowadzić niewidomy ? czy nie wpaść w dół obydwa ? uczeń nie przewyższać nauczyciel . lecz każdy , dopiero w pełnia wykształcony , być jak on nauczyciel . czemu to widzieć drzazga w oko swój brat , a nie dostrzegać belka w własny oko ? jak móc mówić swój brat : „ brat , pozwolić , że usunąć drzazga , który być w twój oko ” , podczas gdy sam belka w swój oko nie widzieć ? obłudnik , usunąć najpierw belka z swój oko , a wtedy przejrzeć , ażeby usunąć drzazga z oko brat swój . nie mieć drzewo dobry , który by wydawać zły owoc , ani też drzewo zły , który by dobry owoc wydawać . po własny owoc bowiem poznawać się każdy drzewo ; nie zrywać się figa z cierń , ani z krzak jeżyna nie zbierać się winogrono . dobry człowiek z dobry skarbiec swój serce wydobywać dobro , a zły człowiek z zły skarbiec wydobywać zło . bo z obfitość serce mówić on usta "" "" . "" ",2019-03-03
""" być jeszcze młode , zanim zacząć być podróżować , szukać być jawnie mądrość w modlitwa . u brama świątynia prosić być o on i aż do koniec szukać on być . z powód on kwiat , jakby dojrzewać winogrono , serce mój się w on rozradować , noga mój wstąpić na prosty droga , od młodość mój iść on ślad . nakłonić być tylko trochę ucho mój , a już on otrzymać być i znaleźć być dla siebie rozległy wiedza . postąpić być w on , a ten , który dać ja mądrość , chcieć oddać cześć . postanowić być bowiem wprowadzić on w czyn , zapłonąłem gorliwość o dobro i nie doznać być wstyd . dusza mój walczyć o on i z cały staranność usiłować być zachować prawo . ręka wyciągać być w góra , a błąd przeciwko on opłakiwać być . skierować być ku on mój dusza i znaleźć być on dzięki czystość . z on od początek zyskać być rozum , dlatego nie być opuścić . pan mój dziedzictwo , mój przeznaczenie zachować ja , Bóg , bo chronić się do ty , mówić do pan : „ Tyś być pan mój ” . pan mój dziedzictwo i przeznaczenie , to on mój los zabezpieczać . błogosławić pan , który dać ja rozsądek , bo serce napominać ja nawet noc . zawsze stawiać siebie pan przed oko , on być po mój prawica , nic ja nie zachwieje.Ty ścieżka życie ja ukazać , pełnić twój radość i wieczny rozkosz po twój prawica . Jezus powiedzieć do swój uczeń : "" "" jak ja umiłować ojciec , tak i ja wy umiłować być . wytrwać w miłość mój ! jeśli być zachowywać mój przykazanie , być trwać w miłość mój , tak jak ja zachować być przykazanie ojciec mój i trwać w on miłość . to wy powiedzieć być , aby radość mój w wy być i aby radość wasz być pełny . to być mój przykazanie , abyście się wzajemnie miłować , tak jak ja wy umiłować być . nikt nie mieć duży miłość od ten , gdy ktoś życie swój oddawać za przyjaciel swój . wy być przyjaciel mój , jeżeli czynić to , co wy przykazywać . już wy nie nazywać sługa , bo sługa nie wiedzieć , co czynić pan on , ale nazwać być wy przyjaciel , albowiem oznajmić być wy wszystko , co usłyszeć być od ojciec mój . nie wyście ja wybrać , ale ja wy wybrać być i przeznaczyć być wy na to , abyście iść i owoc przynosić i by owoc wasz trwać , aby wszystko dać wy ojciec , o cokolwiek on prosić w imię mój . to wy przykazywać , abyście się wzajemnie miłować "" "" . "" ",2019-03-04
""" kto zachowywać prawo , mnożyć ofiara , a kto zważać na przykazanie , składać ofiara biesiadny . kto świadczyć dobrodziejstwo , jakby przynosić ofiara z przedni mąka , a kto dawać jałmużna , jakby składać ofiara uwielbienie . odejść od zło być miły pan , a odejść od niesprawiedliwość być jak ofiara przebłagalny . nie pokazywać się przed pan z próżny ręka , wszystko ten bowiem czynić się według przykazanie . dar ofiarny sprawiedliwy namaszczać ołtarz tłustość , a przyjemny on zapach unosić się przed wysoki . ofiara mąż sprawiedliwy być miły , a pamiątka z on nie pójść w zapomnienie . Chwal Pan hojny dar i nie umniejszać pierwocina ręka twój ! przy każdy dar twarz rozpogodzić i z wesele poświęcić dziesięcina ! dawać wysoki tak , jak on ty dawać , hojnie , na miara swój możliwość , ponieważ pan być to , który odpłacać i siedem raz więcej oddać ty . nie starać się przekupić on dar , bo nie być przyjąć , ani nie pokładać nadzieja w ofiara niesprawiedliwy , ponieważ pan być sędzia , który nie mieć wzgląd na osoba . ten , kto prawy , ukazać zbawienie "" "" zgromadzić ja mój umiłowany , który przez ofiara zawrzeć z ja przymierze "" "" . niebiosa zwiastować boży sprawiedliwość , albowiem sam Bóg być sędzia . "" "" posłuchać , mój lud , gdyż być przemawiać i być świadczyć przeciw ty , Izrael : ja być Bóg , twój Bóg . nie oskarżać ty za twój ofiara , bo twój całopalenie zawsze być przed ja "" "" "" "" składać Bóg dziękczynny ofiara , spełnić swój ślub wobec wysoki . kto składać dziękczynny ofiara , ten cześć ja oddawać , a ten , który postępować uczciwie , ukazać Boży zbawienie "" "" . Piotr powiedzieć do Jezus : "" "" oto my opuścić być wszystko i pójść być za ty "" "" . Jezus odpowiedzieć : "" "" zaprawdę , powiadać wy : nikt nie opuszczać dom , brat , siostra , matka , ojciec , dziecko lub pole z powód ja i z powód ewangelia , żeby nie otrzymać stokroć więcej teraz , w ten czas , dom , brat , siostra , matka , dziecko i pole , wśród prześladowanie , a życie wieczny w czas przyszły . lecz wiele pierwszy być ostatni , a ostatni pierwszy "" "" . "" ",2019-03-05
""" Mojżesz powiedzieć do lud : "" "" patrzeć ! kłaść dziś przed ty życie i szczęście , śmierć i nieszczęście . ja dziś nakazywać ty miłować pan , Bóg twój , i chodzić on droga , zachowywać on polecenie , prawo i nakaz , abyś żyć i mnożyć się , a pan , Bóg twój , być ten błogosławić w kraj , który iść posiąść . ale jeśli swój serce odwrócić , nie usłuchać , zbłądzić i być oddawać pokłon cudzy bóg , służyć on – oświadczać wy dzisiaj , że na pewno zginąć , niedługo zabawić na ziemia , który iść posiąść , po przejść Jordan . brać dziś przeciwko wy na świadek niebo i ziemia , kłaść przed wy życie i śmierć , błogosławieństwo i przekleństwo . wybierać więc życie , abyście żyć wy i wasz potomstwo , miłować Pan , Bóg swój , słuchać on głos , lgnąć do on ; bo tu być twój życie i długi trwać twój pobyt na ziemia , który pan poprzysięgnąć dać przodek twój : abrahamowy , Izaak i Jakub "" "" . szczęśliwy człowiek , który ufać pan szczęśliwy człowiek , który nie iść za rada występny , nie wchodzić na droga grzesznik i nie zasiadać w grono szyderca , lecz w prawo pański upodobać siebie i rozmyślać nad on dzień i noc . on być jak drzewo zasadzić nad płynąć woda , który wydawać owoc w swój czas . liść on nie więdnąć , a wszystko , co czynić , być udane.Co inny grzesznik : być jak plewa , który wiatr rozmiatać . albowiem droga sprawiedliwy być pan znany , a drogi występny zaginąć . Jezus powiedzieć do swój uczeń : "" "" syn człowieczy musieć wiele wycierpieć : być odrzucić przez starszyzna , arcykapłan i uczony w pismo ; zostać zabić , a trzeci dzień zmartwychwstanie "" "" . potem mówić do wszyscy : "" "" jeśli ktoś chcieć iść za ja , niech się zaprzeć sam siebie , niech co dzień brać krzyż swój i niech ja naśladować . bo kto chcieć zachować swój życie , stracić on , a kto stracić swój życie z mój powód , ten on zachować . bo cóż za korzyść dla człowiek , jeśli cały świat zyskać , a siebie zatracić lub szkoda ponieść ? "" "" "" ",2019-03-07
