title,pl,en
Abba Ojcze,"Ty wyzwoliłeś nas Panie  z kajdan i samych siebie,  a Chrystus stając się bratem  nauczył nas wołać do Ciebie:  Abba Ojcze! Abba Ojcze! Abba Ojcze!  Bo Kościół jak drzewo życia w wieczności zapuszcza korzenie, przenika naszą codzienność i pokazuje nam Ciebie. Abba Ojcze! Abba Ojcze! Abba Ojcze!  Bóg hojnym Dawcą jest życia, on wyswobodził nas z śmierci i przygarniając do siebie uczynił swoimi dziećmi. Abba Ojcze! Abba Ojcze! Abba Ojcze!  Wszyscy jesteśmy braćmi, jesteśmy jedną rodziną. Tej prawdy nic już nie zaćmi i teraz jest jej godzina. Abba Ojcze! Abba Ojcze! Abba Ojcze! ","You delivered us from chains and ourselves, and Christ, by becoming a brother, taught us to call to You: Abba, Father! Abba, Father! Abba, Father! For the Church, like the tree of life in eternity, roots, penetrates our everyday life and shows us to You. Abba, Father! Abba, Father! Abba, Father! God is a generous Giver of life, he has freed us from death and made us children by taking in each other. Abba, Father! Abba, Father! Abba, Father! We are all brothers, we are one family. There is nothing darkening this truth and now is her hour. Abba, Father! Abba, Father! Abba, Father!"
Alleluja (Niech zabrzmi Panu)," Alleluja, Alleluja, Alleluja, Alleluja.   Niech zabrzmi Panu  chwała w niebiosach,  na wysokościach cześć niech oddadzą,  wielbijcie Pana duchy niebieskie,  wielbijcie Pana Jego zastępy.  Alleluja, Alleluja, Alleluja, Alleluja.   Słońce, Księżycu wielbijcie Pana, gwiazdy świecące wielbijcie Pana, niebiosa niebios wielbijcie Pana, wody podniebne wielbijcie Pana.  Alleluja, Alleluja, Alleluja, Alleluja.   Niech wszyscy wielbią Imię Pana, bo Jego słowo stwarza wciąż wszystko, bo tylko Jego Imię jest wzniosłe, niechaj na wieku brzmi Jego chwała.  Alleluja, Alleluja, Alleluja, Alleluja.   On daje siłę swemu ludowi, z prochu podnosi swoich przyjaciół, jego Bogiem bliskim dla Izraela, swoich wybranych On sam umacnia.  Alleluja, Alleluja, Alleluja, Alleluja.   Niech zabrzmi chwała Ojcu,  co stwarza, Jego synowi, który jest Panem, Duchowi, który w nas zamieszkuje przez wszystkie wieki wieków. Amen. ","Alleluia, Alleluia, Alleluia, Alleluia. Let the glory of the heavens be heard in the heavens, let the worship be in heaven, worship the Lord the heavenly spirits, worship the Lord His hosts. Alleluia, Alleluia, Alleluia, Alleluia. Sun, moon, worship the Lord, shining stars, praise the Lord, the heavens of heaven, worship the Lord, so that you should exalt the Lord. Alleluia, Alleluia, Alleluia, Alleluia. Let all praise the name of the Lord, for his word still creates everything, for only his name is sublime, let his glory be at the age. Alleluia, Alleluia, Alleluia, Alleluia. He gives strength to his people, he raises his friends from dust, his God close to Israel, his chosen ones, he strengthens himself. Alleluia, Alleluia, Alleluia, Alleluia. Let the glory be to the Father, which he creates, to his son, who is the Lord, the Spirit who dwells in us through all ages. Amen."
"Alleluja, Alleluja, Amen Amen, Alleluja"," Alleluja, Alleluja,  Amen, Amen, Alleluja.   Pokłońmy się przed Nim –  On naszym Panem jest  Pokłońmy się przed Nim –  On naszym Panem Amen, Amen, Alleluja.  Alleluja, Alleluja,  Amen, Amen, Alleluja.   Jezus Chrystus zmartwychwstał –  On naszym Panem jest  Jezus Chrystus zmartwychwstał –  On naszym Panem Amen, Amen, Alleluja.  Alleluja, Alleluja,  Amen, Amen, Alleluja.   Radujmy się bracia –  On naszym Panem jest  Radujmy się wszyscy –  On naszym Panem. Amen, Amen, Alleluja.  Alleluja, Alleluja,  Amen, Amen, Alleluja.   Posyła nam Ducha –  On naszym Panem jest  Posyła nam Ducha –  On naszym Panem. Amen, Amen, Alleluja. ","Alleluia, Alleluia, Amen, Amen, Alleluia. Let us bow before Him - He is our Lord, let us bow before Him - He is our Lord Amen, Amen, Alleluia. Alleluia, Alleluia, Amen, Amen, Alleluia. Jesus Christ is resurrected - He is our Lord Jesus Christ is resurrected - He is our Lord Amen, Amen, Alleluia. Alleluia, Alleluia, Amen, Amen, Alleluia. Rejoice, brothers - He is our Lord, let us all rejoice - He is our Lord. Amen, Amen, Alleluia. Alleluia, Alleluia, Amen, Amen, Alleluia. He sends us the Spirit - He is our Lord, He sends us the Spirit - He is our Lord. Amen, Amen, Alleluia."
"Blisko, blisko, blisko jesteś"," Blisko, blisko, blisko Jesteś Panie mój Blisko tak, że czuję tchnienie Twe  I przychodzisz do mnie Już dotykasz mnie Łaską przebaczenia Karmisz moją duszę ","Close, close, close You are my Lord, Close to me, that I feel my breath and come to me You touch me with Grace of forgiveness You feed my soul"
Bo góry mogą ustąpić," Bo góry mogą ustąpić i pagórki się zachwiać.  Ale miłość Moja, miłość Moja nigdy nie odstąpi od Ciebie mówi Pan. ","Because the mountains can give way and the hills get swayed. But my love, my love will never depart from you, says the Lord."
Bo jak śmierć potężna jest miłość," Bo jak śmierć potężna jest Miłość A zazdrość jej nieprzejednana jak szeol. Żar jej to żar ognia Płomień Pański Wody wielkie nie zdołają ugasić miłości  Nie zatopią, nie zatopią jej rzeki. ","For how death is powerful Love and jealousy are as intransigent as sheol. Its heat is the heat of fire. The flame of the Lord. The great waters can not quench love. They will not sink, they will not sink the river."
Boże Twa łaska," Boże Twa łaska nad nami jest, Twoja miłość przychodzi wciąż, działasz mocy pośród nas, przenikasz serca gładzisz grzech.  My chcemy więcej Ciebie  więcej łaski Twej,  pragniemy więcej mocy,  więcej miłości Twojej. ","God, your grace is over us, your love is coming, you are working power among us, you are penetrating your hearts, you are stroking sin. We want more Your grace more, we want more power, more Your love."
Była cicha i piękna jak wiosna," Była cicha i piękna jak wiosna, Żyła prosto, zwyczajnie jak my. Ona Boga na świat nam przyniosła  I na ziemi wśród łez nowe dni zajaśniały.    Matka, która wszystko rozumie, Sercem ogarnia każdego z nas. Matka zobaczyć dobro w nas umie, Ona jest z nami w każdy czas.  Dzisiaj światu potrzeba dobroci, By niepokój zwyciężyć i zło. Trzeba ciepła, co życie ozłoci, Trzeba Boga, więc ludziom,  Nieśmy Go, tak jak Ona.   Matka, która wszystko rozumie, Sercem ogarnia każdego z nas. Matka zobaczyć dobro w nas umie, Ona jest z nami w każdy czas. ","She was as quiet and beautiful as spring, she lived simply, just like us. She brought God to the world, and in the world new days were shining with tears. The mother who understands everything is overwhelmed by each one of us. Mother can see good in us, she is with us at all times. Today, the world needs goodness, To anxiety to overcome and evil. You need warmth, what life will goldeniate, You need God, so people, let us not Him, just like Her. The mother who understands everything is overwhelmed by each one of us. Mother can see good in us, she is with us at all times."
Bóg nasz Pan," Bóg nasz Pan jest dobry cały czas.  Więc uwielbij Go, więc uwielbij Go. ","God our Lord is good all the time. So, worship Him, so worship Him."
Bóg tak umiłował świat," Bóg tak umiłował świat, że Syna swego Jednorodzonego dał, aby każdy kto w Niego wierzy nie zginął, ale życie wieczne miał.  O Jezus, Jezus, Jezus! ","God loved the world so much that he gave his only Son, that whoever believes in him would not perish but have eternal life. For Jesus, Jesus, Jesus!"
Będziemy tańczyć," Będziemy tańczyć,  będziemy śpiewać,  będziemy klaskać w dłonie swe, Kiedy nasz Pan  stanie z nami twarzą w twarz, spotkamy się w Nowym Jeruzalem. Ref: Będziemy tańczyć,  będziemy śpiewać, będziemy klaskać w dłonie swe, Kiedy nasz Pan  w białych szatach stawi nas przed Ojcem Swym, przed Adonai.  Nadejdzie dzień, w którym wszystko spełni się  co dawno już objawił Bóg,  więc mocno trwaj, nigdy nie poddawaj się, nie poddawaj się. ","We will dance, we will sing, we will clap our hands, When our Lord will come face to face with us, we will meet in the New Jerusalem. Ref: We will dance, we will sing, we will clap our hands, When our Lord in white robes puts us in front of His Father, in front of Adonai. There will come a day when everything will come true what God has already revealed, so hold fast, never give up, do not give up."
Będę śpiewał Ci," Będę śpiewał Ci najpiękniejszą pieśń  Z aniołami tak będę śpiewał Ci  Święty, Święty, Święty jest Pan, Zastępów Pan.  Cała ziemia jest pełna Jego chwały ","I will sing to you the most beautiful song With angels, so I will sing you Holy, Holy, Holy is the Lord, the Host of the Lord. The whole earth is full of His glory"
"Błogosław, duszo moja Pana"," Błogosław duszo moja Pana, wszystko, co we mnie, Jego najświętsze imię. Błogosław duszo moja Pana, jego dobroci nigdy nie zapominaj.  On odpuszcza wszystkie twoje grzechy, leczy wszystkie twoje choroby. Okazuje Swoje miłosierdzie,  On ratuje Ciebie od zguby. On napełnia twoje życie dobrem, aż odnowi się twoja młodość, jak u orła. Nie odpłaca według grzechów, nie chce wiecznie gniewać się. On pamięta żeśmy prochem, on najlepiej wie!  Błogosław duszo moja Pana, wszystko, co we mnie, Jego najświętsze imię. Błogosław duszo moja Pana, jego dobroci nigdy nie zapominaj.  Tak jak ojciec nad swoimi dziećmi, Pan lituje się nad pokornym. On oddala od nas nasze winy jak daleko wschód od zachodu. Jak wysoko niebo jest nad ziemią, tak jest wielka dobroć dla ludzi, którzy się Go boją. Dni człowieka są jak trawa,  kwitnie On jak polny kwiat. Kiedy mocniej wiatr zawieje, znika po nim ślad!  Błogosław duszo moja Pana, wszystko, co we mnie, Jego najświętsze imię. Błogosław duszo moja Pana, jego dobroci nigdy nie zapominaj.  Błogosławcie Pana –  wszyscy aniołowie Błogosławcie Pana – wszyscy Jego ludzie Błogosławcie Pana –  wszystkie Jego dzieła Błogosławcie Go!  Błogosław duszo moja Pana, wszystko, co we mnie, Jego najświętsze imię. Błogosław duszo moja Pana, jego dobroci nigdy nie zapominaj. ","Bless my Lord's soul, everything in me, His most holy name. Bless my Lord, my goodness, never forget. He forgives all your sins, heals all your diseases. He shows His mercy, He saves you from perishing. He fills your life with good, until your youth is renewed, like an eagle. He does not repay according to his sins, he does not want to be angry forever. He remembers that we are dust, he knows best! Bless my Lord's soul, everything in me, His most holy name. Bless my Lord, my goodness, never forget. Like the father over his children, the Lord pities the humble. He distances our faults from us as far east from the west. How high the sky is above the earth, so great is goodness for people who fear Him. The days of man are like grass, he blooms like a field flower. When the wind blows harder, the trail disappears! Bless my Lord's soul, everything in me, His most holy name. Bless my Lord, my goodness, never forget. Bless the Lord - all angels Bless the Lord - all His people Bless the Lord - all His works Bless him! Bless my Lord's soul, everything in me, His most holy name. Bless my Lord, my goodness, never forget."
Błogosławcie Pana wszystkie Jego dzieła," Błogosławcie Pana wszystkie Jego dzieła,  które by nie kwitły gdyby nie cierpienie,  Błogosławcie Pana.   Błogosławcie Pana wszystkie łzy i żale, każda moja słabość i upokorzenie,  Błogosławcie Pana.  Błogosławcie Pana wszystkie moje rany, na które Duch Święty staje się balsamem, Błogosławcie Pana.  Niech Cię błogosławią  wszystkie me niemoce, ból skrzętnie skrywany po bezsennej nocy, Błogosławcie Pana.  Błogosławcie Pana, że Mu ufam jeszcze, że mnie wciąż uzdrawia łaski Swojej deszczem Błogosławcie Pana. ","Bless the Lord, all his works that would not flourish were it not for suffering, Bless the Lord. Bless the Lord with all tears and regrets, all my weakness and humiliation, Bless the Lord. Bless the Lord, all my wounds, to which the Holy Spirit becomes a balm, Bless the Lord. May they bless you all my infirmities, pain carefully hidden after a sleepless night, Bless the Lord. Bless the Lord that I trust in him, that he still heals me with His rain. Bless the Lord."
Błogosławione jest Imię Twe," Błogosławione jest Imię Twe, błogosławione jest Imię Twe i wywyższone nad wszelką chwałę i cześć, Tyś jedynie Panem jest.  Powstań! I Pana chwal,  chwal Go na wieki. Powstań! Chwal Boga wciąż,  On jedynie jest Panem. Powstań! I Pana chwal,  chwal Go na wieki. Powstań! Chwal Boga wciąż, On Panem wszechświata jest. ","Blessed is Your Name, blessed is Your name and exalted above all glory and honor, You are only Lord. Arise! And praise God, praise him forever. Arise! Praise God still, He is only Lord. Arise! And praise God, praise him forever. Arise! Praise God still, He is the Lord of the universe."
Cała ziemio wołaj," Cała ziemio wołaj z radości na cześć Pana,  raduj się, wesel się. Cała ziemio wołaj z radości na cześć Pana,  Alleluja, Alleluja.  Śpiewajcie Panu pieśń nową, albowiem uczynił cuda. Zwycięstwo Mu zgotowała Jego prawica i święte ramię Jego.   Cała ziemio wołaj z radości na cześć Pana,  raduj się, wesel się. Cała ziemio wołaj z radości na cześć Pana,  Alleluja, Alleluja.  Pan okazał swoje zbawienie, na oczach pogan objawił swą sprawiedliwość. Wspomniał na dobroć i na wierność swoją dla domu Izraela.  Cała ziemio wołaj z radości na cześć Pana,  raduj się, wesel się. Cała ziemio wołaj z radości na cześć Pana,  Alleluja, Alleluja.  Ujrzały wszystkie krańce ziemi zbawienie Boga naszego. Wołaj z radości na cześć Pana, cała ziemio, cieszcie się, weselcie i grajcie.  Cała ziemio wołaj z radości na cześć Pana,  raduj się, wesel się. Cała ziemio wołaj z radości na cześć Pana,  Alleluja, Alleluja.  Śpiewajcie Panu przy wtórze cytry, przy wtórze cytry i przy dźwięku harfy. Przy trąbach i przy głosie rogu na oczach Pana, Króla, się radujcie.  Cała ziemio wołaj z radości na cześć Pana,  raduj się, wesel się. Cała ziemio wołaj z radości na cześć Pana,  Alleluja, Alleluja.  Niech szumi morze i wszystko, co w nim żyje, krąg ziemi i jego mieszkańcy, rzeki niech klaszczą w dłonie, góry niech razem wołają z radości. ","Let all earth call out of joy in praise of the Lord, rejoice, be glad. The whole earth call out for joy in honor of the Lord, Alleluia, Alleluia. Sing to the Lord a new song, for he has done wonders. His right hand and his holy arm prepared his victory. Let all earth call out of joy in praise of the Lord, rejoice, be glad. The whole earth call out for joy in honor of the Lord, Alleluia, Alleluia. The Lord showed his salvation and revealed his justice in the sight of the Gentiles. He mentioned goodness and loyalty to the home of Israel. Let all earth call out of joy in praise of the Lord, rejoice, be glad. The whole earth call out for joy in honor of the Lord, Alleluia, Alleluia. All the ends of the earth saw the salvation of our God. Rejoice in the honor of the Lord, all earth, rejoice, rejoice and play. Let all earth call out of joy in praise of the Lord, rejoice, be glad. The whole earth call out for joy in honor of the Lord, Alleluia, Alleluia. Sing to the Lord with the tones of the lemons, with the tones of the lemons and at the sound of the harp. With the trumpets and the voice of the corner in the eyes of the Lord, King, rejoice. Let all earth call out of joy in praise of the Lord, rejoice, be glad. The whole earth call out for joy in honor of the Lord, Alleluia, Alleluia. May the sea and everything in it live, the circle of the earth and its inhabitants, let the clapper clap their hands, let the mountains cry out for joy together."
Chcę wywyższać Imię Twe," Chcę wywyższać Imię Twe, chcę zaśpiewać Tobie chwałę. Panie, dziś raduję się, bo przyszedłeś, by mnie zbawić.  Z nieba zstąpiłeś i chcesz prowadzić mnie. Na krzyżu zmarłeś, by mój zapłacić dług.  Z grobu wstałeś i dziś nieba Królem jesteś Ty,  chcę wywyższać Imię Twe. ","I want to exalt Your Name, I want to sing praise to You. Lord, today I rejoice because you came to save me. You came down from heaven and want to lead me. You died on the cross to pay my debt. You have risen from the grave and today is heaven. The King is You, I want to exalt Your Name."
Chlebie najcichszy," Chlebie najcichszy otul mnie swym milczeniem, ukryj mnie w swojej bieli, wchłoń moją ciemność.  Przemień mnie w siebie, bym jak Ty stał się chlebem. Pobłogosław mnie, połam, rozdaj łaknącym braciom.  Chlebie najcichszy otul mnie swym milczeniem, ukryj mnie w swojej bieli, wchłoń moją ciemność.  A ułomki chleba, które zostaną rozdaj tym, którzy nie wierzą w swój głód. ","Hold the softest bread with your silence, hide me in your white, absorb my darkness. Transform me into yourself, so that you, like you, become bread. Bless me, break me, give to the hungry brothers. Hold the softest bread with your silence, hide me in your white, absorb my darkness. A piece of bread that will be given to those who do not believe in their hunger."
Chrystus Pan karmi nas," Chrystus Pan karmi nas Swoim świętym Ciałem, chwalmy Go na wieki  Duchem całym wielbię Pana, Boga, Zbawcę Jedynego, bo w Nim samym odnajduję wszystką radość życia mego.  Chrystus Pan karmi nas Swoim świętym Ciałem, chwalmy Go na wieki  Wielbię bo chciał wejrzeć z nieba na swą sługę uniżony, by mnie odtąd wszyscy ludzie mogli zwać Błogosławioną.  Chrystus Pan karmi nas Swoim świętym Ciałem, chwalmy Go na wieki  Sprawił we mnie wielkie dzieła w swej dobroci niepojętej, On, Wszechmocny, On, Największy, On sam jeden zawsze święty.  Chrystus Pan karmi nas Swoim świętym Ciałem, chwalmy Go na wieki  On, który przez pokolenia pozostaje miłosierny, wobec tego, kto Mu służy i chce zostać Jemu wierny.  Chrystus Pan karmi nas Swoim świętym Ciałem, chwalmy Go na wieki  On, który swą moc objawia, gdy wyniosłość serc uniża, każdy zamiar może zburzyć, który pychą Mu ubliża.  Chrystus Pan karmi nas Swoim świętym Ciałem, chwalmy Go na wieki  W mocy Jego odjąć władzę, a wydźwignąć pokornego, wszystkich głodnych zaspokoić, głodem wstrząsnąć bogatego.  Chrystus Pan karmi nas Swoim świętym Ciałem, chwalmy Go na wieki  On się ujął za swym ludem, dziećmi wiary Abrahama, pomny na Swe miłosierdzie, obietnicy Swej nie złamał. ","Christ the Lord nourishes us with His Holy Body, let us praise Him for all time, I glorify the Lord wholeheartedly, God, the only Savior, because in Him I find all the joy of my life. Christ the Lord nourishes us with His holy body, let us praise him for ever, I adore him because he wanted to look down from heaven to his servant humbled, that from now on all men would be able to call the Blessed. Christ the Lord nourishes us with His Holy Body, let us praise him forever. He has done great works in me in his kindness inconceivable, he, the Almighty, he, the greatest, he alone is always holy. Christ the Lord nourishes us with His Holy Body, let us praise Him forever, who for generations remains merciful, who serves Him and wants to be faithful to Him. Christ the Lord nourishes us with His Holy Body, let us praise Him forever, He who reveals His power, when the haughtiness of hearts humbles, every intention can destroy, who pride Him with offenses. Christ the Lord nourishes us with His holy body, let us praise him forever, in his power to take away his power, and lift up the humble, satisfy all the hungry with hunger, shake the rich. Christ the Lord nourishes us with His Holy Body, let us praise him forever. He took charge of his people, the children of Abraham's faith, mindful of His mercy, he did not break His promise."
"Chrystus Pan, Boży Syn"," Chrystus Pan, Boży Syn, Zbawca nasz zgodził się wziąć mój grzech,  za mnie umrzeć chciał Ażebym znał mój ogrom win i wiedział, że Krew Jego zbawia oczyszcza i leczy.  Wywyższony bądź Jezu,  Baranku mój, Tyś jedyny Odkupiciel, Tyś mój Król. Wywyższony bądź Boży Baranku, przed Twym tronem dziś najwyższy składam hołd. ","Christ the Lord, God's Son, our Savior agreed to take my sin, he would die for me, that I would know my greatness of wine, and know that his blood saves purify and heals. Be it high Jesus, O my Lamb, You are the only Redeemer, You are my King. Exalted, be God's Lamb, before Your throne, I pay the highest praise today."
Chwal Adonai," Któż jest jak Bóg? Ponad wszystkim On, wzniosły Jego tron. Góry chylą się, oceany grzmią, Panu dają hołd.  Chwal Adonai, odkąd Słońce budzi się aż zakończy każdy dzień. Chwal Adonai, wszyscy ludzie niech go czczą,  z aniołami wielbią Go. ","Who is like God? He exalted his throne above all. The mountains are bending, the oceans are thundering, they give homage to the Lord. Praise Adonai, since the Sun wakes up until the end of each day. Praise Adonai, let all people worship him, worship him with angels."
Chwalcie Pana niebios," Chwalcie Pana Niebios, chwalcie Go na cytrze, chwalcie Króla świata, bo On Bogiem jest.  Chwal duszo moja Pana mego Króla, chcę chwalić Pana, jak długo będę żył Chcę śpiewać memu Bogu, póki będę istniał, chcę Go wysławiać, śpiewać Alleluja!  Chwalcie Pana Niebios, chwalcie Go na cytrze, chwalcie Króla świata, bo On Bogiem jest.  Szczęśliwy ten, któremu Pan jest pomocą, kto ma nadzieję w Panu Bogu swym, w Bogu, który stworzył Niebo i Ziemię, wszystko, co żyje śpiewa Alleluja!  Chwalcie Pana Niebios, chwalcie Go na cytrze, chwalcie Króla świata, bo On Bogiem jest.  Pan Bóg króluje, wesel się Ziemio, Bóg Twój Syjonie przez pokolenia. On dał Ci życie, On da ci wszystko. Śpiewaj Mu wysławiaj Go Alleluja! ","Praise the Lord of Heaven, praise Him on the zither, praise the King of the world, for He is God. Praise the soul of my Lord my King, I want to praise the Lord, how long I will live. I want to sing to my God, as long as I exist, I want to praise Him, sing Alleluia! Praise the Lord of Heaven, praise Him on the zither, praise the King of the world, for He is God. Happy is the one whom the Lord is helping, who hopes in the Lord his God, in God who created Heaven and Earth, all that lives sings Alleluia! Praise the Lord of Heaven, praise Him on the zither, praise the King of the world, for He is God. God reigns, rejoice the Earth, God your Zion for generations. He gave you life, He will give you everything. Sing to Him, glorify Him Alleluia!"
Chwalcie łąki umajone," Chwalcie łąki umajone, Góry, doliny zielone. Chwalcie, cieniste gaiki, Źródła i kręte strumyki!  Co igra z morza falami, W powietrzu buja skrzydłami, Chwalcie z nami Panią Świata, Jej dłoń nasza wieniec splata.  Ona dzieł Boskich korona, Nad Anioły wywyższona; Choć jest Panią nieba, ziemi, Nie gardzi dary naszymi.  Wdzięcznym strumyki mruczeniem, Ptaszęta słodkim kwileniem, I co czuje, i co żyje, Niech z nami sławi Maryję! ","Praise the umajone meadows, the mountains, the green valleys. Praise, shady gaiki, Sources and winding brooks! What is playing with waves in the sea, Wings in the air, Praise the Lady of the World with us, Her hand weaves the wreath. She works the divine crown, exalted above the Angels; Although she is the Lady of heaven, the earth, she does not disdain our gifts. Graceful brooks purring, Birdie with a sweet whimper, And what he feels and what lives, let him praise Mary with us!"
"Chwalę Ciebie, Panie"," Chwalę Ciebie Panie i uwielbiam. Wznoszę w górę swoje ręce uwielbiając Imię Twe.  Bo wielkiś Ty, wielkie dzieła czynisz dziś. Nie dorówna Tobie nikt, nie dorówna Tobie nikt. ","I praise You, Lord, and I adore You. I raise my hands up, praising Your Name. Because you are great, you make great works today. No one can match you, no one can match you."
Chwała Bogu Ojcu," Chwała Bogu Ojcu  W chwale Jego Syn, Chwałą Tobie Duchu, Tworzysz jedno w Nich!  Śpiewajmy Alleluja Panu, alleluja, alleluja! ","Praise God the Father. In glory, His Son, Glory be to You, You create one in them! Let us sing Alleluia to the Lord, hallelujah, alleluia!"
Ciebie całą duszą pragnę," Ciebie całą duszą pragnę I z tęsknotą oczekuję,  Jak spękana, zeschła ziemia, W czas posuchy wody łaknie.  Boże, jesteś moim Bogiem, Ciebie z troską szukam.  W Twej świątyni ujrzeć pragnę Twą potęgę, moc i chwałę, Bowiem Twoją miłość, Panie, bardziej cenię niźli życie.  Boże, jesteś moim Bogiem, Ciebie z troską szukam.  Póki tylko istnieć będę, pragnę Ciebie chwalić, Boże, Dusza moja pełna szczęścia, będzie śpiewać Ci z radością.  Boże, jesteś moim Bogiem, Ciebie z troską szukam.  Jesteś mym wspomożycielem, cień Twych skrzydeł daje radość, Całym sercem lgnę do Ciebie, Twa prawica mnie prowadzi.  Boże, jesteś moim Bogiem, Ciebie z troską szukam. ","I long for you with all my soul and I look forward to longing. Like a broken, dry land, in the time of drought the water is hungry. God, you are my God, I am looking for you with concern. In Your temple, I want to see Your power, strength and glory, for Your love, Lord, I value more than my life. God, you are my God, I am looking for you with concern. As long as I exist, I want to praise You, God, my soul full of happiness will sing You with joy. God, you are my God, I am looking for you with concern. You are my helper, the shadow of your wings gives joy, I cling to You with all my heart, Your right hand leads me. God, you are my God, I am looking for you with concern."
