title,pl,en
Jezu Tyś jest,"Jezu, Tyś jest światłością mej duszy, Niech ciemność ma  nie przemawia do mnie już.  Jezu, Tyś jest światłością mej duszy, Daj mi moc przyjąć dziś miłość Twą. ","Jesus, You are the light of my soul, Let no darkness speak to me anymore. Jesus, You are the light of my soul, Give me strength to receive Your love today."
Jezus Chrystus moim Panem jest," Jezus Chrystus moim Panem jest Alleluja.  On kocha mnie, On kocha mnie Alleluja. ","Jesus Christ, my Lord, is Alleluia. He loves me, He loves me Hallelujah."
Jezus Chrystus to Panów Pan," Jezus Chrystus to panów Pan  i całej ziemi Król.  Jedyny Pan, Władca narodów, jedyny Pan i Bóg.  W innym imieniu nie ma zbawienia,  bo Jezus to Panów Pan, Jezus to Panów Pan, Jezus to Panów Pan. Alleluja, Alleluja, Alleluja. ","Jesus Christ is the lords of the Lord and the whole earth King. The only Lord, Lord of nations, the only Lord and God. In another name, there is no salvation, because Jesus is Lord's Lord, Jesus is Lord's Lord, Jesus is Lord's Lord. Alleluia, Alleluia, Alleluia."
Jezus daje nam zbawienie," Jezus daje nam zbawienie,  Jezus daje pokój nam. Jemu składam dziękczynienie,  chwałę z serca mego dam.  Jezus siłą mą, Jezus pieśnią mego życia. Królem wiecznym On, niepojęty w mocy swej. W nim znalazłem to czego szukałem do dzisiaj. Sam mi podał dłoń bym zwyciężał każdy dzień.  W Jego ranach uzdrowienie,  w Jego śmierci życia dar. Jego krew to oczyszczenie,  Jego życie chwałą nam.  Jezus siłą mą, Jezus pieśnią mego życia. Królem wiecznym On, niepojęty w mocy swej. W nim znalazłem to czego szukałem do dzisiaj. Sam mi podał dłoń bym zwyciężał każdy dzień. ","Jesus gives us salvation, Jesus gives us peace. I give thanks to him, I will give glory from my heart. Jesus, my strength, Jesus, the song of my life. He is the eternal King, inconceivable in his power. In it, I found what I was looking for today. He gave me his hand to win every day. In His wounds Healing, in His death, the gift of life. His blood is purification, His life is glory to us. Jesus, my strength, Jesus, the song of my life. He is the eternal King, inconceivable in his power. In it, I found what I was looking for today. He gave me his hand to win every day."
Jezus najwyższe Imię," Jezus Najwyższe Imię, Nasz Zbawiciel, Książe Pokoju, Emmanuel, Bóg jest z nami, Odkupiciel, Słowo Żywota.  Święty Bóg, Mesjasz prawdziwy, Jedyny Ojca Syn, umiłowany, zgładził grzech, Baranek na wieki, Królów Król i Panów Pan. ","Jesus, the Most High Name, Our Savior, the Prince of Peace, Emmanuel, God is with us, the Redeemer, the Word of Life. Holy God, the true Messiah, the only Father the Son, beloved, he has wiped away the sin, the Lamb forever, the kings the King and lords the Lord."
Jezus Namaszczony Pan (Twe imię jak miód)," Jezus, Jezus  Święty, Namaszczony Pan, Jezus, Jezus, Jezus Żyje Wywyższony Pan, Jezus.  Twe Imię jak miód na ustach mych, Twój Duch jest jak woda duszy mej, Twe słowo jak lampa u mych stóp, Jezu, ja kocham Cię, ja kocham. ","Jesus, Holy Jesus, Anointed Lord, Jesus, Jesus, Jesus is the Exalted Lord, Jesus. Your Name is like honey on my lips, Your Spirit is like the water of my soul, Your word like a lamp at my feet, Jesus, I love You, I love You."
Już teraz we mnie kwitną Twe ogrody,"Już teraz we mnie kwitną Twe ogrody,  Już teraz we mnie Twe królestwo jest. ","The gardens are already blooming in me, Your kingdom is in me now."
Każdy dzień upewnia mnie," Każdy dzień upewnia mnie,  Pan w miłości wierny jest, któż by inny mógł jak On, wybaczać co dzień. Boże wiem jak ranię Cię,  Często słabnę gubię sens, Jednak Ty podnosisz mnie I nadzieję dajesz mi.  Nikt nie odbierze mi tego co mam w Tobie.  Pełnię miłości, pełnię radości,  pełnię wolności  mam w Tobie! królestwo jest. ","Every day assures me, the Lord is faithful in love, who would be able to forgive every day as He did. God, I know how I hurt you, I often lose my sense, but You raise me and give me hope. Nobody will take away what I have in you. I am full of love, full of joy, full of freedom in You! the kingdom is."
Każdy spragniony," Każdy spragniony i słaby też niech przyjdzie do źródła, serce obmyje swe. Niech ból i cierpienie zanurzy Pan w swym miłosierdziu,  niech głębia woła w nas.  Panie Jezu przyjdź. ","Let everyone who is thirsty and weak also come to the source, the heart will wash his. May the Lord immerse in pain and suffering in His mercy, let depth speak to us. Lord Jesus, come."
Kiedy masz chwile smutne (Matce która pod krzyżem)," Kiedy masz chwile smutne w Twym życiu  Powierz się Matce Kiedy rozpacz rozdziera Twe serce,  Ofiaruj się Jej   Matce która pod krzyżem stała  Matce która się z Synem żegnała  Która uczyć cię będzie pokory, Cierpienia znieść ci pomoże  Ona Matka która pod krzyżem stała Matka która się z Synem żegnała Która uczyć cię będzie pokory, Cierpienia znieść ci pomoże  Kiedy ruszysz w daleką wędrówkę Powierz się Matce Gdy na szlaku zaskoczy cię burza, Ofiaruj się Jej  Matce która pod krzyżem stała  Matce która się z Synem żegnała  Która uczyć cię będzie pokory, Cierpienia znieść ci pomoże  Ona Matka która pod krzyżem stała Matka która się z Synem żegnała Która uczyć cię będzie pokory, Cierpienia znieść ci pomoże  Jeśli zgubisz swą drogę do Boga Powierz się Matce Gdy w twym sercu znów gości trwoga, Ofiaruj się Jej  Matce która pod krzyżem stała  Matce która się z Synem żegnała  Która uczyć cię będzie pokory, Cierpienia znieść ci pomoże  Ona Matka która pod krzyżem stała Matka która się z Synem żegnała Która uczyć cię będzie pokory, Cierpienia znieść ci pomoże ","When you have moments of sadness in your life, entrust yourself to the mother. When despair rends your heart, give to her mother who stood by the cross. Mother who said goodbye to the child. Who will teach you humility, help her. Mother who crossed the cross stood Mother who came to My son said goodbye Who will teach you humility, Suffering will help you When you go on a long journey. Commend to the Mother. When the storm surprises you, sacrifice to her mother who stood with the cross to the mother who said goodbye to the Son Who will teach you humility, Suffer to bear you She will help Mother who stood by the cross Mother who said goodbye to the Son Who will teach you humility, Suffering will help you If you lose your way to God, entrust yourself to the Mother When you are in fear again, give to her mother who stood under the cross with Mother She said goodbye to the Son Who will teach you humility, Suffer She will be helped by her Mother who stood under the cross Mother who said goodbye to the Son Who will teach you will be humble, Suffering suffering will help you"
"Kiedy w jasną, spokojną - O Boże"," Kiedy w jasną, spokojną, cichą noc Spoglądam na niebo pełne gwiazd, Wtedy myślę, czy życie to ma sens  I wołam do Ciebie, Ojcze nasz.   O Boże, o Boże, Panie mój, Nie pamiętaj, że czasem było źle. Wiesz dobrze, że zawsze jestem Twój  I że tylko Twoją drogą kroczyć chcę.  Kiedy w życiu tak pełnym rozczarowań Przez grzechu kamienie potknę się, Kiedy spokój utonie w fali knowań, Każdym drżeniem mej duszy szukam Cię.  O Boże, o Boże, Panie mój, Nie pamiętaj, że czasem było źle. Wiesz dobrze, że zawsze jestem Twój  I że tylko Twoją drogą kroczyć chcę.  Życie ludzi przebiega krętą drogą, Hen w górze cel mej wędrówki tkwi, I choć czasem sił braknie moim nogom, To ja dojdę, dojdę, gdy zaufam Ci.  O Boże, o Boże, Panie mój, Nie pamiętaj, że czasem było źle. Wiesz dobrze, że zawsze jestem Twój  I że tylko Twoją drogą kroczyć chcę. ","When in a bright, calm, quiet night I look at the sky full of stars, Then I think, if this life makes sense and I call to You, our Father. Oh God, God, my Lord, Do not remember that sometimes it was bad. You know well that I am always Yours and that I want to follow you only. When in a life so full of disappointments Through sin, stones stumble, When peace sinks in a wave of plots, I look for you with every trembling of my soul. Oh God, God, my Lord, Do not remember that sometimes it was bad. You know well that I am always Yours and that I want to follow you only. The life of people runs along a winding road, Hen, the goal of my journey is up, And though my arms are sometimes lacking, I will come, I will come when I trust in You. Oh God, God, my Lord, Do not remember that sometimes it was bad. You know well that I am always Yours and that I want to follow you only."
Kiedyś wino i chleb," Kiedyś wino i chleb, teraz ciało i krew. Możesz wierzyć lub nie, to naprawdę dzieje się.   Ciągle czekasz na cud, niespokojny Twój duch, a ja przypomnę, że w ciszy i przy blasku świec  cud największy dzieje się.   Kiedyś wino i chleb, teraz ciało i krew. Możesz wierzyć lub nie, to naprawdę dzieje się.   Wypatrujesz co dnia, czekasz na jakiś znak, a ja przypomnę, że w ciszy i przy blasku świec  cud największy dzieje się. ","Once wine and bread, now the body and blood. You can believe it or not, it really happens. You are still waiting for a miracle, your mind is restless, and I will remind you that in the silence and the candlelight the greatest miracle happens. Once wine and bread, now the body and blood. You can believe it or not, it really happens. You look out every day, wait for a sign, and I will remind you that in the silence and the candlelight the greatest miracle happens."
Kocham więc nie muszę się bać," Kocham, więc nie muszę się bać, zabierz mój strach.  Jezus mówi Ci, że miłość ta  zabiera strach. Jezus drogą! Jezus prawdą! Jezus życiem!   Kocham, więc nie muszę się kryć, mogę sobą być.   Jezus mówi Ci, że miłość ta  zabiera strach. Jezus drogą! Jezus prawdą! Jezus życiem!   Jezus daje Ci miłość swą, nie lękaj się.  Jezus mówi Ci, że miłość ta  zabiera strach. Jezus drogą! Jezus prawdą! Jezus życiem!  ","I love, so I do not have to be afraid, take my fear. Jesus tells you that this love takes fear. Jesus, the way! Jesus is the truth! Jesus is life! I love, so I do not have to hide, I can be myself. Jesus tells you that this love takes fear. Jesus, the way! Jesus is the truth! Jesus is life! Jesus gives you his love, do not be afraid. Jesus tells you that this love takes fear. Jesus, the way! Jesus is the truth! Jesus is life!"
Kto spożywa moje ciało," Kto spożywa moje Ciało i Krew moją pije, trwa we Mnie, a Ja w nim,  będzie żył na wieki.  Ja jestem Chlebem Żywym,  który zstąpił z nieba, jeśli kto ten chleb spożywa  będzie żył na wieki. ","Whoever eats my flesh and drinks my blood abides in me, and I, in him, will live forever. I am the Living Bread, who came down from heaven, if anyone consumes this bread, he will live forever."
Kto spragniony jest,Kto spragniony jest niech przyjdzie do Mnie i pije. Jak rzekło Pismo: Strumienie Wody Żywej  popłyną z Jego wnętrza. Ja pragnącemu dam  pić ze zdrojów zbawienia. ,Who thirsty is let him come to me and drink. As the Scripture said: Streams of Living Water will flow from His interior. I want to drink the desires of salvation from the desires of salvation.
Laudato si," Laudato si, o mi Signore.  Niech Cię wysławia to, co stworzyłeś:  Słońce na niebie, księżyc wśród nocy.  Gwiazdy świecące, wiatry gwałtowne,  Żywioły wodne, ogień gorący.  Laudato si, o mi Signore.  I siostra nasza, matka ziemia, Ta, co nas żywi i wychowuje, Słodkie owoce, kwiaty i zioła, I szczyty górskie, morskie głębiny.  Laudato si, o mi Signore.  Trzeba nam chwalić Ciebie, o Boże, Trzeba nam śpiewać Tobie, o Boże, Bo to jest sensem naszego życia. Niech całe życie będzie piosenką! ","Laudato si, Signore about me. Let it magnify what you have created: the sun in the sky, the moon in the night. Shining stars, violent winds, Water elements, hot fire. Laudato si, Signore about me. And our sister, mother earth, the one who feeds and educates us, sweet fruits, flowers and herbs, and mountain peaks, sea depths. Laudato si, Signore about me. We must praise You, God, We must sing to You, God, It is the meaning of our lives. Let your whole life be a song!"
Maryjo śliczna Pani," Maryjo, Śliczna Pani, Matko Boga i ludzi na ziemi. Tyś świata Królową, Tyś gwiazdą na niebie,  Ty nas wiedziesz przed Jezusa wieczny tron.   Maryja, Ave Maryja. U Boga nam wybłagaj zdroje łask,  by świat lepszym był, by w miłości żył.  O Maryjo miej w opiece dzieci swe.  Maryjo, Śliczna Pani, świat dziś czuje na swych ustach gorzkie łzy. W sercu ból, smutek żal,  a w oczach wciąż strach, usłysz, Pani, błaganie, pomóż nam.  Maryja, Ave Maryja. U Boga nam wybłagaj zdroje łask,  by świat lepszym był, by w miłości żył.  O Maryjo miej w opiece dzieci swe. ","Mary, lovely Lady, Mother of God and people on earth. You are the Queen of the world, You are the star in the sky, You lead us to Jesus, the eternal throne. Mary, Ave Mary. With God, we beg the springs of favors so that the world would be better to live in love. O Mary, take care of your children. Mary, the lovely Lady, today the world feels bitter tears on her lips. In the heart of pain, sorrow for sorrow, and in your eyes still fear, hear, Lady, begging, help us. Mary, Ave Mary. With God, we beg the springs of favors so that the world would be better to live in love. O Mary, take care of your children."
Matko która nas znasz," Matko, która nas znasz, Z dziećmi Twymi bądź,  Na drogach nam nadzieją świeć,  Z Synem Twym z nami idź!   Z wszystkich niewiast wybrana –  przyjdź i drogę wskaż Córko ludu Bożego –  do Syna Twego nas prowadź. Służebnico pokorna –  pokój światu daj.   Matko, która nas znasz, Z dziećmi Twymi bądź,  Na drogach nam nadzieją świeć,  Z Synem Twym z nami idź!   Królowo ognisk rodzinnych –  przyjdź i drogę wskaż Dziewico, wzorze prostoty – do Syna Twego nas prowadź. Oblubienico cieśli –  pokój światu daj.   Matko, która nas znasz, Z dziećmi Twymi bądź,  Na drogach nam nadzieją świeć,  Z Synem Twym z nami idź!   Królowo narodu naszego –  przyjdź i drogę wskaż Uciśnionych nadziejo –  do Syna Twego nas prowadź. Światło łaknących prawdy –  pokój światu daj.   Matko, która nas znasz, Z dziećmi Twymi bądź,  Na drogach nam nadzieją świeć,  Z Synem Twym z nami idź!   Pociecho ludu biednego –  przyjdź i drogę wskaż Pani wszelkiej radości –  do Syna Twego nas prowadź. Matko tkliwego serca –  pokój światu daj.   Matko, która nas znasz, Z dziećmi Twymi bądź,  Na drogach nam nadzieją świeć,  Z Synem Twym z nami idź!   Dziewico, Matko Chrystusa –  przyjdź i drogę wskaż Dziewico, Matko Kościoła –  do Syna Twego nas prowadź. Dziewico, Matko ludzi –  pokój światu daj.   Matko, która nas znasz, Z dziećmi Twymi bądź,  Na drogach nam nadzieją świeć,  Z Synem Twym z nami idź!   Matko, przez Syna nam dana –  przyjdź i drogę wskaż Matko, która nas słuchasz –  do Syna Twego nas prowadź. Ty nas zawsze rozumiesz –  pokój światu daj.   Matko, która nas znasz, Z dziećmi Twymi bądź,  Na drogach nam nadzieją świeć,  Z Synem Twym z nami idź!   Dziewico z nami idąca –  przyjdź i drogę wskaż Historii świata promieniu –  do Syna Twego nas prowadź. Pośredniczko najlepsza –  pokój światu daj .   Matko, która nas znasz, Z dziećmi Twymi bądź,  Na drogach nam nadzieją świeć,  Z Synem Twym z nami idź!   Matko ludzi bezdomnych –  przyjdź i drogę wskaż Matko prześladowanych –  do Syna Twego nas prowadź. Matko dzieci wzgardzonych –  pokój światu daj.   Matko, która nas znasz, Z dziećmi Twymi bądź,  Na drogach nam nadzieją świeć,  Z Synem Twym z nami idź!   Matko ludzi cierpiących –  przyjdź i drogę wskaż Matko z sercem przeszytym –  do Syna Twego nas prowadź. U stóp krzyża stojąca –  pokój światu daj.  ","Mother, who know us, With your children, let us shine on our paths, With Your Son, go with us! Out of all women chosen - come and follow the path of the daughter of God's people - lead us to your Son. Servant humble - give peace to the world. Mother, who know us, With your children, let us shine on our paths, With Your Son, go with us! Queen of family foci - come and show the Virgin, the pattern of simplicity - lead us to Your Son. Spouse carpenter - give peace to the world. Mother, who know us, With your children, let us shine on our paths, With Your Son, go with us! Queen of our nation - come and show the oppressed hopes - lead us to your Son. A light of hungry truth - give peace to the world. Mother, who know us, With your children, let us shine on our paths, With Your Son, go with us! The comfort of the poor people - come and show the path of all joy - lead us to your Son. Mother of a tender heart - give peace to the world. Mother, who know us, With your children, let us shine on our paths, With Your Son, go with us! Virgin, Mother of Christ - come and show the Virgin, Mother of the Church, lead us to Your Son. Virgin, Mother of people - give peace to the world. Mother, who know us, With your children, let us shine on our paths, With Your Son, go with us! Mother, through the Son, given to us - come and show me the Mother who is listening to us - lead us to your Son. You always understand us - give peace to the world. Mother, who know us, With your children, let us shine on our paths, With Your Son, go with us! Virgin coming with us - come and take a path to the world's history of the ray - lead us to your Son. Intermediate best - give peace to the world. Mother, who know us, With your children, let us shine on our paths, With Your Son, go with us! Mother of the homeless - come and show the Mother of the persecuted - lead us to Your Son. Mother of the despised children - give peace to the world. Mother, who know us, With your children, let us shine on our paths, With Your Son, go with us! Mother of suffering people - come and show me Mother with a pierced heart - lead us to Your Son. At the foot of the cross, standing - give peace to the world."
"Memu Bogu, Królowi"," Memu Bogu królowi  będę śpiewał tę pieśń  teraz zawsze na wieki, Amen.  Alleluja, alleluja, alleluja, Amen. ","To my God, I will sing the song to the King forever, forever, Amen. Alleluia, alleluia, alleluia, Amen."
Miłość Twa,"Miłość Twa od najwyższych gór wyższa jest, Wielka jest wierność Twa,  do nieba sięga wzwyż. Miłość Twa głębsza niż ocean bez dna,  Wielka jest wierność Twa, gdy do mnie zniżasz się. ","Your love from the highest mountains is higher, Greatness is Your fidelity, He reaches heaven upward. Your love is deeper than the bottomless ocean, Greatness is Your faithfulness when you fall down to me."
"Mój Jezu, mój Zbawco","Mój Jezu, mój Zbawco,  któż jest tak wielki jak Ty? Przez wszystkie dni wysławiać chcę wspaniałe dzieła Twoich rąk. Mój Panie, Obrońco,  Źródło mych natchnień i sił, niech cały świat,  wszystko co jest zawsze wielbi Imię Twe.  Krzycz na cześć Pana,  rozraduj się w Nim,  ogłaszaj wszędzie, że On Panem jest. Góry ustąpią na dźwięk Jego słów  gdy przemówi Stwórca ziem. Patrzę z podziwem na dzieło Twych rąk, zawsze chcę kochać Cię przy Tobie być! Cóż może równać się z tym,  co u Ciebie mam? ","My Jesus, my Savior, who is as great as you? I want to praise wonderful works of your hands all days. My Lord, Defender, The source of my inspirations and strength, let the whole world, all that is always worshiping Your Name. Scream in honor of the Lord, rejoice in Him, announce everywhere that He is Lord. The mountains will give way to the sound of His words when the Creator of the earth speaks. I look with admiration at the work of Your hands, I always want to love You while being You! What can be equal to what I have with you?"
Mój Pan mocą moją jest," Mój Pan mocą moją jest, Pieśnią i Zbawieniem,  On Bogiem mym   Dla ciebie otwieram serce swe  Mój Pan Królem był i jest, na zawsze i na wieki,  Amen. ","My Lord is my power, Song and Salvation, He is my God, I open my heart to you My Lord, the King was and is, forever and for ever, Amen."
Mój zbawiciel,"Mój Zbawiciel, on bardzo kocha mnie.  Ja, nie wiem czemu miłością darzy mnie. On mi nowe życie dzisiaj, ofiarować chce będę, będę mieszkał razem z Panem mym! ","My Savior, he loves me very much. I do not know why he has love for me. He will give me a new life today, I will offer, I will live with my Lord!"
Mów do mnie Panie," Mów do mnie, Panie,  Chcę słyszeć Cię.  Przyjąć od Ciebie,  Co masz dla mnie.  Nie chcę się chować, Lecz w Tobie skryć. W cieniu Twym Panie Chcę iść.  Święty, potężny jesteś  Panie nasz.  Przed Tobą dziś możemy stać Dzięki łasce,  Nie dzięki nam samym. ","Talk to me, Lord, I want to hear You. Accept from you, What you have for me. I do not want to hide, But hide in You. In the shadow of Your Lord, I want to go. Holy, mighty are our Lord. We can stand in front of you today thanks to grace, not thanks to us alone."
Nasz Bóg jest potężny w mocy swej,"Nasz Bóg jest potężny w mocy swej Króluje nad nami dziś Z Nieba rządzi w mocy, miłości, mądrości Swej ","Our God is powerful in his power. He reigns over us today. He runs from Heaven in power, love, and wisdom"
Nasz Bóg jest wielki," Wodę zamieniłeś w wino. Ślepi przy Tobie znów widzą,  któż jest jak Ty? Tylko Ty.   Blaskiem rozświetlasz ciemności. Człowiek powstaje z marności, któż jest jak Ty?  Tylko Ty.  Nasz Bóg jest wielki, nasz Bóg jest silny  Boże nikt inny nie równa się z Tobą. Nasz Bóg uzdrawia, jest wszechmogący. Nasz Bóg, Nasz Bóg.  Blaskiem rozświetlasz ciemności. Człowiek powstaje z marności, któż jest jak Ty? Tylko Ty. Jeśli nasz Bóg jest przy nas już nic nas nie zatrzyma!   Nasz Bóg jest wielki, nasz Bóg jest silny  Boże nikt inny nie równa się z Tobą. Nasz Bóg uzdrawia, jest wszechmogący. Nasz Bóg, Nasz Bóg.  Jeśli nasz Bóg jest z nami,  któż jest przeciwko nam?  Któż jest przeciwko nam?  Nasz Bóg jest wielki, nasz Bóg jest silny  Boże nikt inny nie równa się z Tobą. Nasz Bóg uzdrawia, jest wszechmogący. Nasz Bóg, Nasz Bóg. ","You turned the water into wine. Blind with you, they see again, who is like you? Only you. You shine the darkness with light. Man arises from futility, who is like you? Only you. Our God is great, our God is strong God, no one else is equal with You. Our God heals, he is almighty. Our God, our God. You shine the darkness with light. Man arises from futility, who is like you? Only you. If our God is with us, nothing will stop us! Our God is great, our God is strong God, no one else is equal with You. Our God heals, he is almighty. Our God, our God. If our God is with us, who is against us? Who is against us? Our God is great, our God is strong God, no one else is equal with You. Our God heals, he is almighty. Our God, our God."
Nic nie musisz mówić nic, Nic nie musisz mówić nic Odpocznij we mnie  Czuj się bezpiecznie  Pozwól kochać się  Miłość pragnie Ciebie. ,You do not have to say anything. Rest in me. Feel safe. Let love be. Love desires you.
Nie bój się (Zostań tu)," Zostań tu i ze mną się módl Razem czuwajmy x2  Nie bój się, nie lękaj się  Bóg sam wystarczy x2 ","Stay here and pray with me Let's watch together x2 Do not be afraid, do not be afraid God alone will be enough x2"
"Nie bój się, wypłyń na głębię", Nie bój się wypłyń na głębię  Jest przy Tobie Chrystus. ,Do not be afraid to go out into the depths. Christ is with you.
Nie ma za trudnych spraw (Zanim powiem słowo)," Nie ma za trudnych spraw, nie ma zbyt błahych też  dla Ciebie Panie, Ty przecież wszystko wiesz.  Każdą potrzebę znasz, słyszysz mój śmiech i płacz, dla Ciebie Panie, to przecież ważne jest.  Ja wiem, że wszystko jest możliwe,  że nie ma rzeczy bez znaczenia,  dlatego modlę się do Ciebie, Dobry Panie. I wiem  że zanim powiem słowo, Ty Boże znasz już całe zdanie. Uwielbiam Cię, Twoja wola niech się stanie! ","There are no difficult matters, there are not too trivial ones for you too. Lord, you know everything. Every need you know, you hear my laughter and cry, Lord, it's important. I know that everything is possible, that there is no meaningless thing, that's why I am praying to You, Good Lord. And I know that before I say a word, God, you know the whole sentence. I adore You, Your will be done!"
Nie zabraknie mi nigdy chleba," Nie zabraknie mi nigdy chleba nie zabraknie mi nigdy wody, bo Ty Panie jesteś  chlebem z nieba, Jezu jesteś źródłem mym. ","I will never run out of bread, I will never run out of water, because You are the bread from heaven, Jesus, you are my source."
Niech oblicze Twe,"Niech oblicze Twe, Panie mój,  Zajaśnieje nad sługą Twym.  Niech przenika mnie jego blask. ","Let your face, my Lord, shine over Your servant. Let its splendor permeate me."
Niech Twój święty duch (i niech spłynie), Niech Twój Święty Duch  Dziś przenika mnie  I niech zawsze już  Gości w duszy mej.   I niech spłynie deszcz  Błogosławieństw Twych  Ojcze obmyj mnie   Duchu Święty przyjdź  Duchu Święty przyjdź Działaj z mocą w nas Duchu Święty przyjdź Przemień smutku czas  I niech spłynie deszcz  Błogosławieństw Twych  Ojcze obmyj mnie  ,"May Your Holy Spirit penetrate me And let my guests always be in my soul. Let the rain bless you, Father, wash me, Holy Spirit, come, Holy Spirit come, act with power in us, Holy spirit, come, Change the time of sorrow, Let the rain bless You, Father, wash me"
