title,pl,en
Do Ciebie Panie," Do Ciebie Panie woła dusza moja, Tęskni ciało me. Gdy nie ma Cię, moje serce ogarnia lęk. Przyjdź dotknij mnie, rozraduj mnie.  Jezu, pragnę blisko Ciebie być,  Jezu, w Twych ramionach się skryć. Słodycz Twą poznawać co dnia, Przy sercu Twym trwać. ","To You, Lord, my soul cries, I miss my flesh. When you are not there, my heart is overcome with fear. Come touch me, rejoice me. Jesus, I want to be close to You, Jesus, hide in Your arms. Let your sweetness be known every day, be with your heart."
Do mnie wróć," Do mnie wróć, zbawię Cię,  cała ziemio! Bo jam jest Pan i twój Bóg jedyny.   Przyjdźcie tu, zbawi was,  przyjdźcie do Pana.  Bo On wasz Pan i wasz Bóg jedyny. ","Return to me, I will save you, all earth! For I am the Lord and your only God. Come here, save you, come to the Lord. Because He is your Lord and your only God."
Dobry jest Pan," Dobry jest Pan dla ufnych,  dla duszy, która szuka Go.  Wołaj całym sercem do Pana, niech łzy twe płyną jak rzeka Powstań i wołaj po nocy, jak wody wylewaj swe serce.  Dobry jest Pan dla ufnych,  dla duszy, która szuka Go.  Nie jest zamiarem Boga  odtrącić na wieki, gdy udręczył, znów się zlituje  w niezmiernej swej dobroci, Wzywajmy Jego imienia z otchłani grobu, On rzeknie: „Nie bójcie się” i powstaniemy.  Dobry jest Pan dla ufnych,  dla duszy, która szuka Go.  Wspomnij Panie o tym, co nas spotkało, spojrzyj i przypatrz się naszej hańbie: słudzy panują nad nami;  Ty ocal nas z ich ręki. Nawróć nas, a wrócimy do Ciebie. ","The Lord is good for the faithful, for the soul who seeks him. Call with all your heart to the Lord, let your tears flow like a river. Rise up and cry after the night, pour out your heart like water. The Lord is good for the faithful, for the soul who seeks him. It is not God's intention to turn away forever, when he has suffered, he will again have mercy in immense goodness, Let us call his name from the abyss of the grave, he will say: ""Do not be afraid"" and let us rise. The Lord is good for the faithful, for the soul who seeks him. Remember, Lord, what has happened to us, look and look at our shame: the servants rule over us; You save us from their hands. Convert us and we will return to You."
Dotknij Panie moich oczu," Dotknij Panie moich oczu,  abym przejrzał. Dotknij Panie moich warg, abym przemówił uwielbieniem. Dotknij Panie mego serca i oczyść je. Niech Twój Święty Duch  dziś ogarnia mnie. ","Touch the Lord of my eyes, that I may see. Touch Lord of my lips, let me speak with adoration. Touch the Lord of my heart and cleanse it. Let Your Holy Spirit overwhelm me today."
Duchu miłości," Duchu Miłości wylewaj się na nas Z przebitego serca Jezusa, Jezusa. ","Spirit of Love pour out on us From the pierced heart of Jesus, Jesus."
Duchu święty (o przyjdź i rozpal nas)," Duchu Święty!  Przyjdź i rozpal nas I utul nas, miłość nam daj. ","Holy Spirit! Come and inflame us and comfort us, give us love."
Duchu święty ogarnij mnie," Duchu Święty, ogarnij mnie! Otwórz oczy mego serca, napełnij miłością! Duchu Święty, ja kocham Cię! Niech Twa święta wola pełni się! ","Holy Spirit, embrace me! Open the eyes of my heart, fill with love! Holy Spirit, I love You! Let Your holy will be done!"
Duchu święty powiej wiatrem," Duchu Święty, powiej wiatrem I z mocą na nas zstąp Bądź miłością w naszych sercach Światłem ogarnij nas  Daj nowe oczy, ześlij swój ogień I jedność z Tobą daj  Z czterech wiatrów, przybądź Duchu Powiej mocą, ożyw nas Bądź wolnością w naszych sercach Życiem wypełnij nas  Daj nowe oczy, ześlij swój ogień I jedność z Tobą daj ","Holy Spirit, wind and power on us, come down Be love in our hearts Light embrace us Give new eyes, send your fire And unity with You give From the four winds, come in Spirit, Create with power, revive us Be freedom in our hearts Life fill us up Give new eyes, send your fire And give me unity"
Duchu święty przyjdź (Niech wiara zagości)," Duchu Święty przyjdź  Niech wiara zagości, Nadzieja zagości,  Niech miłość zagości w nas. ","Holy Spirit come Let faith come in, Hope will enter, Let love come into us."
"Duchu święty, cudownym wiatrem jesteś","Duchu święty, cudownym  wiatrem jesteś wkoło nas! Nie odchodź! ","Holy spirit, you are a wonderful wind around us! Do not go!"
"Duszo ma, Pana chwal"," Duszo ma, Pana chwal, oddaj Bogu cześć, Świętemu śpiewaj pieśń. Z mocą wywyższaj go, duszo ma, Uwielbiam, Boże, Cię!  Nowy dzień wraz ze wschodem słońca Znów nadszedł czas, by Ci śpiewać pieśń. Cokolwiek jest już za mną  i to wszystko, co przede mną Wiem, będę śpiewać, gdy nadejdzie zmrok.  Duszo ma, Pana chwal, oddaj Bogu cześć, Świętemu śpiewaj pieśń. Z mocą wywyższaj go, duszo ma, Uwielbiam, Boże, Cię!  Bogaty w miłość, gniew oddalasz, Panie, Twe serce miłe, wielkie Imię Twe. Ze względu na Twą dobroć  będę śpiewać Tobie pieśni, Wiele powodów, by uwielbiać Cię.  Duszo ma, Pana chwal, oddaj Bogu cześć, Świętemu śpiewaj pieśń. Z mocą wywyższaj go, duszo ma, Uwielbiam, Boże, Cię!  Przyjdzie dzień, gdy bez sił zostanę, Nadejdzie czas mego końca tu. Dusza ma będzie już na zawsze Cię uwielbiać, W wieczności z Tobą piękna zabrzmi pieśń. ","Soul, praise God, worship God, sing a song to the Saint. With power, exalt him, he has a soul, I adore, God, You! A new day with sunrise It's time to sing a song again. Whatever is behind me and all that I know, I will sing when it's dark. Soul, praise God, worship God, sing a song to the Saint. With power, exalt him, he has a soul, I adore, God, You! Rich in love, anger, you go away, O Lord, Your good heart, Your great Name. Because of your goodness, I will sing songs to You, Many reasons to worship You. Soul, praise God, worship God, sing a song to the Saint. With power, exalt him, he has a soul, I adore, God, You! There will come a day when I will be left without strength. The time will come to end here. The soul will adore you forever. In the eternity with you, beauty will sound a song."
Dzielmy się wiarą jak chlebem," Dzielmy się wiarą jak chlebem, dajmy świadectwo nadziei. Bóg ofiarował nam siebie i my mamy się Nim z ludźmi dzielić.  Chleba tego nie zabraknie rozmnoży się podczas łamania. Potrzeba tylko rąk naszych i gotowości dawania.  Dzielmy się wiarą jak chlebem, dajmy świadectwo nadziei. Bóg ofiarował nam siebie i my mamy się Nim z ludźmi dzielić.  Nikt nie zapala lampy, żeby ją schować pod korcem. Skoro Bóg nas światłem natchnął trzeba z tym światłem iść w drogę.  Dzielmy się wiarą jak chlebem, dajmy świadectwo nadziei. Bóg ofiarował nam siebie i my mamy się Nim z ludźmi dzielić.  Odrzućmy zwątpienie i trwogę, choć świat się śmieje z proroków musimy świadczyć odważnie w służbie ludziom i Bogu. ","Let us share our faith as bread, let us give witness to hope. God has given himself to us and we are to share Him with people. The bread will not fail, it will multiply during the breaking. We only need our hands and readiness to give. Let us share our faith as bread, let us give witness to hope. God has given himself to us and we are to share Him with people. No one lights a lamp to hide it under the bushel. If God has inspired us with light, we must go with the light. Let us share our faith as bread, let us give witness to hope. God has given himself to us and we are to share Him with people. Let us reject doubt and fear, although the world is laughing at the prophets, we must bravely serve the people and God."
"Dzięki, o Panie! Składamy dzięki","Dzięki, o Panie! Składamy dzięki, O Wszechmogący nasz Królu w niebie!  Za to, że dałeś nam wiarę...  Za to, że dałeś nam miłość... Dzięki, o Panie! Składamy dzięki, O Wszechmogący nasz Królu w niebie!  Za to, że dałeś nam siebie...  Ty nam przebaczasz grzechy... Dzięki, o Panie! Składamy dzięki, O Wszechmogący nasz Królu w niebie!  Ty nam przywracasz życie...  Za to, że jesteś z nami... Dzięki, o Panie! Składamy dzięki, O Wszechmogący nasz Królu w niebie!  Tobie śpiewamy z radością...  Za to, że Zmartwychwstałeś... Dzięki, o Panie! Składamy dzięki, O Wszechmogący nasz Królu w niebie!  Za to, żeś Ducha nam zesłał... ","Thanks, Lord! Thank you, O Almighty our King in Heaven! For giving us faith ... For giving us love ... Thanks, Lord! Thank you, O Almighty our King in Heaven! For giving us yourselves ... You forgive us sins ... Thanks, Lord! Thank you, O Almighty our King in Heaven! You bring us back to life ... For being with us ... Thanks, Lord! Thank you, O Almighty our King in Heaven! We sing to you with joy ... For having resurrected ... Thank you, Lord! Thank you, O Almighty our King in Heaven! For sending the Spirit to us ..."
Gdy kiedyś Pan," Gdy kiedyś Pan powróci znów, abyśmy też tam byli, gdy kiedyś Pan powróci znów.   Gdy Święci swój opuszczą grób , abyśmy też tam byli, gdy kiedyś Pan powróci znów.   Gdy Boga tron otoczą w krąg, abyśmy też tam byli, gdy kiedyś Pan powróci znów.   Gdy księgę swą otworzy Bóg, abyśmy też tam byli, gdy kiedyś Pan powróci znów.  Gdy po imieniu wezwie Pan, abyśmy też tam byli, gdy kiedyś Pan powróci znów.   Gdy ucztę nam zgotuje Bóg, abyśmy też tam byli, gdy kiedyś Pan powróci znów.  Gdy zabrzmi pieśń: Alleluja, abyśmy też tam byli, gdy kiedyś Pan powróci znów. ","When the Lord will come back again, that we should also be there when the Lord will return again. When the Saints leave the grave, so that we may also be there when the Lord returns once. When the throne of God will be surrounded, let us also be there when the Lord returns once. When God opens his book, let us also be there when the Lord returns once. When you call on the name, let us also be there when the Lord returns once. When God makes us a feast, let us also be there when the Lord returns once. When the song, Alleluia, sounds, let us also be there when the Lord returns once."
Gdy klęczę przed Tobą," Gdy klęczę przed Tobą Modlę się i składam hołd Weź ten dzień, uczyń go swym I we mnie miłość wznieć  Ave Maria Gratia plena Dominus Tecum Benedicta tu  Wszystko Tobie daję Każdy sen i każdą myśl Matko Boga, matko moja Wznieś je przed Boży tron  Ave Maria Gratia plena Dominus Tecum Benedicta tu  Gdy klęczę przed Tobą Widzę Twa radosną twarz Każda myśl, każde słowo Niech spocznie w dłoniach Twych  Ave Maria Gratia plena Dominus Tecum Benedicta tu ","When I kneel in front of you I pray and pay homage Take this day, make him yours and love me in my life Ave Maria Gratia plena Dominus Tecum Benedicta, I give you everything I sleep and every thought Mother of God, my mother, raise them before God's throne Ave Maria Gratia plena Dominus Tecum Benedicta, here, when I kneel in front of you I see Your joyful face Every thought, every word Let rest in Your hands Ave Ave Maria Gratia plena Dominus Tecum Benedicta here"
Gdy schodzimy się," Gdy schodzimy się Niech Święty Duch w nas działa Gdy schodzimy się, By sławić imię Twe Wiemy dobrze, że gdy serca są otwarte Błogosławisz mocą Swą Błogosławisz boś obiecał to Błogosławisz mocą Swą ","When we come down Let the Holy Spirit work in us When we come down, To praise your name We know well that when the hearts are open You bless with Your strength You bless You have promised that You bless with His strength"
GLORIA!!! (Na niedzielę i święta)," Gloria in excelsis Deo, Gloria Gloria!  Chwalimy Cię, błogosławimy Cię  Wielbimy Cię, wysławiamy Cię  Dzięki Ci składamy, bo wielka jest chwała Twoja. Panie Boże, Królu Nieba  Boże Ojcze Wszechmogący  Panie Synu Jednorodzony  Jezu Chryste, Jezu Chryste, Jezu Chryste!  Gloria in excelsis Deo, Gloria Gloria!  Panie Boże, Baranku Boży, Synu Ojca  Który gładzisz grzechy świata zmiłuj się nad nami,  Który gładzisz grzechy świata przyjm błaganie nasze,  Który siedzisz po prawicy Ojca zmiłuj się nad nami.  Albowiem tylko Tyś jest Święty  Tylko Tyś jest Panem Tylko Tyś Najwyższy  Jezu Chryste Z Duchem Świętym  W chwale Boga Ojca  Amen Amen Amen Amen Amen! ","Gloria in excelsis Deo, Gloria Gloria! We praise You, we bless You, We praise You, we praise You We give thanks to You, for Your glory is great. Lord God, King of Heaven, God, Father Almighty Lord, Son, only-begotten Jesus Christ, Jesus Christ, Jesus Christ! Gloria in excelsis Deo, Gloria Gloria! Lord God, Lamb of God, son of the Father, Who take away the sins of the world, have mercy on us, Who take away the sins of the world, accept our plea, Who sit at the right hand of the Father, have mercy on us. For only You are Holy Only You are Lord Only You, the Supreme Jesus Christ With the Holy Spirit In the Glory of God the Father Amen Amen Amen Amen Amen!"
Godzien o godzien jest Bóg," Godzien, o godzien jest Bóg, siedzący na tronie, Baranek wśród chwał, przyjąć wdzięczność siłę i moc, błogosławieństwo i cześć.  On Panem jest od wieków na wieki. Amen.  Będziemy niezmiernie wciąż trwać w jedności i w prawdzie, oddając Ci hołd, miłość, wdzięczność, siłę i moc, błogosławieństwo i cześć.  On Panem jest od wieków na wieki. Amen. ","Worthy, God is worthy, sitting on the throne, Lamb among the glories, gratitude, strength and power, blessing and honor. He has been Lord for ever. Amen. We will continue immeasurably in unity and in truth, giving you homage, love, gratitude, strength and power, blessing and honor. He has been Lord for ever. Amen."
Gwiazdo zaranna," Gwiazdo zaranna, obleczona w słońce  - módl się za nami  Chwały ikono, Dziewico posłuszna - módl się za nami  Gwiazdo przewodnia, Służebnico Pańska - módl się za nami  Matko żyjących, Początku Kościoła - módl się za nami  Bogarodzico, Córo Twego Syna - módl się za nam  Znaku nadziei, Mieszkanie mądrości - módl się za nami ","Morning star, clothed with the sun - pray for us Glory icon, Virgin obey - pray for us Guide star, Servant of the Lord - pray for us Mother of the living, Beginning of the Church - pray for us, the Father, daughter of your Son - pray for us us Sign of hope, Flat of wisdom - pray for us"
Idź w pokoju, Idź w pokoju    A Bóg Izraela niech  spełni prośbę Którą do Niego zaniosłeś. ,Go in peace And the God of Israel let him fulfill the request You brought to Him.
"Ja wierzę, że to Jezus"," Ja wierzę, że to Jezus, wierzę, że On Synem Boga jest. On zmarł i powstał, aby żyć i za cenę śmierci życie dał. Ref Wierzę, że jest tu teraz,  stoi pośród nas,  ma moc nas teraz uzdrawiać,  ma przebaczenia dar.  Ja wierzę Tobie Panie, wierzę, że Tyś Synem Boga jest. Zmarłeś i powstałeś, aby żyć, by za cenę śmierci życie dać. RefWierzę, że tutaj jesteś, stoisz pośród nas, masz moc nas teraz uzdrawiać,  masz przebaczenia dar. ","I believe it is Jesus, I believe that he is the Son of God. He died and rose to live and gave his life for the price of death. Ref I believe he is here now, he is standing among us, he has the power to heal us now, he has forgiveness for a gift. I believe in You, Lord, I believe that You are the Son of God. You died and arose to live, to give life for the price of death. I re-believe that you are here, you stand among us, you have the power to heal us now, you have forgiveness for a gift."
Jak Dawid," Jak Dawid, kiedy przed Bogiem był, będę tańczył ze wszystkich sił przed Panem, Królem mym.   Jak Miriam grała na bębnie swym, będę klaskać ze wszystkich sił przed Panem, Królem mym.  Pokłońmy się przed Bogiem,  oddajmy Jemu cześć, wielbijmy Imię Jezus, śpiewajmy Panu pieśń. ","Like David, when he was before God, I would dance with all my might before the Lord, my King. As Miriam played on her drum, I will clap with all my might before the Lord, my King. Let us bow to God, let us worship Him, let us praise the Name of Jesus, let us sing the song to the Lord."
Jak dobrze jest dziękować Ci," Jak dobrze jest dziękować Ci Panie i śpiewać psalm Twojemu Imieniu i opowiadać rano Twoje miłosierdzie, a w nocy wierność Twoją przy dziesięciostrunnej harfie i lutni i dźwięcznej cytrze... ",How good is to thank You Lord and sing the Psalm with Your Name and tell Your mercy in the morning and Your faithfulness at ten-string harp and lute and sonorous lyre at night ...
Jak ożywczy deszcz," Jak ożywczy deszcz Duchu Święty przyjdź  Dotknij naszych serc, rozpal ognia żar. Dziś przenikaj nas tchnieniem mocy swej, Bądź nam światłem dnia i nadzieją serc.  Dziś przenikaj nas tchnieniem mocy swej, Bądź nam światłem dnia i nadzieją serc. ","Like an invigorating rain, Holy Spirit come touch our hearts, light a fire. Today, penetrate us with the breath of your power, be with us the light of day and the hope of our hearts. Today, penetrate us with the breath of your power, be with us the light of day and the hope of our hearts."
Jak wielki jest Bóg," To On, nasz Pan i Król  odziany w majestat Swój.  Ziemio raduj się, ziemio raduj się. Okrywa światłość Go, ucieka ciemność i zło,  drży na Jego głos, drży na Jego głos.  Jak wielki jest Bóg,  jak wielki jest Bóg,  jak wielki jest Nasz Bóg.  On czas w swej dłoni ma,  od wieków na wieki trwa,  początkiem, końcem On,  początkiem, końcem On.  Jedyny w Trójcy Bóg, Ojciec, Syn i Duch,  Barankiem jest i Lwem, Barankiem jest i Lwem.  Jak wielki jest Bóg,  jak wielki jest Bóg,  jak wielki jest Nasz Bóg.  Na wieki godzien jest przyjąć chwałę, moc i cześć, ogłaszać chcę jak wielki jest Bóg.  Jak wielki jest Bóg,  jak wielki jest Bóg,  jak wielki jest Nasz Bóg. ","It is He, our Lord and King clothed in the majesty of His. Earth rejoice, earth rejoice. He covers the light of him, darkness and evil run away, trembling in his voice, trembling at his voice. How great God is, how great God is, how great God is. He has the time in his hand, has lasted forever, beginning, ending He, the beginning, the end He. The One in the Trinity God, Father, Son and Spirit, the Lamb is also the Lion, the Lamb is and the Lion. How great God is, how great God is, how great God is. It is worthy to accept glory, power and honor forever, I want to declare how great God is. How great God is, how great God is, how great God is."
Jeden chleb," Jeden chleb, co zmienia się w Chrystusa Ciało, Z wielu ziaren pszenicznych się rodzi.  Jedno wino, co się Krwią Chrystusa stało, Z soku wielu winnych gron pochodzi.  Jak ten chleb co złączył złote ziarna,  Tak niech miłość łączy nas ofiarna. Jak ten kielich łączy kropel wiele, Tak nas, Chryste, w swoim złącz Kościele.  O Pasterzu, zgromadź w jednej swej owczarni, Zabłąkane owce, które giną, W jeden Kościół zbierz na nowo i przygarnij, Byśmy jedną stali się rodziną.  Jak ten chleb co złączył złote ziarna,  Tak niech miłość łączy nas ofiarna. Jak ten kielich łączy kropel wiele, Tak nas, Chryste, w swoim złącz Kościele.  Na ramiona swoje weź, o Panie, Tych, co sami wrócić już nie mogą! Niechaj zjednoczenia cud się stanie, Prowadź nas ku niebu wspólną drogą.  Jak ten chleb co złączył złote ziarna,  Tak niech miłość łączy nas ofiarna. Jak ten kielich łączy kropel wiele, Tak nas, Chryste, w swoim złącz Kościele. ","One bread, which changes into Christ's body, many wheat grains are born. One wine, what is the Blood of Christ stood, The juice of many guilty grapes comes from. Like this bread which has connected the golden grains, Let love be united to us selfless. How this cup connects many drops, So us, Christ, in our Church connections. O Shepherd, gather in one of your sheepfolds, Stray sheep that die, In one Church, gather together and embrace, That we may become one family. Like this bread which has connected the golden grains, Let love be united to us selfless. How this cup connects many drops, So us, Christ, in our Church connections. Take your shoulders, O Lord, those who can not come back alone! Let the unity of the miracle happen, lead us to the sky along a common path. Like this bread which has connected the golden grains, Let love be united to us selfless. How this cup connects many drops, So us, Christ, in our Church connections."
Jeden jest tylko Pan," Jeden jest tylko Pan, Tutaj jest Jego dom. Klęknijcie wszyscy, którzy tu wchodzicie, I razem chwalmy Go.  Miejsce to wybrał Pan, Aby wysłuchać nas. Śpiewajcie wszyscy słudzy w Jego domu, Bogu oddajmy cześć! ","One is only the Lord, Here is His home. Kneel all who come here, and let us praise him together. This place was chosen by the Lord to hear us. Sing all the servants in his house, let us worship God!"
"Jedyny Pan, prawdziwy Bóg"," Jedyny Pan, prawdziwy Bóg  Wszystko co mam, oddaję Mu On jedynym Panem jest  Sz`ma Izrael ","The only Lord, the true God. All that I have, I give Him Him the only Lord is Szma Israel"
Jest jedno ciało," Jest jedno Ciało, jest jeden Pan, jednoczy nas w Duchu,  byśmy razem szli.  Usta głoszą chwałę Mu,  w ręku słowa Jego miecz. W moc odziani tak idziemy,  zdobywając ziemię tę.   Jesteśmy ludem Króla chwał,  Jego świętym narodem,  wybranym pokoleniem,  by objawiać Jego cześć.  Jesteśmy ludem Króla chwał,  Jego świętym narodem, wielbijmy Jezusa,  On jest Królem całej ziemi tej. ","There is one body, there is one Lord, he unites us in the Spirit so that we may go together. Mouths proclaim praise to Him, in the hand of the word His sword. In the power we clothe, we go, winning this land. We are the people of the King of glory, His holy nation, the chosen generation, to reveal His honor. We are the people of the King of glory, His holy nation, let us praise Jesus, He is the King of all this earth."
Jest zakątek na tej Ziemii," Jest zakątek na tej ziemi,  gdzie powracać każdy chce, gdzie króluje Jej Oblicze,  na Nim cięte rysy dwie. Wzrok ma smutny, zatroskany,  jakby chciała prosić cię, byś w matczyną Jej opiekę oddał się.  Madonno, Czarna Madonno, jak dobrze Twym dzieckiem być! O, pozwól, Czarna Madonno, w ramiona Twoje się skryć!  W Jej ramionach znajdziesz spokój i uchronisz się od zła,  bo dla wszystkich swoich dzieci Ona Serce czułe ma. I opieką cię otoczy, Gdy Jej serce oddasz swe, Gdy powtórzysz Jej z radością słowa te:  Madonno, Czarna Madonno, jak dobrze Twym dzieckiem być! O, pozwól, Czarna Madonno, w ramiona Twoje się skryć!  Dziś, gdy wokół nas niepokój,  Gdzie się człowiek schronić ma, Gdzie ma pójść, jak nie do Matki,  Która ukojenie da? Więc błagamy, o Madonno,  Skieruj wzrok na dzieci swe I wysłuchaj, jak śpiewamy prosząc Cię:  Madonno, Czarna Madonno, jak dobrze Twym dzieckiem być! O, pozwól, Czarna Madonno, w ramiona Twoje się skryć! ","There is a corner on this earth, where everyone wants to return, where Her Face reigns, on him two cut features. His eyes are sad, concerned, as if she wanted to ask you to give her protection to her maternal care. Madonna, Black Madonna, how good a child to be! O, let me, Black Madonna, hide in Your arms! In her arms you will find peace and protect yourself from evil, because for all her children she has a tender heart. I will take care of you, When you give her your heart, When you rejoice her with joy, these words: Madonna, Black Madonna, how good a child to be! O, let me, Black Madonna, hide in Your arms! Today, when there is anxiety around us, Where is a man to take shelter, Where to go, how not to Mother, Who will give relief? So, we beg you, Madonna, look to your children and hear how we sing, asking you, Madonna, Black Madonna, how good your baby to be! O, let me, Black Madonna, hide in Your arms!"
Jesteś blisko mnie (Twoja miłość)," Jesteś blisko mnie, a tęsknie za Duchem Twym.  Kocham kroki twe i wiem, jak pukasz do drzwi.  Przychodzisz jak ciepły wiatr, Otwieram się i czuję znów, że:  Twoja miłość jak ciepły deszcz  Twoja miłość jak morze gwiazd za dnia  Twoja miłość sprawia, że  Nieskończenie dobry Święty Duch Ogarnia mnie. ","You are close to me and I miss Your Spirit. I love your steps and I know how to knock on the door. You come like a warm wind, I'm open and I feel again that: Your love like a warm rain Your love like a sea of ​​stars by day Your love makes the Infinitely good Holy Spirit Embrace me."
Jesteś Królem," Jesteś Królem, jesteś Królem, królem jest Bóg   Podnieśmy wszyscy nasze serca,  podnieśmy wszyscy nasze dłonie,  stawajmy przed obliczem Pana,  wielbiąc Go. ","You are the King, you are the King, the king is God. Let us all raise our hearts, let us all raise our hands, we stand before the Lord, glorifying Him."
Jesteś życiem mym," Jesteś życiem mym, więc każdy  ruch robię w Tobie, Jezu! Ty pozwalasz wciąż oddychać mi.  Jesteś droga mą, więc każdy  krok stawiam w Tobie, Jezu! Ty pozwalasz wciąż oddychać mi.  Fale Twoje łaski Panie. Gdzie nie spojrzę tam, wciąż widzę Cię. Twa miłość mnie uwiodła. Jezu jakże to możliwe jest? ","You are my life, so I make every move in You, Jesus! You let me still breathe. You are my dear, so I take every step in You, Jesus! You let me still breathe. Waves, Your favors, Lord. Where I will not look there, I still see you. Your love seduced me. Jesus, how is it possible?"
Jezu mój Jezu," Jezu mój Jezu,  dziś do Ciebie mówić chcę Ty mi dajesz swojego ducha Uwielbiam Cię. ","Jesus, my Jesus, today I am talking to You, I am giving You my spirit, I adore You."
