"Bóg rzekł: ""Niechaj się zaroją wody od istot żywych, a ptactwo niechaj lata nad ziemią, pod sklepieniem nieba!"" Tak stworzył Bóg wielkie potwory morskie i wszelkiego rodzaju pływające istoty żywe, którymi zaroiły się wody, oraz wszelkie ptactwo skrzydlate różnego rodzaju. Bóg, widząc, że były dobre, pobłogosławił je tymi słowami: ""Bądźcie płodne i mnóżcie się, abyście zapełniały wody w morzach, a ptactwo niechaj się rozmnaża na ziemi"". I tak upłynął wieczór i poranek – dzień piąty. Potem Bóg rzekł: ""Niechaj ziemia wyda istoty żywe różnego rodzaju: bydło, zwierzęta pełzające i dzikie zwierzęta według ich rodzajów!"" I stało się tak: Bóg uczynił różne rodzaje dzikich zwierząt, bydła i wszelkich zwierząt pełzających po ziemi. I widział Bóg, że były dobre. A wreszcie rzekł Bóg: ""Uczyńmy człowieka na Nasz obraz, podobnego Nam. Niech panuje nad rybami morskimi, nad ptactwem podniebnym, nad bydłem, nad ziemią i nad wszystkimi zwierzętami pełzającymi po ziemi!"" Stworzył więc Bóg człowieka na swój obraz, na obraz Boży go stworzył: stworzył mężczyznę i niewiastę. Po czym Bóg im błogosławił, mówiąc do nich: ""Bądźcie płodni i rozmnażajcie się, abyście zaludnili ziemię i uczynili ją sobie poddaną; abyście panowali nad ptactwem podniebnym, nad rybami morskimi i nad wszystkimi zwierzętami pełzającymi po ziemi"". I rzekł Bóg: ""Oto wam daję wszelką roślinę przynoszącą ziarno po całej ziemi i wszelkie drzewo, którego owoc ma w sobie nasienie: dla was będą one pokarmem. A dla wszelkiego zwierzęcia polnego i dla wszelkiego ptactwa podniebnego, i dla wszystkiego, co się porusza po ziemi i ma w sobie pierwiastek życia, będzie pokarmem wszelka trawa zielona"". I tak się stało. A Bóg widział, że wszystko, co uczynił, było bardzo dobre. I tak upłynął wieczór i poranek – dzień szósty. W ten sposób zostały ukończone niebo i ziemia oraz wszystkie zastępy jej stworzeń. A gdy Bóg ukończył w dniu szóstym swe dzieło, nad którym pracował, odpoczął dnia siódmego po całym swym trudzie, jaki podjął. Wtedy Bóg pobłogosławił ów siódmy dzień i uczynił go świętym; w tym bowiem dniu odpoczął po całej swej pracy, którą wykonał, stwarzając. Oto są dzieje początków po stworzeniu nieba i ziemi. Jak jest przedziwne imię Twoje, Panie! Gdy patrzę na Twe niebo, dzieło palców Twoich, na księżyc i gwiazdy, które Ty utwierdziłeś: Czym jest człowiek, że o nim pamiętasz, czym syn człowieczy, że troszczysz się o niego?Uczyniłeś go niewiele mniejszym od aniołów, uwieńczyłeś go czcią i chwałą. Obdarzyłeś go władzą nad dziełami rąk Twoich, wszystko złożyłeś pod jego stopy:Owce i bydło wszelakie, i dzikie zwierzęta, ptaki niebieskie i ryby morskie, wszystko, co szlaki mórz przemierza. U Jezusa zebrali się faryzeusze i kilku uczonych w Piśmie, którzy przybyli z Jerozolimy. I zauważyli, że niektórzy z Jego uczniów brali posiłek nieczystymi, to znaczy nie obmytymi rękami. Faryzeusze bowiem, i w ogóle Żydzi, trzymając się tradycji starszych, nie jedzą, jeśli sobie rąk nie obmyją, rozluźniając pięść. I gdy wrócą z rynku, nie jedzą, dopóki się nie obmyją. Jest jeszcze wiele innych zwyczajów, które przejęli i których przestrzegają, jak obmywanie kubków, dzbanków, naczyń miedzianych. Zapytali Go więc faryzeusze i uczeni w Piśmie: ""Dlaczego Twoi uczniowie nie postępują według tradycji starszych, lecz jedzą nieczystymi rękami?"" Odpowiedział im: ""Słusznie prorok Izajasz powiedział o was, obłudnikach, jak jest napisane: „Ten lud czci Mnie wargami, lecz sercem swym daleko jest ode Mnie. Ale czci Mnie na próżno, ucząc zasad podanych przez ludzi”. Uchyliliście przykazanie Boże, a trzymacie się ludzkiej tradycji, dokonujecie obmywania dzbanków i kubków. I wiele innych podobnych rzeczy czynicie"". I mówił do nich: ""Sprawnie uchylacie Boże przykazanie, aby swoją tradycję zachować. Mojżesz tak powiedział: „Czcij ojca swego i matkę swoją”, oraz: „Kto złorzeczy ojcu lub matce, niech śmierć poniesie”. A wy mówicie: „Jeśli ktoś powie ojcu lub matce: Korban, to znaczy darem złożonym w ofierze jest to, co miało być ode mnie wsparciem dla ciebie” – to już nie pozwalacie mu nic uczynić dla ojca ani dla matki. I znosicie słowo Boże ze względu na waszą tradycję, którą sobie przekazaliście. Wiele też innych tym podobnych rzeczy czynicie""."
"Gdy Pan Bóg uczynił ziemię i niebo, nie było jeszcze żadnego krzewu polnego na ziemi ani żadna trawa polna jeszcze nie wzeszła – bo Pan Bóg nie zsyłał deszczu na ziemię, bo nie było człowieka, który by uprawiał ziemię, a nurt wody wypływał z ziemi, aby w ten sposób nawadniać całą powierzchnię gleby. Wtedy to Pan Bóg ulepił człowieka z prochu ziemi i tchnął w jego nozdrza tchnienie życia, wskutek czego stał się człowiek istotą żywą. A zasadziwszy ogród w Edenie na wschodzie, Pan Bóg umieścił tam człowieka, którego ulepił. Na rozkaz Pana Boga wyrosły z gleby wszelkie drzewa miłe z wyglądu i smaczny owoc rodzące oraz drzewo życia w środku tego ogrodu i drzewo poznania dobra i zła. Pan Bóg wziął zatem człowieka i umieścił go w ogrodzie Eden, aby uprawiał go i doglądał. A tak przykazał Pan Bóg człowiekowi: ""Z wszelkiego drzewa tego ogrodu możesz spożywać do woli, ale z drzewa poznania dobra i zła nie wolno ci jeść, bo gdy z niego spożyjesz, niechybnie umrzesz"". Chwal i błogosław, duszo moja, Pana Błogosław, duszo moja, Pana, Boże mój, Panie, Ty jesteś bardzo wielki! Odziany w majestat i piękno, światłem okryty jak płaszczem.Wszystko czeka na Ciebie, byś dał im pokarm we właściwym czasie. Gdy im dajesz, zbierają, gdy otwierasz swą rękę, sycą się Twym dobrem.Kiedy odbierasz im oddech, marnieją i w proch się obracają. Stwarzasz je, napełniając swym Duchem, i odnawiasz oblicze ziemi. Jezus przywołał znowu tłum do siebie i rzekł do niego: ""Słuchajcie Mnie, wszyscy, i zrozumcie! Nic nie wchodzi z zewnątrz w człowieka, co mogłoby uczynić go nieczystym; lecz to, co wychodzi z człowieka, to czyni człowieka nieczystym. Kto ma uszy do słuchania, niechaj słucha!"" Gdy się oddalił od tłumu i wszedł do domu, uczniowie pytali Go o tę przypowieść. Odpowiedział im: ""I wy tak niepojętni jesteście? Nie rozumiecie, że nic z tego, co z zewnątrz wchodzi w człowieka, nie może uczynić go nieczystym; bo nie wchodzi do jego serca, lecz do żołądka, i zostaje wydalone na zewnątrz"". Tak uznał wszystkie potrawy za czyste. I mówił dalej: ""Co wychodzi z człowieka, to czyni go nieczystym. Z wnętrza bowiem, z serca ludzkiego pochodzą złe myśli, nierząd, kradzieże, zabójstwa, cudzołóstwa, chciwość, przewrotność, podstęp, wyuzdanie, zazdrość, obelgi, pycha, głupota. Całe to zło z wnętrza pochodzi i czyni człowieka nieczystym""."
"Paweł i Barnaba powiedzieli do Żydów: „Należało głosić słowo Boże najpierw wam. Skoro jednak odrzucacie je i sami uznajecie się za niegodnych życia wiecznego, zwracamy się do pogan. Tak bowiem nakazał nam Pan: ""Ustanowiłem Cię światłością dla pogan, abyś był zbawieniem aż po krańce ziemi”. Poganie słysząc to radowali się i wielbili słowo Pańskie, a wszyscy, przeznaczeni do życia wiecznego, uwierzyli. Słowo Pańskie rozszerzało się po całym kraju. Idźcie i głoście światu Ewangelię Chwalcie Pana, wszystkie narody, wysławiajcie Go, wszystkie ludy, bo potężna nad nami Jego łaska, a wierność Pana trwa na wieki. Spośród swoich uczniów wyznaczył Pan jeszcze innych siedemdziesięciu dwóch i wysłał ich po dwóch przed sobą do każdego miasta i miejscowości, dokąd sam przyjść zamierzał. Powiedział też do nich: ""Żniwo wprawdzie wielkie, ale robotników mało; proście więc Pana żniwa, żeby wyprawił robotników na swoje żniwo. Idźcie, oto was posyłam jak owce między wilki. Nie noście z sobą trzosa ani torby, ani sandałów; i nikogo w drodze nie pozdrawiajcie. Gdy do jakiego domu wejdziecie, najpierw mówcie: „Pokój temu domowi!” Jeśli tam mieszka człowiek godny pokoju, wasz pokój spocznie na nim; jeśli nie, powróci do was. W tym samym domu zostańcie, jedząc i pijąc, co mają: bo zasługuje robotnik na swoją zapłatę.Nie przechodźcie z domu do domu. Jeśli do jakiego miasta wejdziecie i przyjmą was, jedzcie, co wam podadzą; uzdrawiajcie chorych, którzy tam są, i mówcie im: „Przybliżyło się do was królestwo Boże”."
"Tak mówi Pan: ""Przeklęty mąż, który pokłada nadzieję w człowieku i który w ciele upatruje swą siłę, a od Pana odwraca swe serce. Jest on podobny do dzikiego krzewu na stepie, nie dostrzega, gdy przychodzi szczęście; wybiera miejsca spalone na pustyni, ziemię słoną i bezludną. Błogosławiony mąż, który pokłada ufność w Panu, i Pan jest jego nadzieją. Jest on podobny do drzewa zasadzonego nad wodą, co swe korzenie puszcza ku strumieniowi; nie obawia się, gdy nadejdzie upał, bo zachowa zielone liście; także w roku posuchy nie doznaje niepokoju i nie przestaje wydawać owoców"". Szczęśliwy człowiek, który ufa Panu Szczęśliwy człowiek, który nie idzie za radą występnych, nie wchodzi na drogę grzeszników i nie zasiada w gronie szyderców, lecz w Prawie Pańskim upodobał sobie i rozmyśla nad nim dniem i nocą.On jest jak drzewo zasadzone nad płynącą wodą, które wydaje owoc w swoim czasie. Liście jego nie więdną, a wszystko, co czyni, jest udane.Co innego grzesznicy: są jak plewa, którą wiatr rozmiata. Albowiem droga sprawiedliwych jest Panu znana, a droga występnych zaginie. Jezus zszedł z Dwunastoma na dół i zatrzymał się na równinie; był tam liczny tłum Jego uczniów i wielkie mnóstwo ludu z całej Judei i z Jeruzalem oraz z nadmorskich okolic Tyru i Sydonu. On podniósł oczy na swoich uczniów i mówił: ""Błogosławieni jesteście, ubodzy, albowiem do was należy królestwo Boże. Błogosławieni, którzy teraz głodujecie, albowiem będziecie nasyceni. Błogosławieni, którzy teraz płaczecie, albowiem śmiać się będziecie. Błogosławieni jesteście, gdy ludzie was znienawidzą i gdy was wyłączą spośród siebie, gdy zelżą was i z powodu Syna Człowieczego odrzucą z pogardą wasze imię jako niecne: cieszcie się i radujcie w owym dniu, bo wielka jest wasza nagroda w niebie. Tak samo bowiem przodkowie ich czynili prorokom. Natomiast biada wam, bogaczom, bo odebraliście już pociechę waszą. Biada wam, którzy teraz jesteście syci, albowiem głód cierpieć będziecie. Biada wam, którzy się teraz śmiejecie, albowiem smucić się i płakać będziecie. Biada wam, gdy wszyscy ludzie chwalić was będą. Tak samo bowiem przodkowie ich czynili fałszywym prorokom""."
"Adam zbliżył się do swej żony, Ewy. A ona poczęła i urodziła Kaina, i rzekła: ""Otrzymałam mężczyznę od Pana"". A potem urodziła jeszcze Abla, jego brata. Abel był pasterzem trzód, a Kain uprawiał rolę. Gdy po jakimś czasie Kain składał Panu w ofierze płody roli, i również Abel składał pierwociny z drobnego bydła i z jego tłuszczu, Pan wejrzał na Abla i na jego ofiarę; na Kaina zaś i na jego ofiarę nie chciał patrzeć. Smuciło to Kaina bardzo i chodził z ponurą twarzą. Pan zapytał Kaina: ""Dlaczego jesteś smutny i dlaczego twarz twoja jest ponura? Przecież, gdybyś postępował dobrze, miałbyś twarz pogodną; jeżeli zaś nie będziesz dobrze postępował, grzech leży u wrót i czyha na ciebie, a przecież ty masz nad nim panować"". Kain zwrócił się do swego brata, Abla: ""Chodźmy na pole"". A gdy byli na polu, Kain rzucił się na swego brata, Abla, i zabił go. Wtedy Bóg zapytał Kaina: ""Gdzie jest brat twój, Abel?"" On odpowiedział: ""Nie wiem. Czyż jestem stróżem brata mego?"" Rzekł Bóg: ""Cóż uczyniłeś? Krew brata twego głośno woła ku mnie z ziemi! Bądź więc teraz przeklęty na tej roli, która rozwarła swą paszczę, aby wchłonąć krew brata twego, przelaną przez ciebie. Gdy rolę tę będziesz uprawiał, nie da ci już ona więcej plonu. Tułaczem i zbiegiem będziesz na ziemi!"" Kain rzekł do Pana: ""Zbyt wielka jest kara moja, abym mógł ją znieść. Skoro mnie teraz wypędzasz z tej roli i mam się ukrywać przed Tobą, i być tułaczem i zbiegiem na ziemi, każdy, kto mnie spotka, będzie mógł mnie zabić!"" Ale Pan mu powiedział: ""O, nie! Ktokolwiek by zabił Kaina, siedmiokrotnej pomsty doświadczy!"" Dał też Pan znamię Kainowi, aby go nie zabił nikt, kto go spotka. Adam raz jeszcze zbliżył się do swej żony i ta urodziła mu syna, któremu dała imię Set, ""gdyż – jak mówiła – dał i Bóg innego potomka w zamian za Abla, którego zabił Kain"". Składajcie Bogu dziękczynną ofiarę Przemówił Pan, Bóg nad bogami, i wezwał ziemię od wschodu do zachodu słońca. ""Nie oskarżam cię za twoje ofiary, bo twe całopalenia zawsze są przede Mną"".""Czemu wymieniasz moje przykazania i na ustach masz moje przymierze? Ty, co nienawidzisz karności, a słowa moje odrzuciłeś za siebie?""""Zasiadłszy, przemawiasz przeciw bratu, znieważasz syna swej matki. Ty tak postępujesz, a Ja mam milczeć? Czy myślisz, że jestem podobny do ciebie? Skarcę ciebie i postawię ci to przed oczy"". Faryzeusze zaczęli rozprawiać z Jezusem, a chcąc wystawić Go na próbę, domagali się od Niego znaku. On zaś westchnął w głębi duszy i rzekł: ""Czemu to plemię domaga się znaku? Zaprawdę, powiadam wam: żaden znak nie będzie dany temu plemieniu"". A zostawiwszy ich, wsiadł z powrotem do łodzi i odpłynął na drugą stronę."
"Bóg pobłogosławił Noego i jego synów, mówiąc do nich: ""Bądźcie płodni i mnóżcie się, abyście zaludnili ziemię. Wszelkie zaś zwierzę na ziemi i wszelkie ptactwo podniebne niechaj się was boi i lęka. Wszystko, co się porusza na ziemi, i wszystkie ryby morskie zostały oddane wam we władanie. Wszystko, co się porusza i żyje, jest przeznaczone dla was na pokarm, tak jak rośliny zielone, daję wam wszystko. Nie wolno wam tylko jeść mięsa z krwią życia. Upomnę się o waszą krew przez wzgląd na wasze życie – upomnę się o nią u każdego zwierzęcia. Upomnę się też u człowieka o życie człowieka i u każdego – o życie brata. Jeśli ktoś przeleje krew ludzką, przez ludzi ma być przelana krew jego, bo człowiek został stworzony na obraz Boga. Wy zaś bądźcie płodni i mnóżcie się; zaludniajcie ziemię i miejcie nad nią władzę"". Potem Bóg tak rzekł do Noego i do jego synów: ""Oto Ja zawieram przymierze z wami i z waszym potomstwem, które po was będzie; z wszelką istotą żywą, która jest z wami: z ptactwem, ze zwierzętami domowymi i polnymi, jakie są przy was, ze wszystkimi, które wyszły z arki, z wszelkim zwierzęciem na ziemi. Zawieram z wami przymierze, tak iż nigdy już nie zostanie zgładzona wodami potopu żadna istota żywa i już nigdy nie będzie potopu niszczącego ziemię"". Po czym Bóg dodał: ""A to jest znak przymierza, które Ja zawieram z wami i każdą istotą żywą, jaka jest z wami, na wieczne czasy: Łuk mój kładę na obłoki, aby był znakiem przymierza między Mną a ziemią"". Bóg z wyżyn nieba spogląda na ziemię Poganie będą się bali imienia Pana, a Twej chwały wszyscy królowie ziemi, bo Pan odbuduje Syjon i ukaże się w swym majestacie.Pan przychyli się ku modlitwie opuszczonych i nie odrzuci ich modłów. Należy to zapisać dla przyszłych pokoleń, lud, który się narodzi, niech wychwala Pana.Spojrzał Pan z wysokości swego przybytku, popatrzył z nieba na ziemię, aby usłyszeć jęki uwięzionych, aby skazanych na śmierć uwolnić.Synowie sług Twoich bezpiecznie mieszkać będą, a ich potomstwo będzie trwało w Twej obecności. Aby imię Pana głoszono na Syjonie i w Jeruzalem Jego chwałę, kiedy zgromadzą się razem narody i królestwa, aby służyć Panu. Jezus udał się ze swoimi uczniami do wiosek pod Cezareą Filipową. W drodze pytał uczniów: ""Za kogo uważają Mnie ludzie?"" Oni Mu odpowiedzieli: ""Za Jana Chrzciciela, inni za Eliasza, jeszcze inni za jednego z proroków"". On ich zapytał: ""A wy za kogo Mnie uważacie?"" Odpowiedział Mu Piotr: ""Ty jesteś Mesjasz"". Wtedy surowo im przykazał, żeby nikomu o Nim nie mówili. I zaczął ich pouczać, że Syn Człowieczy wiele musi wycierpieć, że będzie odrzucony przez starszych, arcykapłanów i uczonych w Piśmie; że zostanie zabity, ale po trzech dniach zmartwychwstanie. A mówił zupełnie otwarcie te słowa. Wtedy Piotr wziął Go na bok i zaczął Go upominać. Lecz On obrócił się i patrząc na swych uczniów, zgromił Piotra słowami: ""Zejdź Mi z oczu, szatanie, bo nie myślisz po Bożemu, lecz po ludzku""."
"Saul wyruszył ku pustyni Zif, a wraz z nim trzy tysiące doborowych Izraelitów, aby wpaść na trop Dawida na pustyni Zif. Dawid wraz z Abiszajem zakradli się w nocy do obozu; Saul właśnie spał w środku obozowiska, a jego dzida była wbita w ziemię obok głowy. Abner i ludzie leżeli uśpieni dokoła niego. Rzekł więc Abiszaj do Dawida: ""Dziś Bóg oddaje wroga twojego w twe ręce. Teraz pozwól, że przybiję go dzidą do ziemi, jednym pchnięciem, drugiego nie będzie trzeba"". Dawid odparł Abiszajowi: ""Nie zabijaj go! Któż bowiem podniósłby rękę na pomazańca Pańskiego, a nie poniósł kary?"" Wziął więc Dawid dzidę i bukłak na wodę od wezgłowia Saula i poszli sobie. Nikt ich nie spostrzegł, nikt o nich nie wiedział, nikt się nie obudził. Wszyscy spali, gdyż Pan zesłał na nich twardy sen. Dawid oddalił się na przeciwległą stronę i stanął na wierzchołku góry w oddali, a dzieliła go od nich spora odległość. Wtedy Dawid zawołał do Saula: ""Oto dzida królewska, niech przyjdzie który z pachołków i weźmie ją. Pan nagradza człowieka za sprawiedliwość i wierność: Pan dał mi ciebie w ręce, lecz ja nie podniosłem ich przeciw pomazańcowi Pańskiemu"". Pan jest łaskawy, pełen miłosierdzia Błogosław, duszo moja, Pana, i wszystko, co jest we mnie, święte imię Jego. Błogosław, duszo moja, Pana i nie zapominaj o wszystkich Jego dobrodziejstwach.On odpuszcza wszystkie twoje winy i leczy wszystkie choroby. On twoje życie ratuje od zguby, obdarza cię łaską i zmiłowaniem.Miłosierny jest Pan i łaskawy, nieskory do gniewu i bardzo cierpliwy. Nie postępuje z nami według naszych grzechów ani według win naszych nam nie odpłaca.Jak odległy jest wschód od zachodu, tak daleko odsuwa od nas nasze winy. Jak ojciec lituje się nad dziećmi, tak Pan się lituje nad tymi, którzy cześć Mu oddają. Jezus powiedział do swoich uczniów: ""Powiadam wam, którzy słuchacie: Miłujcie waszych nieprzyjaciół; dobrze czyńcie tym, którzy was nienawidzą; błogosławcie tym, którzy was przeklinają, i módlcie się za tych, którzy was oczerniają. Jeśli cię kto uderzy w policzek, nadstaw mu i drugi. Jeśli zabiera ci płaszcz, nie broń mu i szaty. Dawaj każdemu, kto cię prosi, a nie dopominaj się zwrotu od tego, który bierze twoje. Jak chcecie, żeby ludzie wam czynili, podobnie wy im czyńcie. Jeśli bowiem miłujecie tych tylko, którzy was miłują, jakaż za to należy się wam wdzięczność? Przecież i grzesznicy okazują miłość tym, którzy ich miłują. I jeśli dobrze czynicie tym tylko, którzy wam dobrze czynią, jaka za to należy się wam wdzięczność? I grzesznicy to samo czynią. Jeśli pożyczek udzielacie tym, od których spodziewacie się zwrotu, jakaż za to należy się wam wdzięczność? I grzesznicy pożyczają grzesznikom, żeby tyleż samo otrzymać. Wy natomiast miłujcie waszych nieprzyjaciół, czyńcie dobrze i pożyczajcie, niczego się za to nie spodziewając. A wasza nagroda będzie wielka i będziecie synami Najwyższego; ponieważ On jest dobry dla niewdzięcznych i złych. Bądźcie miłosierni, jak Ojciec wasz jest miłosierny. Nie sądźcie, a nie będziecie sądzeni; nie potępiajcie, a nie będziecie potępieni; odpuszczajcie, a będzie wam odpuszczone. Dawajcie, a będzie wam dane; miarę dobrą, ubitą, utrzęsioną i wypełnioną ponad brzegi wsypią w zanadrza wasze. Odmierzą wam bowiem taką miarą, jaką wy mierzycie""."
"Cała mądrość od Pana pochodzi i z Nim jest na wieki. Piasek morski, krople deszczu i dni wieczności któż może policzyć? Wysokość nieba, szerokość ziemi, przepaść i mądrość któż potrafi zbadać? Jako pierwsza przed wszystkim stworzona została mądrość, a rozum roztropny jest od wieków. Korzeń mądrości komuż został objawiony, a dzieła jej wszechstronnych umiejętności któż poznał? Jest Jeden mądry, co bardzo lękiem przejmuje, Zasiadający na swoim tronie. To Pan ją stworzył, przejrzał, policzył i wylał ją na wszystkie swe dzieła, na wszystkie stworzenia jako swój dar, a tych, co Go miłują, hojnie w nią wyposażył. Pan Bóg króluje, pełen majestatu Pan króluje, oblókł się w majestat, Pan wdział potęgę i nią się przepasał. Tak świat utwierdził, że się nie zachwieje.Twój tron niewzruszony na wieki, istniejesz od wieków, Boże. Świadectwa Twoje bardzo godne są wiary; Twojemu domowi świętość przystoi po wszystkie dni, o Panie. Gdy Jezus z Piotrem, Jakubem i Janem zstąpił z góry i przyszedł do uczniów, ujrzał wielki tłum wokół nich i uczonych w Piśmie, którzy rozprawiali z nimi. Skoro Go zobaczyli, zaraz podziw ogarnął cały tłum i przybiegając, witali Go. On ich zapytał: ""O czym rozprawiacie z nimi?"" Jeden z tłumu odpowiedział Mu: ""Nauczycielu, przyprowadziłem do Ciebie mojego syna, który ma ducha niemego. Ten, gdziekolwiek go pochwyci, rzuca nim, a on wtedy się pieni, zgrzyta zębami i drętwieje. Powiedziałem Twoim uczniom, żeby go wyrzucili, ale nie mogli"". Odpowiadając im, Jezus rzekł: ""O plemię niewierne, jak długo mam być z wami? Jak długo mam was znosić? Przyprowadźcie go do Mnie!"" I przywiedli go do Niego. Na widok Jezusa duch zaraz począł miotać chłopcem, tak że upadł na ziemię i tarzał się z pianą na ustach. Jezus zapytał ojca: ""Od jak dawna to mu się zdarza?"" Ten zaś odrzekł: ""Od dzieciństwa. I często wrzucał go nawet w ogień i w wodę, żeby go zgubić. Lecz jeśli coś możesz, zlituj się nad nami i pomóż nam"". Jezus mu odrzekł: ""Jeśli możesz? Wszystko możliwe jest dla tego, kto wierzy"". Zaraz ojciec chłopca zawołał: ""Wierzę, zaradź memu niedowiarstwu!"" A Jezus, widząc, że tłum się zbiega, rozkazał surowo duchowi nieczystemu: ""Duchu niemy i głuchy, rozkazuję ci, wyjdź z niego i więcej w niego nie wchodź!"" A ten krzyknął i wyszedł, silnie nim miotając. Chłopiec zaś pozostawał jak martwy, tak że wielu mówiło: ""On umarł"". Lecz Jezus ujął go za rękę i podniósł, a on wstał. A gdy przyszedł do domu, uczniowie pytali Go na osobności: ""Dlaczego my nie mogliśmy go wyrzucić?"" Powiedział im: ""Ten rodzaj można wyrzucić tylko modlitwą i postem""."
"Dziecko, jeśli masz zamiar służyć Panu, przygotuj swą duszę na doświadczenia! Zachowaj spokój serca i bądź cierpliwy, a nie trać równowagi w czasie utrapienia! Przylgnij do Niego i nie odstępuj, abyś był wywyższony w twoim dniu ostatnim. Przyjmij wszystko, co przyjdzie na ciebie, a w zmiennych losach poniżenia bądź wytrzymały! Bo w ogniu próbuje się złoto, a ludzi miłych Bogu – w piecu poniżenia. Bądź Mu wierny, a On zajmie się tobą, prostuj swe drogi i Jemu zaufaj! Którzy boicie się Pana, oczekujcie Jego zmiłowania, nie zbaczajcie z drogi, abyście nie upadli. Którzy boicie się Pana, zawierzcie Mu, a nie przepadnie wasza zapłata. Którzy boicie się Pana, spodziewajcie się dobra, wiecznego wesela i zmiłowania! Popatrzcie na dawne pokolenia i zobaczcie: kto zaufał Panu, a został zawstydzony? Albo kto trwał w bojaźni Pańskiej, a został opuszczony? Albo kto wzywał Go, a On nim wzgardził? Dlatego że Pan jest litościwy i miłosierny, odpuszcza grzechy i wybawia w czasie ucisku. Zaufaj Panu, On sam będzie działał Miej ufność w Panu i czyń to, co dobre, a będziesz mieszkał na ziemi i żył bezpiecznie. Raduj się w Panu, a On spełni pragnienia twego serca.Pan zna dni postępujących uczciwie, a ich dziedzictwo trwać będzie na wieki. W czasie klęski nie zaznają wstydu,  w dniach głodu zostaną nasyceni.Odstąp od złego i czyń dobro, abyś mógł przetrwać na wieki. Gdyż Pan sprawiedliwość miłuje i nie opuszcza swych świętych.Zbawienie sprawiedliwych pochodzi od Pana, On ich ucieczką w czasie utrapienia. Pan ich wspomaga i wyzwala, wyzwala od występnych i zachowuje, On bowiem jest ich ucieczką. Jezus i Jego uczniowie przemierzali Galileę, On jednak nie chciał, żeby ktoś o tym wiedział. Pouczał bowiem swoich uczniów i mówił im: ""Syn Człowieczy będzie wydany w ręce ludzi. Ci Go zabiją, lecz zabity, po trzech dniach zmartwychwstanie"". Oni jednak nie rozumieli tych słów, a bali się Go pytać. Tak przyszli do Kafarnaum. Gdy był już w domu, zapytał ich: ""O czym to rozprawialiście w drodze?"" Lecz oni milczeli, w drodze bowiem posprzeczali się między sobą o to, kto z nich jest największy. On usiadł, przywołał Dwunastu i rzekł do nich: ""Jeśli ktoś chce być pierwszym, niech będzie ostatnim ze wszystkich i sługą wszystkich"". Potem wziął dziecko, postawił je przed nimi i objąwszy je ramionami, rzekł do nich: ""Kto jedno z tych dzieci przyjmuje w imię moje, Mnie przyjmuje; a kto Mnie przyjmuje, nie przyjmuje Mnie, lecz Tego, który Mnie posłał""."
