"Pan przemówił do Achaza tymi słowami: „Proś dla siebie o znak od Pana, Boga twego, czy to głęboko w Szeolu, czy to wysoko w górze”. Lecz Achaz odpowiedział: „Nie będę prosił i nie będę wystawiał Pana na próbę”. Wtedy rzekł Izajasz: „Słuchajcie więc, domu Dawidowy: Czyż mało wam naprzykrzać się ludziom, iż naprzykrzacie się także mojemu Bogu? Dlatego Pan sam da wam znak: Oto Panna pocznie i porodzi Syna, I nazwie Go imieniem Emanuel”. Przybądź, o Panie, Tyś jest Królem chwały Do Pana należy ziemia i wszystko, co ją napełnia,    świat i jego mieszkańcy.   Albowiem On go na morzach osadził    i utwierdził ponad rzekami.Kto wstąpi na górę Pana,    kto stanie w Jego świętym miejscu?   Człowiek rąk nieskalanych i czystego serca,    który nie skłonił swej duszy ku marnościom.On otrzyma błogosławieństwo od Pana    i zapłatę od Boga, swego Zbawcy.   Oto pokolenie tych, którzy Go szukają,    którzy szukają oblicza Boga Jakuba. Bóg posłał anioła Gabriela do miasta w Galilei, zwanego Nazaret, do Dziewicy poślubionej mężowi, imieniem Józef, z rodu Dawida; a Dziewicy było na imię Maryja. Anioł wszedł do Niej i rzekł: „Bądź pozdrowiona, pełna łaski, Pan z Tobą”. Ona zmieszała się na te słowa i rozważała, co miałoby znaczyć to pozdrowienie.ecz anioł rzekł do Niej: „Nie bój się, Maryjo, znalazłaś bowiem łaskę u Boga. Oto poczniesz i porodzisz Syna, któremu nadasz imię Jezus. Będzie On wielki i będzie nazwany Synem Najwyższego, a Pan Bóg da Mu tron Jego ojca, Dawida. Będzie panował nad domem Jakuba na wieki, a Jego panowaniu nie będzie końca”. Na to Maryja rzekła do anioła: „Jakże się to stanie, skoro nie znam męża?” Anioł Jej odpowiedział: „Duch Święty zstąpi na Ciebie i moc Najwyższego osłoni Cię. Dlatego też Święte, które się narodzi, będzie nazwane Synem Bożym. A oto również krewna Twoja, Elżbieta, poczęła w swej starości syna i jest już w szóstym miesiącu ta, która uchodzi za niepłodną. Dla Boga bowiem nie ma nic niemożliwego”. Na to rzekła Maryja: „Oto ja służebnica Pańska, niech mi się stanie według twego słowa”. Wtedy odszedł od Niej anioł."
"W Sorea, w pokoleniu Dana, żył pewien mąż imieniem Manoach. Żona jego była niepłodna i nie rodziła. Anioł Pański ukazał się owej kobiecie mówiąc jej: „Otoś teraz niepłodna i nie rodziłaś, ale poczniesz i porodzisz syna. Lecz odtąd strzeż się: nie pij wina ani sycery i nie jedz nic nieczystego. Oto poczniesz i porodzisz syna, a brzytwa nie dotknie jego głowy, gdyż chłopiec ten będzie Bożym nazirejczykiem od chwili urodzenia. On to zacznie wybawiać Izraelitów z rąk filistyńskich”. Poszła więc kobieta do swego męża i tak rzekła do niego: „Przyszedł do mnie mąż Boży, którego oblicze było jakby oblicze anioła Bożego, pełne dostojeństwa. Nie pytałam go, skąd przybył, a on nie oznajmił mi swego imienia. Rzekł do mnie: ""Oto poczniesz i porodzisz syna, lecz odtąd nie pij wina ani sycery, ani nie jedz nic nieczystego, bo chłopiec ten będzie Bożym nazirejczykiem od chwili urodzenia aż do swojej śmierci"". Porodziła więc owa kobieta syna i nazwała go imieniem Samson. Chłopiec rósł, a Pan mu błogosławił. Duch zaś Pana począł na niego oddziaływać. Będę opiewał chwałę Twoją, Boże Bądź dla mnie skałą schronienia   i zamkiem warownym, aby mnie ocalić.  Bo Ty jesteś moją opoką i twierdzą,   Boże mój, wyrwij mnie z rąk niegodziwca.Bo Ty, mój Boże, jesteś moją nadzieją,   Panie, Tobie ufam od lat młodości.  Ty byłeś moją podporą od dnia narodzin,   od łona matki moim opiekunem.Opowiem o potędze Pana,   będę przypominał tylko Twoją sprawiedliwość.  Boże, Ty mnie uczyłeś od mojej młodości   i do tej chwili głoszę Twoje cuda. Za czasów Heroda, króla Judei, żył pewien kapłan, imieniem Zachariasz, z oddziału Abiasza. Miał on żonę z rodu Aarona, a na imię było jej Elżbieta. Oboje byli sprawiedliwi wobec Boga i postępowali nienagannie według wszystkich przykazań i przepisów Pańskich. Nie mieli jednak dziecka, ponieważ Elżbieta była niepłodna; oboje zaś byli już posunięci w latach. Kiedy Zachariasz w wyznaczonej dla swego oddziału kolei pełnił służbę kapłańską przed Bogiem, jemu zgodnie ze zwyczajem kapłańskim przypadł los, żeby wejść do przybytku Pańskiego i złożyć ofiarę kadzenia. A cały lud modlił się na zewnątrz w czasie kadzenia. Naraz ukazał mu się anioł Pański, stojący po prawej stronie ołtarza kadzenia. Przeraził się na ten widok Zachariasz i strach padł na niego. Lecz anioł rzekł do niego: „Nie bój się, Zachariaszu; twoja prośba została wysłuchana: żona twoja Elżbieta urodzi ci syna, któremu nadasz imię Jan. Będzie to dla ciebie radość i wesele; i wielu z jego narodzenia cieszyć się będzie. Będzie bowiem wielki w oczach Pana; wina i sycery pić nie będzie i już w łonie matki napełniony będzie Duchem Świętym. Wielu spośród dzieci Izraela nawróci do Pana, Boga ich; on sam pójdzie przed Nim w duchu i mocy Eliasza, żeby serca ojców nakłonić ku dzieciom, a nieposłusznych do usposobienia sprawiedliwych, by przygotować Panu lud doskonały”. Na to rzekł Zachariasz do anioła: „Po czym to poznam? Bo ja jestem już stary i moja żona jest w podeszłym wieku”. Odpowiedział mu anioł: „Ja jestem Gabriel, który stoję przed Bogiem. A zostałem posłany, aby mówić z tobą i oznajmić ci tę wieść radosną. A oto będziesz niemy i nie będziesz mógł mówić aż do dnia, w którym się to stanie, bo nie uwierzyłeś moim słowom, które się spełnią w swoim czasie”. Lud tymczasem czekał na Zachariasza. I dziwił się, że tak długo zatrzymuje się w przybytku. Kiedy wyszedł, nie mógł do nich mówić i zrozumieli, że miał widzenie w przybytku. On zaś dawał im znaki i pozostał niemy. A gdy upłynęły dni jego posługi kapłańskiej, powrócił do swego domu. Potem żona jego, Elżbieta, poczęła i pozostawała w ukryciu przez pięć miesięcy i mówiła: „Tak uczynił mi Pan wówczas, kiedy wejrzał łaskawie i zdjął ze mnie hańbę w oczach ludzi”."
"„Pan mówi: Oto nadejdą dni, kiedy wzbudzę Dawidowi Odrośl sprawiedliwą. Będzie panował jako król, postępując roztropnie, i będzie wykonywał prawo i sprawiedliwość na ziemi. W jego dniach Juda dostąpi zbawienia, a Izrael będzie mieszkał bezpiecznie. To zaś będzie imię, którym go będą nazywać: ""Pan naszą sprawiedliwością"". Dlatego oto nadejdą dni, mówi Pan, kiedy nie będą już mówić: ""Na życie Pana, który wyprowadził synów Izraela z ziemi egipskiej!"" lecz raczej: ""Na życie Pana, który wyprowadził i przywrócił pokolenie domu Izraela z ziemi północnej i ze wszystkich ziem, po których ich rozproszył"", tak że będą mogli mieszkać w swej ziemi”. Pokój zakwitnie, kiedy Pan przybędzie BożeBoże, przekaż Twój sąd Królowi,  a Twoją sprawiedliwość synowi królewskiemu. Aby Twoim ludem rządził sprawiedliwie  i ubogimi według prawa.BożeWyzwoli bowiem biedaka, który Go wzywa,  i ubogiego, co nie ma opieki. Zmiłuje się nad biednym i ubogim,  nędzarza ocali od śmierci.BożeBłogosławiony niech będzie Pan, Bóg Izraela,  który sam czyni cuda. Na wieki niech będzie błogosławione Jego imię,  a Jego chwała niech wypełni ziemię. Z narodzeniem Jezusa Chrystusa było tak. Po zaślubinach Matki Jego, Maryi, z Józefem, wpierw nim zamieszkali razem, znalazła się brzemienną za sprawą Ducha Świętego. Mąż Jej, Józef, który był człowiekiem prawym i nie chciał narazić Jej na zniesławienie, zamierzał oddalić Ją potajemnie. Gdy powziął tę myśl, oto anioł Pański ukazał mu się we śnie i rzekł: „Józefie, synu Dawida, nie bój się wziąć do siebie Maryi, twej Małżonki; albowiem z Ducha Świętego jest to, co się w Niej poczęło. Porodzi Syna, któremu nadasz imię Jezus, On bowiem zbawi swój lud od jego grzechów”. A stało się to wszystko, aby się wypełniło słowo Pańskie powiedziane przez proroka: „Oto Dziewica pocznie i porodzi Syna, któremu nadadzą imię Emmanuel, to znaczy ""Bóg z nami"". Zbudziwszy się ze snu, Józef uczynił tak, jak mu polecił anioł Pański: wziął swoją Małżonkę do siebie."
"Wyśpiewuj, Córo Syjońska, podnieś radosny okrzyk, Izraelu! Ciesz się i wesel z całego serca, Córo Jeruzalem! Pan oddalił wyroki na ciebie, usunął twego nieprzyjaciela; Król Izraela, Pan, jest pośród ciebie, już nie będziesz bała się złego. Owego dnia powiedzą Jerozolimie: „Nie bój się, Syjonie! Niech nie słabną twe ręce!”. Pan, twój Bóg jest pośród ciebie, Mocarz, który daje zbawienie. On uniesie się weselem nad tobą, odnowi swą miłość, wzniesie okrzyk radości, jak w dniu uroczystego święta. Głośmy z weselem, Bóg jest między nami Oto Bóg jest moim zbawieniem,    będę miał ufność i bać się nie będę.   Bo Pan jest moją mocą i pieśnią,    On stał się dla mnie zbawieniem.Wy zaś z weselem czerpać będziecie wodę    ze zdrojów zbawienia.   Chwalcie Pana, wzywajcie Jego imienia,    dajcie poznać Jego dzieła między narodami,    przypominajcie, że wspaniałe jest imię Jego.Śpiewajcie Panu, bo uczynił wzniosłe rzeczy,    niech to będzie wiadome po całej ziemi.   Wznoś okrzyki i wołaj z radości, mieszkanko Syjonu    bo wielki jest pośród ciebie, Święty Izraela. Gdy Jan nauczał nad Jordanem, pytały go tłumy: „Cóż mamy czynić?”. On im odpowiadał: „Kto ma dwie suknie, niech jedną da temu, który nie ma; a kto ma żywność, niech tak samo czyni”. Przychodzili także celnicy, żeby przyjąć chrzest, i pytali Go: „Nauczycielu, co mamy czynić?”. On im odpowiadał: „Nie pobierajcie nic więcej ponad to, ile wam wyznaczono”. Pytali go też i żołnierze: „A my, co mamy czynić?”. On im odpowiadał: „Nad nikim się nie znęcajcie i nikogo nie uciskajcie, lecz poprzestawajcie na swoim żołdzie”. Gdy więc lud oczekiwał z napięciem i wszyscy snuli domysły w sercach co do Jana, czy nie jest on Mesjaszem, on tak przemówił do wszystkich: „Ja was chrzczę wodą; lecz idzie mocniejszy ode mnie, któremu nie jestem godzien rozwiązać rzemyka u sandałów. On chrzcić was będzie Duchem Świętym i ogniem. Ma On wiejadło w ręku dla oczyszczenia swego omłotu: pszenicę zbierze do spichrza, a plewy spali w ogniu nieugaszonym”. Wiele też innych napomnień dawał ludowi i głosił dobrą nowinę."
"Ja, twój Bóg, ująłem cię za prawicę mówiąc ci: „Nie lękaj się, przychodzę ci z pomocą”. Nie bój się, robaczku, Jakubie, nieboraku, o Izraelu! Ja cię wspomagam, mówi Pan, odkupiciel twój, Święty Izraela. Oto Ja przemieniam cię w młocarskie sanie, nowe, o podwójnym rzędzie zębów: Ty zmłócisz i wykruszysz góry, zmienisz pagórki w drobną sieczkę. Ty je przewiejesz, a wicher je porwie i trąba powietrzna rozmiecie. Ty natomiast rozradujesz się w Panu, chlubić się będziesz w Świętym Izraela. Nędzni i biedni szukają wody, i nie ma! Ich język wysechł już z pragnienia. Ja, Pan, wysłucham ich, nie opuszczę ich Ja, Bóg Izraela. Każę wytrysnąć strumieniom na nagich wzgórzach i źródłom wód w pośrodku nizin. Zamienię pustynię na pojezierze, a wyschniętą ziemię na wodotryski. Na pustyni zasadzę cedry, akacje, mirty i oliwki; rozkrzewię na pustkowiu cyprysy, wiązy i bukszpan obok siebie. Ażeby widzieli i poznali, rozważyli i pojęli wszyscy, że ręka Pana to uczyniła, że Święty Izraela tego dokonał. Pan jest łagodny i bardzo łaskawy Będę Ciebie wielbił, Boże mój i Królu,  i sławił Twoje imię przez wszystkie wieki. Pan jest dobry dla wszystkich,  a Jego miłosierdzie nad wszystkim, co stworzył.Niech Cię wielbią, Panie, wszystkie Twoje dzieła  i niech Cię błogosławią Twoi święci. Niech mówią o chwale Twojego królestwa  i niech głoszą Twoją potęgę.Aby synom ludzkim oznajmić Twoją potęgę  i wspaniałość chwały Twojego królestwa. Królestwo Twoje królestwem wszystkich wieków,  przez wszystkie pokolenia Twoje panowanie. Jezus powiedział do tłumów: „Zaprawdę powiadam wam: Między narodzonymi z niewiast nie powstał większy od Jana Chrzciciela. Lecz najmniejszy w królestwie niebieskim większy jest niż on. A od czasu Jana Chrzciciela aż dotąd królestwo niebieskie doznaje gwałtu i ludzie gwałtowni zdobywają je. Wszyscy bowiem Prorocy i Prawo prorokowali aż do Jana. A jeśli chcecie przyjąć, to on jest Eliaszem, który ma przyjść. Kto ma uszy, niechaj słucha”."
"„Z kimże byście mogli Mnie porównać, tak, żeby Mi dorównał?” — mówi Święty. Podnieście oczy w górę i patrzcie: Kto stworzył te gwiazdy? Ten, który w szykach prowadzi ich wojsko, wszystkie je woła po imieniu. Spod takiej potęgi i olbrzymiej siły nikt się nie uchyli. Czemu mówisz, Jakubie, i ty, Izraelu, powtarzasz: „Zakryta jest moja droga przed Panem i prawo me przed Bogiem przeoczone?” Czy nie wiesz tego? Czyś nie słyszał? Pan to Bóg wieczny, Stwórca krańców ziemi. On się nie męczy ani nie nuży, Jego mądrość jest niezgłębiona. On dodaje mocy zmęczonemu i pomnaża siły omdlałego. Chłopcy się męczą i nużą, chwieją się słabnąc młodzieńcy; lecz ci, co zaufali Panu, odzyskują siły, otrzymują skrzydła jak orły; biegną bez zmęczenia, bez znużenia idą. Chwal i błogosław, duszo moja, Pana Błogosław, duszo moja, Pana   i wszystko, co jest we mnie, święte imię Jego.  Błogosław, duszo moja, Pana   i nie zapominaj o wszystkich Jego dobrodziejstwach.On odpuszcza wszystkie twoje winy   i uleczy wszystkie choroby,  On twoje życie ratuje od zguby,   obdarza cię łaską i zmiłowaniem.Miłosierny jest Pan i łaskawy,   nieskory do gniewu i bardzo cierpliwy.  Nie postępuje z nami według naszych grzechów   ani według win naszych nam nie odpłaca. Jezus przemówił tymi słowami: „Przyjdźcie do Mnie wszyscy, którzy utrudzeni i obciążeni jesteście, a Ja was pokrzepię. Weźmijcie moje jarzmo na siebie i uczcie się ode Mnie, bo jestem łagodny i pokorny sercem, a znajdziecie ukojenie dla dusz waszych. Albowiem jarzmo moje jest słodkie, a moje brzemię lekkie”."
"„Pocieszcie, pocieszcie mój lud!” mówi wasz Bóg. „Przemawiajcie do serca Jeruzalem i wołajcie do niego, że czas jego służby się skończył, że nieprawość jego odpokutowana, bo odebrało z ręki Pana karę w dwójnasób za wszystkie swe grzechy”. Głos się rozlega: „Przygotujcie na pustyni drogę dla Pana, wyrównajcie na pustkowiu gościniec naszemu Bogu! Niech się podniosą wszystkie doliny, a wszystkie góry i wzgórza obniżą; równiną niechaj się staną urwiska, a strome zbocza niziną gładką. Wtedy się chwała Pana objawi, zobaczy ją wszelkie ciało, bo powiedziały to usta Pana”. Głos się odzywa: „Wołaj!” — I rzekłem: Co mam wołać? — „Wszelkie ciało to jakby trawa, a cały wdzięk jego jest niby kwiat polny. Trawa usycha, więdnie kwiat, gdy na nie wiatr Pana powieje. Prawdziwie trawą jest naród. Trawa usycha, więdnie kwiat, lecz słowo Boga naszego trwa na wieki”. Wstąpże na wysoką górę, zwiastunko dobrej nowiny w Syjonie! Podnieś mocno twój głos, zwiastunko dobrej nowiny w Jeruzalem! Podnieś głos, nie bój się! Powiedz miastom judzkim: „Oto wasz Bóg!” Oto Pan, Bóg, przychodzi z mocą i ramię Jego dzierży władzę. Oto Jego nagroda z Nim idzie i przed Nim Jego zapłata. Podobnie pasterz pasie swą trzodę, gromadzi ją swoim ramieniem, jagnięta nosi na swej piersi, owce karmiące prowadzi łagodnie. Oto nasz Pan Bóg przyjdzie z wielką mocą Śpiewajcie Panu pieśń nową,  śpiewaj Panu ziemio cała. Śpiewajcie Panu, sławcie Jego imię,  każdego dnia głoście Jego zbawienie.Głoście Jego chwałę wśród wszystkich narodów,  rozgłaszajcie cuda pośród wszystkich ludów. Głoście wśród ludów, że Pan jest królem,  będzie sprawiedliwie sądził wszystkie ludy.Niech się radują niebiosa i ziemia weseli,  niech szumi morze i wszystko, co je napełnia. Niech się cieszą pola i wszystko, co na nich rośnie,  niech wszystkie drzewa w lasach wykrzykują z radości.Przed obliczem Pana, który już się zbliża,  który już się zbliża, by sądzić ziemię, On będzie sądził świat sprawiedliwie,  a lud według swej prawdy. Jezus powiedział do swoich uczniów: „Jak wam się zdaje? Jeśli kto posiada sto owiec i zabłąka się jedna z nich: czy nie zostawi dziewięćdziesięciu dziewięciu na górach i nie pójdzie szukać tej, która się zabłąkała? A jeśli mu się uda ją odnaleźć, zaprawdę powiadam wam : cieszy się nią bardziej niż dziewięćdziesięciu dziewięciu tymi, które się nie zabłąkały. Tak też nie jest wolą Ojca waszego, który jest w niebie, żeby zginęło jedno z tych małych”."
"Niech się rozweseli pustynia i spieczona ziemia, niech się raduje step i niech rozkwitnie! Niech wyda kwiaty jak lilie polne, niech się rozraduje także skacząc i wykrzykując z uciechy. Chwałą Libanu ją obdarzono, ozdobą Karmelu i Saronu. Oni zobaczą chwałę Pana, wspaniałość naszego Boga. Pokrzepcie ręce osłabłe, wzmocnijcie kolana omdlałe!Powiedzcie małodusznym: ""Odwagi! Nie bójcie się! Oto wasz Bóg, oto pomsta; przychodzi Boża odpłata; On sam przychodzi, aby was zbawić. Wtedy przejrzą oczy niewidomych i uszy głuchych się otworzą. Wtedy chromy wyskoczy jak jeleń i język niemych wesoło krzyknie. Bo trysną zdroje wód na pustyni i strumienie na stepie; spieczona ziemia zmieni się w staw, spragniony kraj w krynice wód, badyle w kryjówkach, gdzie legały szakale, na trzcinę z sitowiem. Będzie tam droga czysta, którą nazwą Drogą Świętą. Nie przejdzie nią nieczysty, gdy odbywa podróż, i głupi nie będą się tam wałęsać. Nie będzie tam lwa, ni zwierz najdzikszy nie wstąpi na nią ani się nie znajdzie, ale tamtędy pójdą wyzwoleni i odkupieni przez Pana powrócą. Przybędą na Syjon z radosnym śpiewem, ze szczęściem wiecznym na twarzach. Osiągną radość i szczęście, ustąpi smutek i wzdychanie. Oto Bóg przyjdzie, ażeby nas zbawić Będę słuchał tego, co mówi Pan Bóg:  Oto ogłasza pokój ludowi i świętym swoim. Zaprawdę bliskie jest Jego zbawienie dla tych, którzy się Go boją,  i chwała zamieszka w naszej ziemi.Spotkają się ze sobą łaska i wierność,  ucałują się sprawiedliwość i pokój. Wierność z ziemi wyrośnie,  a sprawiedliwość spojrzy z nieba.Pan sam obdarzy szczęściem,  a nasza ziemia wyda swój owoc. Przed Nim kroczyć będzie sprawiedliwość,  a śladami Jego kroków zbawienie. Pewnego dnia, gdy Jezus nauczał, siedzieli przy tym faryzeusze i uczeni w Prawie, którzy przyszli ze wszystkich miejscowości Galilei, Judei i Jerozolimy. A była w Nim moc Pańska, że mógł uzdrawiać.Wtem jacyś ludzie niosąc na łożu człowieka, który był sparaliżowany, starali się go wnieść i położyć przed Nim. Nie mogąc z powodu tłumu w żaden sposób przynieść go, wyszli na płaski dach i przez powałę spuścili go wraz z łożem w sam środek przed Jezusa. On widząc ich wiarę, rzekł: „Człowieku, odpuszczają ci się twoje grzechy”. Na to uczeni w Piśmie i faryzeusze poczęli się zastanawiać i mówić: „Któż On jest, że śmie mówić bluźnierstwa? Któż może odpuszczać grzechy prócz samego Boga?” Lecz Jezus przejrzał ich myśli i rzekł do nich: „Co za myśli nurtują w sercach waszych? Cóż jest łatwiej powiedzieć: ""Odpuszczają ci się twoje grzechy"", czy powiedzieć: ""Wstań i chodź?"" Lecz abyście wiedzieli, że Syn Człowieczy ma na ziemi władzę odpuszczania grzechów” — rzekł do sparaliżowanego: „Mówię ci, wstań, weź swoje łoże i idź do domu”. I natychmiast wstał wobec nich, wziął łoże, na którym leżał, i poszedł do domu, wielbiąc Boga."
"Złóż, Jeruzalem, szatę smutku i utrapienia swego, a przywdziej wspaniałe szaty chwały, dane ci na zawsze przez Pana. Oblecz się płaszczem sprawiedliwości pochodzącej od Boga, włóż na głowę swą koronę chwały Przedwiecznego! Albowiem Bóg chce pokazać twoją wspaniałość wszystkiemu, co jest pod niebem. Imię twe u Boga, na wieki będzie nazwane: „Pokój sprawiedliwości i chwała pobożności!”. Podnieś się, Jeruzalem! Stań na miejscu wysokim, spojrzyj na wschód, zobacz twe dzieci, zgromadzone na słowo Świętego od wschodu słońca aż do zachodu, rozradowane, że Bóg o nich pamiętał. Wyszli od ciebie pieszo, pędzeni przez wrogów, a Bóg przyprowadzi ich niesionych z chwałą, jakby na tronie królewskim. Albowiem postanowił Bóg zniżyć każdą górę wysoką, pagórki odwieczne, doły zasypać do zrównania z ziemią, aby bezpiecznie mógł kroczyć Izrael w chwale Pana. Na rozkaz Pana lasy i drzewa pachnące ocieniać będą Izraela. Z radością bowiem poprowadzi Bóg Izraela do światła swej chwały z właściwą sobie sprawiedliwością i miłosierdziem. Pan Bóg uczynił wielkie rzeczy dla nas Gdy Pan odmienił los Syjonu,  wydawało się nam, że śnimy. Usta nasze były pełne śmiechu,  a język śpiewał z radości.Mówiono wtedy między poganami:  „Wielkie rzeczy im Pan uczynił”. Odmień znowu nasz los, Panie,  jak odmieniasz strumienie na Południu.Ci, którzy we łzach sieją,  żąć będą w radości. Idą i płaczą niosąc ziarno na zasiew,  Lecz powrócą z radością niosąc swoje snopy. Było to w piętnastym roku rządów Tyberiusza Cezara. Gdy Poncjusz Piłat był namiestnikiem Judei, Herod tetrarchą Galilei, brat jego Filip tetrarchą Iturei i kraju Trachonu, Lizaniasz tetrarchą Abileny; za najwyższych kapłanów Annasza i Kajfasza skierowane zostało słowo Boże do Jana, syna Zachariasza, na pustyni. Obchodził więc całą okolicę nad Jordanem i głosił chrzest nawrócenia na odpuszczenie grzechów, jak jest napisane w księdze mów proroka Izajasza: „Głos wołającego na pustyni: Przygotujcie drogę Panu, prostujcie ścieżki dla Niego; każda dolina niech będzie wypełniona, każda góra i pagórek zrównane, drogi kręte niech staną się prostymi, a wyboiste drogami gładkimi. I wszyscy ludzie ujrzą zbawienie Boże”."
"W ów dzień śpiewać będą tę pieśń w ziemi judzkiej: „Miasto mamy potężne; On jako środek ocalenia sprawił mury i przedmurze. Otwórzcie bramy! Niech wejdzie naród sprawiedliwy, dochowujący wierności; jego charakter stateczny Ty kształtujesz w pokoju, w pokoju, bo Tobie zaufał. Złóżcie nadzieję w Panu na zawsze, bo Pan jest wiekuistą Skałą! Bo On poniżył przebywających na szczytach, upokorzył miasto niedostępne, upokorzył je aż do ziemi, sprawił, że w proch runęło. Podepcą je nogi, nogi biednych i stopy ubogich”.  Błogosławiony, idący od Pana Wysławiajcie Pana, bo jest dobry,   bo łaska Jego trwa na wieki.   Lepiej się uciec do Pana,   niż pokładać ufność w człowieku.   Lepiej się uciec do Pana,  niż pokładać ufność w książętach.Otwórzcie mi bramy sprawiedliwości,   wejdę przez nie i podziękuję Panu.   Oto jest brama Pana,  przez nią wejdą sprawiedliwi.   Dziękuję Tobie, żeś mnie wysłuchał  i stałeś się moim Zbawcą.O Panie, Ty nas wybaw,   O Panie, daj nam pomyślność.   Błogosławiony, który przybywa w imię Pańskie,   błogosławimy was z Pańskiego domu.   Pan jest Bogiem!  I daje nam światło. Jezus powiedział do swoich uczniów: „Nie każdy, który Mi mówi: ""Panie, Panie"", wejdzie do królestwa niebieskiego, lecz ten, kto spełnia wolę mojego Ojca, który jest w niebie. Każdego więc, kto tych słów moich słucha i wypełnia je, można porównać z człowiekiem roztropnym, który dom swój zbudował na skale. Spadł deszcz, wezbrały potoki, zerwały się wichry i uderzyły w ten dom. On jednak nie runął, bo na skale był utwierdzony. Każdego zaś, kto tych słów moich słucha, a nie wypełnia ich, można porównać z człowiekiem nierozsądnym, który dom swój zbudował na piasku. Spadł deszcz, wezbrały potoki, zerwały się wichry i rzuciły się na ten dom. I runął, a upadek jego był wielki”."
