"Nie aniołom Bóg poddał przyszły świat, o którym mówimy. Ktoś to gdzieś potwierdził uroczyście, mówiąc: ""Czym jest człowiek, że pamiętasz o nim, albo syn człowieczy, że się troszczysz o niego; mało co mniejszym uczyniłeś go od aniołów, chwałą i czcią go uwieńczyłeś. Wszystko poddałeś pod jego stopy"". Ponieważ zaś poddał Mu wszystko, nic nie zostawił, co by nie było Mu poddane. Teraz wszakże nie widzimy jeszcze, aby wszystko było Mu poddane. Widzimy natomiast Jezusa, który mało co od aniołów był mniejszy, chwałą i czcią uwieńczonego za mękę śmierci, iż z łaski Bożej zaznał śmierci za każdego człowieka. Przystało bowiem Temu, dla którego wszystko i przez którego wszystko istnieje, który wielu synów do chwały doprowadza, aby przewodnika ich zbawienia udoskonalił przez cierpienia. Tak bowiem Ten, który uświęca, jak ci, którzy mają być uświęceni, od Jednego wszyscy pochodzą. Z tej to przyczyny nie wstydzi się nazywać ich braćmi swymi, mówiąc: ""Oznajmię imię Twoje braciom moim, pośrodku zgromadzenia będę Cię wychwalał"". Dałeś Synowi władzę nad swym dziełem O Panie, nasz Panie, jak przedziwne jest Twoje imię po całej ziemi. Czym jest człowiek, że o nim pamiętasz, czym syn człowieczy, że troszczysz się o niego?Uczyniłeś go niewiele mniejszym od aniołów, uwieńczyłeś go czcią i chwałą. Obdarzyłeś go władzą nad dziełami rąk Twoich, wszystko złożyłeś pod jego stopy:Owce i bydło wszelakie, i dzikie zwierzęta, ptaki niebieskie i ryby morskie, wszystko, co szlaki mórz przemierza. W Kafarnaum Jezus w szabat wszedł do synagogi i nauczał. Zdumiewali się Jego nauką: uczył ich bowiem jak ten, który ma władzę, a nie jak uczeni w Piśmie. Był właśnie w ich synagodze człowiek opętany przez ducha nieczystego. Zaczął on wołać: ""Czego chcesz od nas, Jezusie Nazarejczyku? Przyszedłeś nas zgubić. Wiem, kto jesteś: Święty Boga"". Lecz Jezus rozkazał mu surowo: ""Milcz i wyjdź z niego!"" Wtedy duch nieczysty zaczął nim miotać i z głośnym krzykiem wyszedł z niego. A wszyscy się zdumieli, tak że jeden drugiego pytał: ""Co to jest? Nowa jakaś nauka z mocą. Nawet duchom nieczystym rozkazuje i są Mu posłuszne"". I wnet rozeszła się wieść o Nim wszędzie po całej okolicznej krainie galilejskiej."
"To mówi Pan Bóg: ""Oto Ja wyślę anioła mego, aby przygotował drogę przede Mną, a potem nagle przybędzie do swej świątyni Pan, którego wy oczekujecie, i Anioł Przymierza, którego pragniecie. Oto nadejdzie, mówi Pan Zastępów. Ale kto przetrwa dzień Jego nadejścia i kto się ostoi, gdy się ukaże? Albowiem On jest jak ogień złotnika i jak ług farbiarzy. Usiądzie więc, jakby miał przetapiać i oczyszczać srebro, i oczyści synów Lewiego, i przecedzi ich jak złoto i srebro, a wtedy będą składać Panu ofiary sprawiedliwe. Wtedy będzie miła Panu ofiara Judy i Jeruzalem jak za dawnych dni i lat starożytnych"". Pan Bóg Zastępów, On jest Królem chwały Bramy, podnieście swe szczyty, unieście się, odwieczne podwoje, aby mógł wkroczyć Król chwały. Kto jest tym Królem chwały? Pan, dzielny i potężny,Pan, potężny w boju.Bramy, podnieście swe szczyty, unieście się, odwieczne podwoje, aby mógł wkroczyć Król chwały. Kto jest tym Królem chwały? Pan Zastępów: On jest Królem chwały.Błogosław, duszo moja, Pana, Boże mój, Panie, Ty jesteś bardzo wielki! odziany w majestat i piękno, światłem okryty jak płaszczem.Chmury są Twoim rydwanem, przechadzasz się na skrzydłach wiatru. Wichry używasz za swych posłów, sługami Twoimi ogień i płomienie.Jak liczne są dzieła Twoje, Panie! Ty wszystko mądrze uczyniłeś, ziemia jest pełna Twoich stworzeń. Oto jest morze, ogromne i szerokie, a w nim żyjątek bez liku, zwierząt wielkich i małych.Wszystko to czeka na Ciebie, byś dał im pokarm we właściwym czasie. Gdy im dajesz, zbierają, gdy otwierasz swą rękę, sycą się Twym dobrem.Kiedy odbierasz im oddech, marnieją i w proch się obracają. Stwarzasz je, napełniając swym duchem, i odnawiasz oblicze ziemi. Gdy upłynęły dni oczyszczenia Maryi według Prawa Mojżeszowego, rodzice przynieśli Jezusa do Jerozolimy, aby Go przedstawić Panu. Tak bowiem jest napisane w Prawie Pańskim: ""Każde pierworodne dziecko płci męskiej będzie poświęcone Panu"". Mieli również złożyć w ofierze parę synogarlic albo dwa młode gołębie, zgodnie z przepisem Prawa Pańskiego. A żył w Jerozolimie człowiek, imieniem Symeon. Był to człowiek sprawiedliwy i pobożny, wyczekiwał pociechy Izraela, a Duch Święty spoczywał na nim. Jemu Duch Święty objawił, że nie ujrzy śmierci, aż nie zobaczy Mesjasza Pańskiego. Za natchnieniem więc Ducha przyszedł do świątyni. A gdy Rodzice wnosili Dzieciątko Jezus, aby postąpić z Nim według zwyczaju Prawa, on wziął Je w objęcia, błogosławił Boga i mówił: Gdy upłynęły dni oczyszczenia Maryi według Prawa Mojżeszowego, rodzice przynieśli Jezusa do Jerozolimy, aby Go przedstawić Panu. Tak bowiem jest napisane w Prawie Pańskim: ""Teraz, o Władco, pozwól odejść słudze Twemu w pokoju, według Twojego słowa. Bo moje oczy ujrzały Twoje zbawienie, któreś przygotował wobec wszystkich narodów: światło na oświecenie pogan i chwałę ludu Twego, Izraela"". A Jego ojciec i Matka dziwili się temu, co o Nim mówiono. Symeon zaś błogosławił Ich i rzekł do Maryi, Matki Jego: ""Oto Ten przeznaczony jest na upadek i na powstanie wielu w Izraelu i na znak, któremu sprzeciwiać się będą. A Twoją duszę miecz przeniknie, aby na jaw wyszły zamysły serc wielu"". Była tam również prorokini Anna, córka Fanuela z pokolenia Asera, bardzo podeszła w latach. Od swego panieństwa siedem lat żyła z mężem i pozostawała wdową. Liczyła już osiemdziesiąty czwarty rok życia. Nie rozstawała się ze świątynią, służąc Bogu w postach i modlitwach dniem i nocą. Przyszedłszy w tej właśnie chwili, sławiła Boga i mówiła o Nim wszystkim, którzy oczekiwali wyzwolenia Jerozolimy. A gdy wypełnili wszystko według Prawa Pańskiego, wrócili do Galilei, do swego miasta Nazaret. Dziecię zaś rosło i nabierało mocy, napełniając się mądrością, a łaska Boża spoczywała na Nim."
"Najmilsi: My miłujemy Boga, ponieważ Bóg sam pierwszy nas umiłował. Jeśliby ktoś mówił: „Miłuję Boga”, a brata swego nienawidził, jest kłamcą, albowiem kto nie miłuje brata swego, którego widzi, nie może miłować Boga, którego nie widzi. Takie zaś mamy od Niego przykazanie, aby ten, kto miłuje Boga, miłował też i brata swego. Każdy, kto wierzy, że Jezus jest Mesjaszem, z Boga się narodził i każdy miłujący Tego, który dał życie, miłuje również tego, który życie od Niego otrzymał. Po tym poznajemy, że miłujemy dzieci Boże, gdy miłujemy Boga i wypełniamy Jego przykazania, albowiem miłość względem Boga polega na spełnianiu Jego przykazań, przykazania Jego nie są ciężkie. Wszystko bowiem, co z Boga zrodzone, zwycięża świat, tym właśnie zwycięstwem, które zwyciężyło świat, jest nasza wiara. Uwielbią Pana wszystkie ludy ziemi Boże, przekaż Twój sąd Królowi,    a Twoją sprawiedliwość synowi królewskiemu.   Aby Twoim ludem rządził sprawiedliwie    i ubogimi według prawa.Wybawi ich od krzywdy i ucisku    a krew ich cenna będzie w Jego oczach.   Zawsze będą się modlić za Niego,    nieustannie Mu błogosławić.Niech Jego imię trwa na wieki;    jak długo świeci słońce, niech trwa Jego imię.   Niech Jego imieniem wzajemnie się błogosławią.    Niech wszystkie narody ziemi życzą Mu szczęścia! Jezus powrócił w mocy Ducha do Galilei, a wieść o Nim rozeszła się po całej okolicy. On zaś nauczał w ich synagogach, wysławiany przez wszystkich. Przyszedł również do Nazaretu, gdzie się wychował. W dzień szabatu udał się swoim zwyczajem do synagogi i powstał, aby czytać. Podano Mu księgę proroka Izajasza. Rozwinąwszy księgę, natrafił na miejsce, gdzie było napisane: „Duch Pański spoczywa na Mnie, ponieważ Mnie namaścił i posłał Mnie, abym ubogim niósł dobrą nowinę, więźniom głosił wolność, a niewidomym przejrzenie; abym uciśnionych odsyłał wolnych, abym obwoływał rok łaski od Pana”. Zwinąwszy księgę oddał słudze i usiadł; a oczy wszystkich w synagodze były w Nim utkwione. Począł więc mówić do nich: „Dziś spełniły się te słowa Pisma, któreście słyszeli”. A wszyscy przyświadczali Mu i dziwili się pełnym wdzięku słowom, które płynęły z ust Jego."
Umiłowani, jeśli Bóg tak nas umiłował, to i my winniśmy się wzajemnie miłować. Nikt nigdy Boga nie oglądał. Jeżeli miłujemy się wzajemnie, Bóg trwa w nas i miłość ku Niemu jest w nas doskonała. Poznajemy, że my trwamy w Nim, a On w nas, bo udzielił nam ze swego Ducha. My także widzieliśmy i świadczymy, że Ojciec zesłał Syna jako Zbawiciela świata. Jeśli kto wyznaje, że Jezus jest Synem Bożym, to Bóg trwa w nim, a on w Bogu. Myśmy poznali i uwierzyli miłości, jaką Bóg ma ku nam. Bóg jest miłością: kto trwa w miłości, trwa w Bogu, a Bóg trwa w nim. Przez to miłość osiąga w nas kres doskonałości, ponieważ tak, jak On jest w niebie, i my jesteśmy na tym świecie. W miłości nie ma lęku, lecz doskonała miłość usuwa lęk, ponieważ lęk kojarzy się z karą. Ten zaś, kto się lęka, nie wydoskonalił się w miłości. Uwielbią Pana wszystkie ludy ziemi Boże, przekaż Twój sąd Królowi,   a Twoją sprawiedliwość synowi królewskiemu.  Aby Twoim ludem rządził sprawiedliwie   i ubogimi według prawa.Królowie Tarszisz i wysp przyniosą dary,   królowie Szeby i Saby złożą daninę.  I oddadzą Mu pokłon wszyscy królowie,   wszystkie narody będą Mu służyły.Wyzwoli bowiem biedaka, który Go wzywa,   i ubogiego, co nie ma opieki.  Zmiłuje się nad biednym i ubogim,   nędzarza ocali od śmierci. Kiedy Jezus nasycił pięć tysięcy mężczyzn, zaraz przynaglił swych uczniów, żeby wsiedli do łodzi i wyprzedzili Go na drugi brzeg, do Betsaidy, zanim odprawi tłum. Gdy rozstał się z nimi, odszedł na górę, aby się modlić. Wieczór zapadł, łódź była na środku jeziora, a On sam jeden na lądzie. Widząc, jak się trudzili przy wiosłowaniu, bo wiatr był im przeciwny, około czwartej straży nocnej przyszedł do nich, krocząc po jeziorze, i chciał ich minąć. Oni zaś, gdy Go ujrzeli kroczącego po jeziorze, myśleli, że to zjawa, i zaczęli krzyczeć. Widzieli Go bowiem wszyscy i zatrwożyli się. Lecz On zaraz przemówił do nich: „Odwagi, Ja jestem, nie bójcie się”. I wszedł do nich do łodzi, a wiatr się uciszył. Oni tym bardziej byli zdumieni w duszy, że nie zrozumieli sprawy z chlebami, gdyż umysł ich był otępiały.
"Umiłowani, miłujmy się wzajemnie, ponieważ miłość jest z Boga, a każdy, kto miłuje, narodził się z Boga i zna Boga. Kto nie miłuje, nie zna Boga, bo Bóg jest miłością. W tym objawiła się miłość Boga ku nam, że zesłał Syna swego Jednorodzonego na świat, abyśmy życie mieli dzięki Niemu. W tym przejawia się miłość, że nie my umiłowaliśmy Boga, ale że On sam nas umiłował i posłał Syna swojego jako ofiarę przebłagalną za nasze grzechy. Uwielbią Pana wszystkie ludy ziemi Boże, przekaż Twój sąd Królowi,   a Twoją sprawiedliwość synowi królewskiemu.  Aby Twoim ludem rządził sprawiedliwie   i ubogimi według prawa.Niech góry przyniosą ludowi pokój,   a wzgórza sprawiedliwość.  Otoczy opieką uciśnionych z ludu,   będzie ratował dzieci biedaków.Za dni Jego zakwitnie sprawiedliwość   i wielki pokój, aż księżyc nie zgaśnie.  Będzie panował od morza do morza,  od Rzeki aż po krańce ziemi. Gdy Jezus ujrzał wielki tłum, ogarnęła Go litość nad nimi; byli bowiem jak owce nie mające pasterza. I zaczął ich nauczać. A gdy pora była już późna, przystąpili do Niego uczniowie i rzekli: „Miejsce jest puste, a pora już późna. Odpraw ich. Niech idą do okolicznych osiedli i wsi, a kupią sobie coś do jedzenia”. Lecz On im odpowiedział: „Wy dajcie im jeść”. Rzekli Mu: „Mamy pójść i za dwieście denarów kupić chleba, żeby im dać jeść?” On ich spytał: „Ile macie chlebów? Idźcie, zobaczcie !” Gdy się upewnili, rzekli: „Pięć i dwie ryby”. Wtedy polecił im wszystkim usiąść gromadami na zielonej trawie. I rozłożyli się gromada przy gromadzie, po stu i po pięćdziesięciu. A wziąwszy pięć chlebów i dwie ryby, spojrzał w niebo, odmówił błogosławieństwo, połamał chleby i dawał uczniom, by kładli przed nimi. Także dwie ryby rozdzielił między wszystkich. Jedli wszyscy do sytości i zebrali jeszcze dwanaście pełnych koszów ułomków i ostatki z ryb. A tych, którzy jedli chleby, było pięć tysięcy mężczyzn."
"Powstań, świeć, Jeruzalem, bo przyszło twe światło i chwała Pana rozbłyska nad tobą. Bo oto ciemność okrywa ziemię i gęsty mrok spowija ludy, a ponad tobą jaśnieje Pan i Jego chwała jawi się nad tobą. I pójdą narody do twojego światła, królowie do blasku twojego wschodu. Podnieś oczy wokoło i popatrz: Ci wszyscy zebrani zdążają do ciebie. Twoi synowie przychodzą z daleka, na rękach niesione twe córki. Wtedy zobaczysz i promienieć będziesz, zadrży i rozszerzy się twoje serce, bo do ciebie napłyną bogactwa zamorskie, zasoby narodów przyjdą ku tobie. Zaleje cię mnogość wielbłądów, dromadery z Madianu i z Efy. Wszyscy oni przybędą ze Saby, ofiarują złoto i kadzidło, nucąc radośnie hymny na cześć Pana. Uwielbią Pana wszystkie ludy ziemi Boże, przekaż Twój sąd Królowi,    a Twoją sprawiedliwość synowi królewskiemu.   Aby Twoim ludem rządził sprawiedliwie    i ubogimi według prawa.Za dni Jego zakwitnie sprawiedliwość,    i wielki pokój, aż księżyc nie zgaśnie.   Będzie panował od morza do morza,    od Rzeki aż po krańce ziemi.Królowie Tarszisz i wysp przyniosą dary,    królowie Szeby i Saby złożą daninę.   I oddadzą Mu pokłon wszyscy królowie,    wszystkie narody będą Mu służyły.Wyzwoli bowiem biedaka, który Go wzywa,    i ubogiego, co nie ma opieki.   Zmiłuje się nad biednym i ubogim,    nędzarza ocali od śmierci. Gdy Jezus narodził się w Betlejem w Judei za panowania króla Heroda, oto Mędrcy ze Wschodu przybyli do Jerozolimy i pytali: „Gdzie jest nowo narodzony król żydowski? Ujrzeliśmy bowiem Jego gwiazdę na Wschodzie i przybyliśmy oddać Mu pokłon”. Skoro usłyszał to król Herod, przeraził się, a z nim cała Jerozolima. Zebrał więc wszystkich arcykapłanów i uczonych ludu i wypytywał ich, gdzie ma się narodzić Mesjasz. Ci mu odpowiedzieli: „W Betlejem judzkim, bo tak napisał prorok: A ty, Betlejem, ziemio Judy, nie jesteś zgoła najlichsze spośród głównych miast Judy, albowiem z ciebie wyjdzie władca, który będzie pasterzem ludu mego, Izraela”. Wtedy Herod przywołał potajemnie Mędrców i wypytał ich dokładnie o czas ukazania się gwiazdy. A kierując ich do Betlejem, rzekł: „Udajcie się tam i wypytujcie starannie o Dziecię, a gdy Je znajdziecie, donieście mi, abym i ja mógł pójść i oddać Mu pokłon”. Oni zaś wysłuchawszy króla, ruszyli w drogę. A oto gwiazda, którą widzieli na Wschodzie, szła przed nimi, aż przyszła i zatrzymała się nad miejscem, gdzie było Dziecię. Gdy ujrzeli gwiazdę, bardzo się uradowali. Weszli do domu i zobaczyli Dziecię z Matką Jego, Maryją; upadli na twarz i oddali Mu pokłon. I otworzywszy swe skarby, ofiarowali Mu dary: złoto, kadzidło i mirrę. A otrzymawszy we śnie nakaz, żeby nie wracali do Heroda, inną drogą udali się do ojczyzny."
"Najmilsi: Jeżeli wiecie, że Bóg jest sprawiedliwy, to uznajcie również, że każdy, kto postępuje sprawiedliwie, pochodzi od Niego. Popatrzcie, jaką miłością obdarzył nas Ojciec: zostaliśmy nazwani dziećmi Bożymi: i rzeczywiście nimi jesteśmy. Świat zaś dlatego nas nie zna, że nie poznał Jego. Umiłowani, obecnie jesteśmy dziećmi Bożymi, ale jeszcze się nie ujawniło, czym będziemy. Wiecie, że gdy się objawi, będziemy do Niego podobni, bo ujrzymy Go takim, jakim jest. Każdy zaś, kto pokłada w Nim nadzieję, uświęca się, podobnie jak On jest święty. Każdy, kto grzeszy, dopuszcza się bezprawia, ponieważ grzech jest bezprawiem. Wiecie, że On się objawi po to, aby zgładzić grzechy, w Nim zaś nie ma grzechu. Każdy, kto trwa w Nim, nie grzeszy, żaden zaś z tych, którzy grzeszą, nie widział Go ani Go nie poznał. Ziemia ujrzała swego Zbawiciela Śpiewajcie Panu pieśń nową,  albowiem uczynił cuda. Zwycięstwo Mu zgotowała Jego prawica  i święte ramię Jego.Ujrzały wszystkie krańce ziemi  zbawienie Boga naszego. Wołaj z radości na cześć Pana, cała ziemio,  cieszcie się, weselcie i grajcie.Śpiewajcie Panu przy wtórze cytry,  przy wtórze cytry i przy dźwięku harfy. Przy trąbach i przy dźwięku rogu,  na oczach Pana i Króla się radujcie. Nazajutrz Jan zobaczył Jezusa, nadchodzącego ku niemu, i rzekł: „Oto Baranek Boży, który gładzi grzech świata. To jest Ten, o którym powiedziałem: ""Po mnie przyjdzie mąż, który mnie przewyższył godnością, gdyż był wcześniej ode mnie"". Ja Go przedtem nie znałem, ale przyszedłem chrzcić wodą w tym celu, aby On się objawił Izraelowi"". Jan dał takie świadectwo: ""Ujrzałem Ducha, który jak gołębica zstępował z nieba i spoczął na Nim. Ja Go przedtem nie znałem, ale Ten, który mnie posłał, abym chrzcił wodą, powiedział do mnie: ""Ten, nad którym ujrzysz Ducha zstępującego i spoczywającego nad Nim, jest Tym, który chrzci Duchem Świętym"". Ja to ujrzałem i daję świadectwo, że On jest Synem Bożym”."
"Powstań, świeć, Jeruzalem, bo przyszło twe światło i chwała Pana rozbłyska nad tobą. Bo oto ciemność okrywa ziemię i gęsty mrok spowija ludy, a ponad tobą jaśnieje Pan i Jego chwała jawi się nad tobą. I pójdą narody do twojego światła, królowie do blasku twojego wschodu. Podnieś oczy wokoło i popatrz: Ci wszyscy zebrani zdążają do ciebie. Twoi synowie przychodzą z daleka, na rękach niesione twe córki. Wtedy zobaczysz i promienieć będziesz, zadrży i rozszerzy się twoje serce, bo do ciebie napłyną bogactwa zamorskie, zasoby narodów przyjdą ku tobie. Zaleje cię mnogość wielbłądów, dromadery z Madianu i z Efy. Wszyscy oni przybędą ze Saby, ofiarują złoto i kadzidło, nucąc radośnie hymny na cześć Pana. Uwielbią Pana wszystkie ludy ziemi Boże, przekaż Twój sąd Królowi,    a Twoją sprawiedliwość synowi królewskiemu.   Aby Twoim ludem rządził sprawiedliwie    i ubogimi według prawa.Za dni Jego zakwitnie sprawiedliwość,    i wielki pokój, aż księżyc nie zgaśnie.   Będzie panował od morza do morza,    od Rzeki aż po krańce ziemi.Królowie Tarszisz i wysp przyniosą dary,    królowie Szeby i Saby złożą daninę.   I oddadzą Mu pokłon wszyscy królowie,    wszystkie narody będą Mu służyły.Wyzwoli bowiem biedaka, który Go wzywa,    i ubogiego, co nie ma opieki.   Zmiłuje się nad biednym i ubogim,    nędzarza ocali od śmierci. Gdy Jezus narodził się w Betlejem w Judei za panowania króla Heroda, oto Mędrcy ze Wschodu przybyli do Jerozolimy i pytali: „Gdzie jest nowo narodzony król żydowski? Ujrzeliśmy bowiem Jego gwiazdę na Wschodzie i przybyliśmy oddać Mu pokłon”. Skoro usłyszał to król Herod, przeraził się, a z nim cała Jerozolima. Zebrał więc wszystkich arcykapłanów i uczonych ludu i wypytywał ich, gdzie ma się narodzić Mesjasz. Ci mu odpowiedzieli: „W Betlejem judzkim, bo tak napisał prorok: A ty, Betlejem, ziemio Judy, nie jesteś zgoła najlichsze spośród głównych miast Judy, albowiem z ciebie wyjdzie władca, który będzie pasterzem ludu mego, Izraela”. Wtedy Herod przywołał potajemnie Mędrców i wypytał ich dokładnie o czas ukazania się gwiazdy. A kierując ich do Betlejem, rzekł: „Udajcie się tam i wypytujcie starannie o Dziecię, a gdy Je znajdziecie, donieście mi, abym i ja mógł pójść i oddać Mu pokłon”. Oni zaś wysłuchawszy króla, ruszyli w drogę. A oto gwiazda, którą widzieli na Wschodzie, szła przed nimi, aż przyszła i zatrzymała się nad miejscem, gdzie było Dziecię. Gdy ujrzeli gwiazdę, bardzo się uradowali. Weszli do domu i zobaczyli Dziecię z Matką Jego, Maryją; upadli na twarz i oddali Mu pokłon. I otworzywszy swe skarby, ofiarowali Mu dary: złoto, kadzidło i mirrę. A otrzymawszy we śnie nakaz, żeby nie wracali do Heroda, inną drogą udali się do ojczyzny."
"Umiłowani, miłujmy się wzajemnie, ponieważ miłość jest z Boga, a każdy, kto miłuje, narodził się z Boga i zna Boga. Kto nie miłuje, nie zna Boga, bo Bóg jest miłością. W tym objawiła się miłość Boga ku nam, że zesłał Syna swego Jednorodzonego na świat, abyśmy życie mieli dzięki Niemu. W tym przejawia się miłość, że nie my umiłowaliśmy Boga, ale że On sam nas umiłował i posłał Syna swojego jako ofiarę przebłagalną za nasze grzechy. Uwielbią Pana wszystkie ludy ziemi Boże, przekaż Twój sąd Królowi,   a Twoją sprawiedliwość synowi królewskiemu.  Aby Twoim ludem rządził sprawiedliwie   i ubogimi według prawa.Niech góry przyniosą ludowi pokój,   a wzgórza sprawiedliwość.  Otoczy opieką uciśnionych z ludu,   będzie ratował dzieci biedaków.Za dni Jego zakwitnie sprawiedliwość   i wielki pokój, aż księżyc nie zgaśnie.  Będzie panował od morza do morza,  od Rzeki aż po krańce ziemi. Gdy Jezus ujrzał wielki tłum, ogarnęła Go litość nad nimi; byli bowiem jak owce nie mające pasterza. I zaczął ich nauczać. A gdy pora była już późna, przystąpili do Niego uczniowie i rzekli: „Miejsce jest puste, a pora już późna. Odpraw ich. Niech idą do okolicznych osiedli i wsi, a kupią sobie coś do jedzenia”. Lecz On im odpowiedział: „Wy dajcie im jeść”. Rzekli Mu: „Mamy pójść i za dwieście denarów kupić chleba, żeby im dać jeść?” On ich spytał: „Ile macie chlebów? Idźcie, zobaczcie !” Gdy się upewnili, rzekli: „Pięć i dwie ryby”. Wtedy polecił im wszystkim usiąść gromadami na zielonej trawie. I rozłożyli się gromada przy gromadzie, po stu i po pięćdziesięciu. A wziąwszy pięć chlebów i dwie ryby, spojrzał w niebo, odmówił błogosławieństwo, połamał chleby i dawał uczniom, by kładli przed nimi. Także dwie ryby rozdzielił między wszystkich. Jedli wszyscy do sytości i zebrali jeszcze dwanaście pełnych koszów ułomków i ostatki z ryb. A tych, którzy jedli chleby, było pięć tysięcy mężczyzn."
Umiłowani, jeśli Bóg tak nas umiłował, to i my winniśmy się wzajemnie miłować. Nikt nigdy Boga nie oglądał. Jeżeli miłujemy się wzajemnie, Bóg trwa w nas i miłość ku Niemu jest w nas doskonała. Poznajemy, że my trwamy w Nim, a On w nas, bo udzielił nam ze swego Ducha. My także widzieliśmy i świadczymy, że Ojciec zesłał Syna jako Zbawiciela świata. Jeśli kto wyznaje, że Jezus jest Synem Bożym, to Bóg trwa w nim, a on w Bogu. Myśmy poznali i uwierzyli miłości, jaką Bóg ma ku nam. Bóg jest miłością: kto trwa w miłości, trwa w Bogu, a Bóg trwa w nim. Przez to miłość osiąga w nas kres doskonałości, ponieważ tak, jak On jest w niebie, i my jesteśmy na tym świecie. W miłości nie ma lęku, lecz doskonała miłość usuwa lęk, ponieważ lęk kojarzy się z karą. Ten zaś, kto się lęka, nie wydoskonalił się w miłości. Uwielbią Pana wszystkie ludy ziemi Boże, przekaż Twój sąd Królowi,   a Twoją sprawiedliwość synowi królewskiemu.  Aby Twoim ludem rządził sprawiedliwie   i ubogimi według prawa.Królowie Tarszisz i wysp przyniosą dary,   królowie Szeby i Saby złożą daninę.  I oddadzą Mu pokłon wszyscy królowie,   wszystkie narody będą Mu służyły.Wyzwoli bowiem biedaka, który Go wzywa,   i ubogiego, co nie ma opieki.  Zmiłuje się nad biednym i ubogim,   nędzarza ocali od śmierci. Kiedy Jezus nasycił pięć tysięcy mężczyzn, zaraz przynaglił swych uczniów, żeby wsiedli do łodzi i wyprzedzili Go na drugi brzeg, do Betsaidy, zanim odprawi tłum. Gdy rozstał się z nimi, odszedł na górę, aby się modlić. Wieczór zapadł, łódź była na środku jeziora, a On sam jeden na lądzie. Widząc, jak się trudzili przy wiosłowaniu, bo wiatr był im przeciwny, około czwartej straży nocnej przyszedł do nich, krocząc po jeziorze, i chciał ich minąć. Oni zaś, gdy Go ujrzeli kroczącego po jeziorze, myśleli, że to zjawa, i zaczęli krzyczeć. Widzieli Go bowiem wszyscy i zatrwożyli się. Lecz On zaraz przemówił do nich: „Odwagi, Ja jestem, nie bójcie się”. I wszedł do nich do łodzi, a wiatr się uciszył. Oni tym bardziej byli zdumieni w duszy, że nie zrozumieli sprawy z chlebami, gdyż umysł ich był otępiały.
