"Pan rzekł do Jozuego: ""Dziś zrzuciłem z was hańbę egipską"". Rozłożyli się obozem Izraelici w Gilgal i tam obchodzili Paschę czternastego dnia miesiąca wieczorem, na stepach Jerycha. Następnego dnia Paschy jedli z plonu tej krainy, chleby przaśne i ziarna prażone tego samego dnia. Manna ustała następnego dnia, gdy zaczęli jeść plon tej ziemi. Nie mieli już więcej Izraelici manny, lecz żywili się tego roku plonami ziemi Kanaan. Wszyscy zobaczcie, jak nasz Pan jest dobry Będę błogosławił Pana po wieczne czasy, Jego chwała będzie zawsze na moich ustach. Dusza moja chlubi się Panem, niech słyszą to pokorni i niech się weselą.Wysławiajcie razem ze mną Pana, wspólnie wywyższajmy Jego imię. Szukałem pomocy u Pana, a On mnie wysłuchał i wyzwolił od wszelkiej trwogi.Spójrzcie na Niego, a rozpromienicie się radością, oblicza wasze nie zapłoną wstydem. Oto zawołał biedak i Pan go usłyszał, i uwolnił od wszelkiego ucisku. W owym czasie przybliżali się do Jezusa wszyscy celnicy i grzesznicy, aby Go słuchać. Na to szemrali faryzeusze i uczeni w Piśmie, mówiąc: ""Ten przyjmuje grzeszników i jada z nimi"". Opowiedział im wtedy następującą przypowieść: ""Pewien człowiek miał dwóch synów. Młodszy z nich rzekł do ojca: „Ojcze, daj mi część własności, która na mnie przypada”. Podzielił więc majątek między nich. Niedługo potem młodszy syn, zabrawszy wszystko, odjechał w dalekie strony i tam roztrwonił swoją własność, żyjąc rozrzutnie. A gdy wszystko wydał, nastał ciężki głód w owej krainie, i on sam zaczął cierpieć niedostatek. Poszedł i przystał na służbę do jednego z obywateli owej krainy, a ten posłał go na swoje pola, żeby pasł świnie. Pragnął on napełnić swój żołądek strąkami, którymi żywiły się świnie, lecz nikt mu ich nie dawał. Wtedy zastanowił się i rzekł: „Iluż to najemników mojego ojca ma pod dostatkiem chleba, a ja tu przymieram głodem. Zabiorę się i pójdę do mego ojca, i powiem mu: Ojcze, zgrzeszyłem przeciw Niebu i względem ciebie; już nie jestem godzien nazywać się twoim synem: uczyń mnie choćby jednym z twoich najemników”. Zabrał się więc i poszedł do swojego ojca. A gdy był jeszcze daleko, ujrzał go jego ojciec i wzruszył się głęboko; wybiegł naprzeciw niego, rzucił mu się na szyję i ucałował go. A syn rzekł do niego: „Ojcze, zgrzeszyłem przeciw Niebu i wobec ciebie, już nie jestem godzien nazywać się twoim synem”. Lecz ojciec powiedział do swoich sług: „Przynieście szybko najlepszą szatę i ubierzcie go; dajcie mu też pierścień na rękę i sandały na nogi! Przyprowadźcie utuczone cielę i zabijcie: będziemy ucztować i weselić się, ponieważ ten syn mój był umarły, a znów ożył; zaginął, a odnalazł się”. I zaczęli się weselić. Tymczasem starszy jego syn przebywał na polu. Gdy wracał i był blisko domu, usłyszał muzykę i tańce. Przywołał jednego ze sług i pytał go, co to ma znaczyć. Ten mu rzekł: „Twój brat powrócił, a ojciec twój kazał zabić utuczone cielę, ponieważ odzyskał go zdrowego”. Rozgniewał się na to i nie chciał wejść; wtedy ojciec jego wyszedł i tłumaczył mu. Lecz on odpowiedział ojcu: „Oto tyle lat ci służę i nie przekroczyłem nigdy twojego nakazu; ale mnie nigdy nie dałeś koźlęcia, żebym się zabawił z przyjaciółmi. Skoro jednak wrócił ten syn twój, który roztrwonił twój majątek z nierządnicami, kazałeś zabić dla niego utuczone cielę”. Lecz on mu odpowiedział: „Moje dziecko, ty zawsze jesteś ze mną i wszystko, co moje, do ciebie należy. A trzeba było weselić się i cieszyć z tego, że ten brat twój był umarły, a znów ożył; zaginął, a odnalazł się”."
"Podczas widzenia otrzymanego od Pana zaprowadził mnie aniał z powrotem przed wejście do świątyni, a oto wypływała woda spod progu świątyni w kierunku wschodnim, ponieważ przednia strona świątyni była skierowana ku wschodowi; a woda płynęła spod prawej strony świątyni na południe od ołtarza. I wyprowadził mnie przez bramę północną na zewnątrz i poza murami powiódł mnie od bramy zewnętrznej, skierowanej ku wschodowi. A oto woda wypływała spod prawej ściany świątyni, na południe od ołtarza. Potem poprowadził mnie ów mąż w kierunku wschodnim; miał on w ręku pręt mierniczy, odmierzył tysiąc łokci i kazał mi przejść przez wodę; woda sięgała aż do kostek. Następnie znów odmierzył tysiąc [łokci] i kazał mi przejść przez wodę: sięgała aż do kolan; i znów odmierzył tysiąc [łokci] i kazał mi przejść: sięgała aż do bioder; i znów odmierzył jeszcze tysiąc [łokci]: był tam już potok, przez który nie mogłem przejść, gdyż woda była za głęboka, była to woda do pływania, rzeka, przez którą nie można było przejść. Potem rzekł do mnie: Czy widziałeś to, synu człowieczy? I poprowadził mnie z powrotem wzdłuż rzeki. Gdy się odwróciłem, oto po obu stronach na brzegu rzeki znajdowało się wiele drzew. A On rzekł do mnie: Woda ta płynie na obszar wschodni, wzdłuż stepów, i rozlewa się w wodach słonych, i wtedy wody jego stają się zdrowe. Wszystkie też istoty żyjące, od których tam się roi, dokądkolwiek potok wpłynie, pozostają przy życiu: będą tam też niezliczone ryby, bo dokądkolwiek dotrą te wody, wszystko będzie uzdrowione. A nad brzegami potoku mają rosnąć po obu stronach różnego rodzaju drzewa owocowe, których liście nie więdną, których owoce się nie wyczerpują; każdego miesiąca będą rodzić nowe, ponieważ woda dla nich przychodzi z przybytku. Ich owoce będą służyć za pokarm, a ich liście za lekarstwo. Pan Bóg Zastępów jest dla nas obroną Bóg jest dla nas ucieczką i mocą: najpewniejszą pomocą w trudnościach. Przeto nie będziemy się bali, choćby zatrzęsła się ziemia i góry zapadały w otchłanie morza.Nurty rzeki rozweselają miasto Boże, najświętszy przybytek Najwyższego. Bóg jest w jego wnętrzu, więc się nie zachwieje, Bóg je wspomaga o świcie.Pan Zastępów jest z nami, Bóg Jakuba jest naszą obroną. Przyjdźcie, zobaczcie dzieła Pana, zdumiewające dzieła, których dokonał na ziemi. Było święto żydowskie i Jezus udał się do Jerozolimy. W Jerozolimie zaś znajduje się sadzawka Owcza, nazwana po hebrajsku Betesda, zaopatrzona w pięć krużganków. Wśród nich leżało mnóstwo chorych: niewidomych, chromych, sparaliżowanych. Znajdował się tam pewien człowiek, który już od lat trzydziestu ośmiu cierpiał na swoją chorobę. Gdy Jezus ujrzał go leżącego i poznał, że czeka już długi czas, rzekł do niego: Czy chcesz stać się zdrowym? Odpowiedział Mu chory: Panie, nie mam człowieka, aby mnie wprowadził do sadzawki, gdy nastąpi poruszenie wody. Gdy ja sam już dochodzę, inny wchodzi przede mną. Rzekł do niego Jezus: Wstań, weź swoje łoże i chodź! Natychmiast wyzdrowiał ów człowiek, wziął swoje łoże i chodził. Jednakże dnia tego był szabat. Rzekli więc żydzi do uzdrowionego: Dziś jest szabat, nie wolno ci nieść twojego łoża. On im odpowiedział: Ten, który mnie uzdrowił, rzekł do mnie: Weź swoje łoże i chodź. Pytali go więc: Cóż to za człowiek ci powiedział: Weź i chodź? Lecz uzdrowiony nie wiedział, kim On jest; albowiem Jezus odsunął się od tłumu, który był w tym miejscu. Potem Jezus znalazł go w świątyni i rzekł do niego: Oto wyzdrowiałeś. Nie grzesz już więcej, aby ci się coś gorszego nie przydarzyło. Człowiek ów odszedł i doniósł żydom, że to Jezus go uzdrowił. I dlatego żydzi prześladowali Jezusa, że to uczynił w szabat."
"Tak mówi Pan: Gdy nadejdzie czas mej łaski, wysłucham cię, w dniu zbawienia przyjdę ci z pomocą. A ukształtowałem cię i ustanowiłem przymierzem dla ludu, aby odnowić kraj, aby rozdzielić spustoszone dziedzictwa, aby rzec więźniom: Wyjdźcie na wolność! marniejącym w ciemnościach: Ukażcie się! Oni będą się paśli przy wszystkich drogach, na każdym bezdrzewnym wzgórzu będzie ich pastwisko. Nie będą już łaknąć ni pragnąć, i nie porazi ich wiatr upalny ni słońce, bo ich poprowadzi Ten, co się lituje nad nimi, i zaprowadzi ich do tryskających zdrojów. Wszystkie me góry zamienię na drogę, i moje gościńce wzniosą się wyżej. Oto ci przychodzą z daleka, oto tamci z Północy i z Zachodu, a inni z krainy Sinitów. Zabrzmijcie weselem, niebiosa! Raduj się, ziemio! Góry, wybuchnijcie radosnym okrzykiem! Albowiem Pan pocieszył swój lud, zlitował się nad jego biednymi. Mówił Syjon: Pan mnie opuścił, Pan o mnie zapomniał. Czyż może niewiasta zapomnieć o swym niemowlęciu, ta, która kocha syna swego łona? A nawet, gdyby ona zapomniała, Ja nie zapomnę o tobie. Pan jest łaskawy, pełen miłosierdzia Pan jest łagodny i miłosierny, nieskory do gniewu i bardzo łaskawy. Pan jest dobry dla wszystkich, a Jego miłosierdzie nad wszystkim, co stworzył.Pan jest wierny we wszystkich swoich słowach i we wszystkich dziełach swoich święty. Pan podtrzymuje wszystkich, którzy upadają, i podnosi wszystkich zgnębionych.Pan jest sprawiedliwy na wszystkich swych drogach i łaskawy we wszystkich swoich dziełach. Pan jest blisko wszystkich, który Go wzywają, wszystkich wzywających Go szczerze. Żydzi prześladowali Jezusa, ponieważ uzdrowił w szabat. Lecz Jezus im odpowiedział: Ojciec mój działa aż do tej chwili i Ja działam. Dlatego więc usiłowali żydzi tym bardziej Go zabić, bo nie tylko nie zachowywał szabatu, ale nadto Boga nazywał swoim Ojcem, czyniąc się równym Bogu. W odpowiedzi na to Jezus im mówił: Zaprawdę, zaprawdę, powiadam wam: Syn nie mógłby niczego czynić sam od siebie, gdyby nie widział Ojca czyniącego. Albowiem to samo, co On czyni, podobnie i Syn czyni. Ojciec bowiem miłuje Syna i ukazuje Mu to wszystko, co On sam czyni, i jeszcze większe dzieła ukaże Mu, abyście się dziwili. Albowiem jak Ojciec wskrzesza umarłych i ożywia, tak również i Syn ożywia tych, których chce. Ojciec bowiem nie sądzi nikogo, lecz cały sąd przekazał Synowi, aby wszyscy oddawali cześć Synowi, tak jak oddają cześć Ojcu. Kto nie oddaje czci Synowi, nie oddaje czci Ojcu, który Go posłał. Zaprawdę, zaprawdę, powiadam wam: Kto słucha słowa mego i wierzy w Tego, który Mnie posłał, ma życie wieczne i nie idzie na sąd, lecz ze śmierci przeszedł do życia. Zaprawdę, zaprawdę, powiadam wam, że nadchodzi godzina, nawet już jest, kiedy to umarli usłyszą głos Syna Bożego, i ci, którzy usłyszą, żyć będą. Podobnie jak Ojciec ma życie w sobie, tak również dał Synowi: mieć życie w sobie samym. Przekazał Mu władzę wykonywania sądu, ponieważ jest Synem Człowieczym. Nie dziwcie się temu! Nadchodzi bowiem godzina, w której wszyscy, którzy spoczywają w grobach, usłyszą głos Jego: a ci, którzy pełnili dobre czyny, pójdą na zmartwychwstanie życia; ci, którzy pełnili złe czyny - na zmartwychwstanie potępienia. Ja sam z siebie nic czynić nie mogę. Tak, jak słyszę, sądzę, a sąd mój jest sprawiedliwy; nie szukam bowiem własnej woli, lecz woli Tego, który Mnie posłał."
"Pan rzekł do Mojżesza: Zstąp na dół, bo sprzeniewierzył się lud twój, który wyprowadziłeś z ziemi egipskiej. Bardzo szybko odwrócili się od drogi, którą im nakazałem, i utworzyli sobie posąg cielca ulanego z metalu i oddali mu pokłon, i złożyli mu ofiary, mówiąc: Izraelu, oto twój bóg, który cię wyprowadził z ziemi egipskiej. I jeszcze powiedział Pan do Mojżesza: Widzę, że lud ten jest ludem o twardym karku. Zostaw Mnie przeto w spokoju, aby rozpalił się gniew mój na nich. Chcę ich wyniszczyć, a ciebie uczynić wielkim ludem. Mojżesz jednak zaczął usilnie błagać Pana, Boga swego, i mówić: Dlaczego, Panie, płonie gniew Twój przeciw ludowi Twemu, który wyprowadziłeś z ziemi egipskiej wielką mocą i silną ręką? Czemu to mają mówić Egipcjanie: W złym zamiarze wyprowadził ich, chcąc ich wygubić w górach i wygładzić z powierzchni ziemi? Odwróć zapalczywość Twego gniewu i zaniechaj zła, jakie chcesz zesłać na Twój lud. Wspomnij na Abrahama, Izaaka i Izraela, Twoje sługi, którym przysiągłeś na samego siebie, mówiąc do nich: Uczynię potomstwo wasze tak liczne jak gwiazdy niebieskie, i całą ziemię, o której mówiłem, dam waszym potomkom, i posiądą ją na wieki. Wówczas to Pan zaniechał zła, jakie zamierzał zesłać na swój lud. Pamiętaj o nas i przyjdź nam z pomocą U stóp Horebu zrobili cielca i pokłon oddawali bożkowi odlanemu ze złota. I zamienili swą chwałę na podobiznę cielca jedzącego siano.Zapomnieli Boga, który ich ocalił, który wielkich rzeczy dokonał w Egipcie, rzeczy przedziwnych w krainie Chama, zdumiewających nad Morzem Czerwonym.Postanowił ich zatem wytracić, gdyby nie Mojżesz, Jego wybraniec; on wstawił się do Niego, aby odwrócił swój gniew, by ich nie niszczył Jezus powiedział do Żydów: Gdybym Ja wydawał świadectwo o sobie samym, sąd mój nie byłby prawdziwy. Jest przecież ktoś inny, kto wydaje sąd o Mnie; a wiem, że sąd, który o mnie wydaje, jest prawdziwy. Wysłaliście poselstwo do Jana i on dał świadectwo prawdzie. Ja nie zważam na świadectwo człowieka, ale mówię to, abyście byli zbawieni. On był lampą, co płonie i świeci, wy zaś chcieliście radować się krótki czas jego światłem. Ja mam świadectwo większe od Janowego. Są to dzieła, które Ojciec dał Mi do wykonania; dzieła, które czynię, świadczą o Mnie, że Ojciec Mnie posłał. Ojciec, który Mnie posłał, On dał o Mnie świadectwo. Nigdy nie słyszeliście ani Jego głosu, ani nie widzieliście Jego oblicza; nie macie także słowa Jego, trwającego w was, bo wyście nie uwierzyli w Tego, którego On posłał. Badacie Pisma, ponieważ sądzicie, że w nich zawarte jest życie wieczne: to one właśnie dają o Mnie świadectwo. A przecież nie chcecie przyjść do Mnie, aby mieć życie. Nie odbieram chwały od ludzi, ale wiem o was, że nie macie w sobie miłości Boga. Przyszedłem w imieniu Ojca mego, a nie przyjęliście Mnie. Gdyby jednak przybył kto inny we własnym imieniu, to byście go przyjęli. Jak możecie uwierzyć, skoro od siebie wzajemnie odbieracie chwałę, a nie szukacie chwały, która pochodzi od samego Boga? Nie mniemajcie jednak, że to Ja was oskarżę przed Ojcem. Waszym oskarżycielem jest Mojżesz, w którym wy pokładacie nadzieję. Gdybyście jednak uwierzyli Mojżeszowi, to byście i Mnie uwierzyli. O Mnie bowiem on pisał. Jeżeli jednak jego pismom nie wierzycie, jakżeż moim słowom będziecie wierzyli?"
"Mylnie rozumując bezbożni mówili sobie: Zróbmy zasadzkę na sprawiedliwego, bo nam niewygodny: sprzeciwia się naszym sprawom, zarzuca nam łamanie prawa, wypomina nam błędy naszych obyczajów. Chełpi się, że zna Boga, zwie siebie dzieckiem Pańskim. Jest potępieniem naszych zamysłów, sam widok jego jest dla nas przykry, bo życie jego niepodobne do innych i drogi jego odmienne. Uznał nas za coś fałszywego i stroni od dróg naszych jak od nieczystości. Kres sprawiedliwych ogłasza za szczęśliwy i chełpi się Bogiem jako ojcem. Zobaczmyż, czy prawdziwe są jego słowa, wybadajmy, co będzie przy jego zejściu. Bo jeśli sprawiedliwy jest synem Bożym, Bóg ujmie się za nim i wyrwie go z ręki przeciwników. Dotknijmy go obelgą i katuszą, by poznać jego łagodność i doświadczyć jego cierpliwości. Zasądźmy go na śmierć haniebną, bo - jak mówił - będzie ocalony. Tak pomyśleli - i pobłądzili, bo własna złość ich zaślepiła. Nie pojęli tajemnic Bożych, nie spodziewali się nagrody za prawość i nie docenili odpłaty dusz czystych. Pan zawsze bliski dla skruszonych w sercu Pan zwraca swe oblicze przeciw zło czyniącym, by pamięć o nich wymazać z ziemi. Pan słyszy wołających o pomoc i ratuje ich od wszelkiej udręki.Pan jest blisko ludzi skruszonych w sercu, ocala upadłych na duchu. Liczne są nieszczęścia, które cierpi sprawiedliwy, ale Pan go ze wszystkich wybawia.On czuwa nad każdą jego kością i żadna z nich nie zostanie złamana. Pan odkupi dusze sług swoich, nie zazna kary, kto się doń ucieka. Jezus obchodził Galileję. Nie chciał bowiem chodzić po Judei, bo żydzi mieli zamiar Go zabić. A zbliżało się żydowskie święto Namiotów. Kiedy zaś bracia Jego udali się na święto, wówczas poszedł i On, jednakże nie jawnie, lecz skrycie. Niektórzy z mieszkańców Jerozolimy mówili: Czyż to nie jest Ten, którego usiłują zabić? A oto jawnie przemawia i nic Mu nie mówią. Czyżby zwierzchnicy naprawdę się przekonali, że On jest Mesjaszem? Przecież my wiemy, skąd On pochodzi, natomiast gdy Mesjasz przyjdzie, nikt nie będzie wiedział, skąd jest. A Jezus, ucząc w świątyni, zawołał tymi słowami: I Mnie znacie, i wiecie, skąd jestem. Ja jednak nie przyszedłem sam od siebie; lecz prawdziwy jest Ten, który Mnie posłał, którego wy nie znacie. Ja Go znam, bo od Niego jestem i On Mnie posłał. Zamierzali więc Go pojmać, jednakże nikt nie podniósł na Niego ręki, ponieważ godzina Jego jeszcze nie nadeszła."
"Tak mówi Pan, który otworzył drogę przez morze i ścieżkę przez potężne wody; który wiódł na wyprawę wozy i konie, także i potężne wojsko; upadli, już nie powstaną, zgaśli, jak knotek zostali zdmuchnięci. Nie wspominajcie wydarzeń minionych, nie roztrząsajcie w myśli dawnych rzeczy. Oto Ja dokonuję rzeczy nowej: pojawia się właśnie. Czyż jej nie poznajecie? Otworzę też drogę na pustyni, ścieżyny na pustkowiu. Sławić Mnie będą zwierzęta polne, szakale i strusie, gdyż na pustyni dostarczę wody i rzek na pustkowiu, aby napoić mój lud wybrany. Lud ten, który sobie utworzyłem, opowiadać będzie moją chwałę. Pan Bóg uczynił wielkie rzeczy dla nas Gdy Pan odmienił los Syjonu, wydawało się nam, że śnimy Usta nasze były pełne śmiechu, a język śpiewał z radości.Mówiono wtedy między poganami: „Wielkie rzeczy im Pan uczynił”. Odmień znowu nasz los, Panie, jak odmieniasz strumienie na Południu.Ci, którzy we łzach sieją, żąć będą w radości. Idą i płaczą niosąc ziarno na zasiew, lecz powrócą z radości niosąc swoje snopy. Jezus udał się na Górę Oliwną, ale o brzasku zjawił się znów w świątyni. Cały lud schodził się do Niego, a On usiadłszy nauczał ich. Wówczas uczeni w Piśmie i faryzeusze przyprowadzili do Niego kobietę którą pochwycono na cudzołóstwie, a postawiwszy ją pośrodku, powiedzieli do Niego: Nauczycielu, tę kobietę dopiero pochwycono na cudzołóstwie. W Prawie Mojżesz nakazał nam takie kamienować. A Ty co mówisz? Mówili to wystawiając Go na próbę, aby mieli o co Go oskarżyć. Lecz Jezus nachyliwszy się pisał palcem po ziemi. A kiedy w dalszym ciągu Go pytali, podniósł się i rzekł do nich: Kto z was jest bez grzechu, niech pierwszy rzuci na nią kamień. I powtórnie nachyliwszy się pisał na ziemi. Kiedy to usłyszeli, wszyscy jeden po drugim zaczęli odchodzić, poczynając od starszych, aż do ostatnich. Pozostał tylko Jezus i kobieta, stojąca na środku. Wówczas Jezus podniósłszy się rzekł do niej: Kobieto, gdzież oni są? Nikt cię nie potępił? A ona odrzekła: Nikt, Panie! Rzekł do niej Jezus: I Ja ciebie nie potępiam. - Idź, a od tej chwili już nie grzesz."
"Od góry Hor szli Izraelici w kierunku Morza Czerwonego, aby obejść ziemię Edom; podczas drogi jednak lud stracił cierpliwość. I zaczęli mówić przeciw Bogu i Mojżeszowi: Czemu wyprowadziliście nas z Egiptu, byśmy tu na pustyni pomarli? Nie ma chleba ani wody, a uprzykrzył się nam już ten pokarm mizerny. Zesłał więc Pan na lud węże o jadzie palącym, które kąsały ludzi, tak że wielka liczba Izraelitów zmarła. Przybyli więc ludzie do Mojżesza mówiąc: Zgrzeszyliśmy, szemrząc przeciw Panu i przeciwko tobie. Wstaw się za nami do Pana, aby oddalił od nas węże. I wstawił się Mojżesz za ludem. Wtedy rzekł Pan do Mojżesza: Sporządź węża i umieść go na wysokim palu; wtedy każdy ukąszony, jeśli tylko spojrzy na niego, zostanie przy życiu. Sporządził więc Mojżesz węża miedzianego i umieścił go na wysokim palu. I rzeczywiście, jeśli kogo wąż ukąsił, a ukąszony spojrzał na węża miedzianego, zostawał przy życiu. Wysłuchaj, Panie, mojego wołania Panie, wysłuchaj modlitwę moją, a wołanie moje niech do Ciebie przyjdzie. Nie ukrywaj przede mną swojego oblicza w dniu mego utrapienia. Nakłoń ku mnie Twego ucha, w dniu, w którym Cię wzywam, szybko mnie wysłuchaj!Poganie będą się bali imienia Pana, a Twej chwały wszyscy królowie ziemi, bo Pan odbuduje Syjon i ukaże się w swym majestacie, przychyli się ku modlitwie opuszczonych i nie odrzuci ich modłów.Należy to spisać dla przyszłych pokoleń, lud, który się narodzi, niech wychwala Pana, Bo spojrzał Pan z wysokości swego przybytku, popatrzył z nieba na ziemię, aby usłyszeć jęki uwięzionych, aby skazanych na śmierć uwolnić. Jezus powiedział do faryzeuszów: Ja odchodzę, a wy będziecie Mnie szukać i w grzechu swoim pomrzecie. Tam, gdzie Ja idę, wy pójść nie możecie. Rzekli więc do Niego żydzi: Czyżby miał sam siebie zabić, skoro powiada: Tam, gdzie Ja idę, wy pójść nie możecie? A On rzekł do nich: Wy jesteście z niskości, a Ja jestem z wysoka. Wy jesteście z tego świata, Ja nie jestem z tego świata. Powiedziałem wam, że pomrzecie w grzechach swoich. Tak, jeżeli nie uwierzycie, że Ja jestem, pomrzecie w grzechach swoich. Powiedzieli do Niego: Kimże Ty jesteś? Odpowiedział im Jezus: Przede wszystkim po cóż jeszcze do was mówię? Wiele mam o was do powiedzenia i do sądzenia. Ale Ten, który Mnie posłał jest prawdziwy, a Ja mówię wobec świata to, co usłyszałem od Niego. A oni nie pojęli, że im mówił o Ojcu. Rzekł więc do nich Jezus: Gdy wywyższycie Syna Człowieczego, wtedy poznacie, że Ja jestem i że Ja nic od siebie nie czynię, ale że to mówię, czego Mnie Ojciec nauczył. A Ten, który Mnie posłał, jest ze Mną: nie pozostawił Mnie samego, bo Ja zawsze czynię to, co się Jemu podoba. Kiedy to mówił, wielu uwierzyło w Niego."
Abram padł na oblicze, a Bóg tak do niego mówił: Oto moje przymierze z tobą: staniesz się ojcem mnóstwa narodów. Nie będziesz więc odtąd nazywał się Abram, lecz imię twoje będzie Abraham, bo uczynię ciebie ojcem mnóstwa narodów. Sprawię, że będziesz niezmiernie płodny, tak że staniesz się ojcem narodów i pochodzić będą od ciebie królowie. Przymierze moje, które zawieram pomiędzy Mną a tobą oraz twoim potomstwem, będzie trwało z pokolenia w pokolenie jako przymierze wieczne, abym był Bogiem twoim, a potem twego potomstwa. I oddaję tobie i twym przyszłym potomkom kraj, w którym przebywasz, cały kraj Kanaan, jako własność na wieki, i będę ich Bogiem. Potem Bóg rzekł do Abrahama: Ty zaś, a po tobie twoje potomstwo przez wszystkie pokolenia, zachowujcie przymierze ze Mną. Pan Bóg pamięta o przymierzu swoim Rozmyślajcie o Panu i Jego potędze, zawsze szukajcie Jego oblicza. Pamiętajcie o cudach, które On uczynił, o Jego znakach, o wyrokach ust Jego.Potomkowie Abrahama, słudzy Jego, synowie Jakuba, Jego wybrańcy. On, Pan, jest naszym Bogiem, Jego wyroki obejmują świat cały.Na wieki On pamięta o swoim przymierzu, obietnicy danej tysiącu pokoleń, o przymierzu, które zawarł z Abrahamem, przysiędze danej Izaakowi. Jezus powiedział do żydów: Zaprawdę, zaprawdę, powiadam wam: Jeśli kto zachowa moją naukę, nie zazna śmierci na wieki. Rzekli do Niego żydzi: Teraz wiemy, że jesteś opętany. Abraham umarł i prorocy - a Ty mówisz: Jeśli kto zachowa moją naukę, ten śmierci nie zazna na wieki. Czy Ty jesteś większy od ojca naszego Abrahama, który przecież umarł? I prorocy pomarli. Kim Ty siebie czynisz? Odpowiedział Jezus: Jeżeli Ja sam siebie otaczam chwałą, chwała moja jest niczym. Ale jest Ojciec mój, który Mnie chwałą otacza, o którym wy mówicie: Jest naszym Bogiem, ale wy Go nie znacie. Ja Go jednak znam. Gdybym powiedział, że Go nie znam, byłbym podobnie jak wy - kłamcą. Ale Ja Go znam i słowa Jego zachowuję. Abraham, ojciec wasz, rozradował się z tego, że ujrzał mój dzień - ujrzał /go/ i ucieszył się. Na to rzekli do Niego żydzi: Pięćdziesięciu lat jeszcze nie masz, a Abrahama widziałeś? Rzekł do nich Jezus: Zaprawdę, zaprawdę, powiadam wam: Zanim Abraham stał się, Ja jestem. Porwali więc kamienie, aby je rzucić na Niego. Jezus jednak ukrył się i wyszedł ze świątyni.
